job_title,company,location,job_summary,post_date,more_info,salary,job_url
Mobile App Developer Flutter (m/w/d),Magicline GmbH,Hamburg,"

Du willst in einem agilen und schnelllebigen Team in der FitTech-Branche etwas bewegen? Wie wäre es mit einer Mentalität, die deine Meinungen und Ideen schätzt? Wenn du zusammen mit einem gleichgesinnten Team an unserer innovativen MySports-App mit modernsten Technologien entwickeln möchtest, dann bist du bei uns genau richtig. Sei ein Teil der digitalen Transformation der Fitnessbranche.
 DEINE POSITION IN UNSEREM TEAM

Entwickle als Teil eines crossfunktionalen Teams an unserer hochskalierbaren mobilen App “MySports”
Setze neue Maßstäbe für moderne Softwareentwicklung und nutze die Bandbreite unseres state-of-the-art Tech-Stacks (u.a. Flutter, Bloc, Dart und Git)
Arbeite eng mit dem Produktmanagement und dem UX/UI-Design zusammen
Baue nachhaltigen und qualitativ hochwertigen Code und runde deine Arbeit mit Softwaretests (Unit, Integration, E2E) ab
Bringe deine Ideen in einem internationalen und multikulturellen Umfeld ein und werde Teil des Erfolgs  



Was du MITBRINGST

Mindestens 5 Jahre relevante Berufserfahrung in der Konzeption und Entwicklung von mobilen Apps und mindestens 3 Jahre davon mit Flutter
Kenntnisse mit Flutter Bloc, Android native, IOS native, Firebase, AppStore oder PlayStore sind von Vorteil
Idealerweise bringst Du Knowhow in der Entwicklung und im Betrieb von skalierbaren Anwendungen mit
Erfahrungen im Umgang mit Softwaretests (Unit, Integration, E2E) und die Überzeugung, dass dies ein wichtiger Bestandteil der Entwicklung ist
Interesse an neuen Trends in der Programmierung und guter Teamarbeit in einem internationalen und multikulturellen Umfeld sowie sichere Kommunikation auf Englisch



DEINE VORTEILE BEI UNS

Einen attraktiven Arbeitsplatz im Herzen von Hamburg und flexible Gestaltung von Arbeitszeit und -ort
Ein eigenes Fitnessstudio zur kostenlosen Nutzung, inklusive Personal Trainer und Physiotherapeut für alle Mitarbeiter
Unser eigenes CashBack Sportprogramm ""MySports"", mit dem wir deine sportlichen Aktivitäten bezuschussen
Hohe Eigenverantwortung, schnelle Verantwortungsübernahme und Leads, die mit dir auf Augenhöhe kommunizieren
Versorgung mit Getränken, frischem Obst und Zwischenmahlzeiten
Ein attraktiver BAV-Zuschuss sowie HVV-Vergünstigungen
Flache Hierarchien und ein motiviertes und dynamisches Team



Wer wir sind
 Als Sport Alliance erleichtern wir Menschen den Zugang zu Sport, in dem wir die Fitnessbranche digitalisieren. Dabei setzen wir als Marktführer auf neueste Technologien und State-of-the-Art-Methoden, um eine cloudbasierte Plattform zu schaffen, die alle relevanten Geschäftsprozesse von Einzelunternehmen bis zu internationalen Fitnessketten abbilden kann. Darauf aufbauend haben wir ein einzigartiges Ökosystem aus innovativen Produkten und Dienstleistungen in den Bereichen Fintech, Beschaffung und Lead-Generierung geschaffen.  Der stetig wachsende Sport Alliance Unternehmensverbund besteht aus Magicline, Finion Capital, Finion FairPay, MySports and bedarf.de. In unseren Büros in Mainz, Eisenstadt, Krakau, Hamburg, Krefeld und Köln arbeiten inzwischen mehr als 350 Kolleginnen und Kollegen an immer neuen Ideen und Lösungen, um die Branche in die Zukunft zu führen. Die Sport Alliance ist überall zu Hause. Mit unserer flexiblen Arbeitsplatzgestaltung erobern wir den ganzen Globus.


Klingt gut?
 Dann werde Teil unseres Teams und bewirb dich gleich online bei uns. Wenn du Fragen hast, schicke gerne eine Mail an jobs@sportalliance.com.  Aus aktuellem Anlass: Um dich und uns zu schützen, finden unsere Job-Interviews im ersten Schritt derzeit ausschließlich telefonisch oder per Videotelefonie statt. Wir sind auch in diesen besonderen Zeiten für dich da und freuen uns darauf, dich kennenzulernen.

",PostedVor > 30 Tagen geschaltet,,,https://www.indeed.com/rc/clk?jk=4507c409b0272a8f&fccid=4297799019f828b8&vjs=3
Junior Developer Java (m|f|d),C3 Creative Code and Content,Berlin+4 Orte,"Zur Verstärkung unseres dynamischen und hochmotivierten Teams in Berlin/Hamburg/München suchen wir ab sofort eine: n
Junior Developer Java (m|f|d)
DEINE BENEFITS:

30 Tage Urlaub und viele Weiterbildungsangebote
Möglichkeit zum mobilen Arbeiten bei flexiblen Arbeitszeiten
Eine Fülle an Corporate Benefits wie betriebliche AV und Mitarbeiterrabatte wie Vergünstigungen auf kulturelle Veranstaltungen und Gutscheine in Online-Shops
Sportangebote u.a. Pilates und Vergünstigungen bei diversen Fitness Studios
Agiles und kollaboratives Arbeitsumfeld, eigenverantwortliches Handeln und faire Bezahlung
Ein abwechslungsreiches Agenturleben, in dem Offenheit und das Streben nach höchster Qualität zur Unternehmenskultur gehören
Eine sehr kollegiale Arbeitsatmosphäre in unseren modernen Büros mit Top-Ausstattung
Selbstverständlich gibt es Kaffee, Tee und Softdrinks sowie frisches Obst, um perfekt in den Tag zu starten

DEINE AUFGABEN UMFASSEN UNTER ANDEREM:

Entwicklung von qualitativ professionell gestalteten CMS-Komponenten, - Modulen und – Applikationen für namenhafte Kunden
Anbindung bestehender WebAPIs an das CMS / Middleware
Entwicklung von RESTful WebAPIs zur Anbindung anderer Kanäle, vorwiegend Mobile APPs

DU BRINGST MIT:

Hochschulstudium im computertechnischen Bereich oder eine ähnlich professionelle Ausbildung
1-2 Jahre Erfahrung im Umgang mit Java-Entwicklungen
Fundierte Erfahrungen in objektorientierter Programmierung mit Java
Fundierte Erfahrungen in HTML, CSS und GIT (Flow)
Sehr gute Kenntnisse im Umgang mit CMS auf MVC-Basis
Fundierte Erfahrungen in der Softwareentwicklung im Team (SCRUM, Jira, Confluence, CI)

ÜBER C3 CREATIVE CODE AND CONTENT:
Creating what matters – C3 Creative Code and Content verschafft Marken und Unternehmen einen relevanten Platz im Leben ihrer Kunden. Mehr als 550 Mitarbeitende an neun europäischen Standorten entwickeln und realisieren Content Marketing-Lösungen, die messbar Wirkung zeigen. Die Agentur kombiniert Kreativität, Content und Technologie und vereint dabei alle Disziplinen für zeitgemäßes Marketing unter einem Dach.
Fast-Track zu C3: Schick uns einfach Deinen CV oder ein Video oder Dein LinkedIn/Xing Profil. Sag uns, wer Du bist, was Du machst und warum wir ganz schnell miteinander sprechen sollten. Wir freuen uns auf Dich.
Art der Stelle: Vollzeit, Festanstellung
Leistungen:

Betriebliche Altersvorsorge
Betriebliche Weiterbildung
Kostenlose Getränke
Mitarbeiter-Rabatt
",PostedVor 17 Tagen geschaltet,Festanstellung +1Montag bis Freitag,,https://www.indeed.com/company/C3-Creative-Code-and-Content/jobs/Junior-Developer-Java-234697038ddc4ae0?fccid=a97346291a6b2a58&vjs=3
Senior Mobile App Developer Flutter (m/f/d),Sport Alliance GmbH,Homeoffice,"Do you like to make a change in the FitTech industry with an agile and fast moving team? How about a mentality that values your opinions and ideas? If you want to join a like-minded team to develop our innovative MySports app based on state-of-the-art technologies, then you are exactly right with us. Be a part of the digital transformation of the fitness industry. 

 Tasks 



Develop as part of a cross-functional team on our highly scalable mobile app ""MySports""
Set new standards for modern software development and use the breadth of our state-of-the-art tech stack (including Flutter, Bloc, Dart and Git)
Work closely with product management and UX/UI design
Build sustainable and high-quality code and complement your work with software tests (Unit, Integration, E2E)
Contribute your ideas in an international and multicultural environment and become a part of our success
 Requirements 



At least 5 years of relevant professional experience in mobile app design and development, and at least 3 years of that with Flutter
Knowledge with Flutter Bloc, IOS / Android native, Firebase, AppStore or PlayStore are an advantage
Ideally, you bring know-how in the development and operation of scalable applications
Experience in handling software tests (Unit, Integration, E2E) and the conviction that this is an important part of the development
Interest in new programming trends and good teamwork in an international and multicultural environment as well as confident communication in English
 Benefits 



Free choice of work location within large parts of Europe and, if interested, an attractive workplace in the heart of Kraków or Hamburg, as well as flexible arrangement of working hours
Our own fitness studio that can be used free of charge, including a personal trainer and a physiotherapist for all colleagues (only for Hamburg)
Our own CashBack sports programme ""MySports"", which we use to subsidize your sports activities
High level of personal responsibility, quick assumption of responsibility and leads who communicate with you at eye level
Supply of drinks, fresh fruit and snacks
An attractive company pension (only for Germany) and subsidized public transport (only for Hamburg)
Flat hierarchies and a motivated and dynamic team
 SOUNDS GOOD? 

 Then become a part of our team and apply now online. If you have any questions, then feel free to send a mail. 


Due to recent events: In order to protect you and us, our job interviews in the first step are currently only conducted by phone or video phone. We are also there for you in these special times and look forward to getting to know you.",PostedVor 9 Tagen geschaltet,Vollzeit,,https://www.indeed.com/rc/clk?jk=13b41512b788adeb&fccid=a5d5ff01a1b7ec03&vjs=3
Organization Developer (m/f/d) 80% Homeoffice,Arvato infoscore GmbH,Homeoffice in Baden-Baden+2 Orte,"

Rätsel gelöst? Als Berufserfahrener (m/w/d) bist Du hier Entdecker_in und Wegbereiter_in zugleich und bringst Deine ganze Erfahrung in ein global erfolgreiches Unternehmen mit spannenden Herausforderungen ein.


Wir suchen zum nächstmöglichen Zeitpunkt eine_n
Organisationsentwickler (m/w/d)
(unbefristet) in Vollzeit am Standort in Verl, Baden Baden, Berlin, Stockholm oder Amsterdam / im Mobile Office (bis zu 80%)


Das erwartet Dich:

Du wirkst maßgeblich an unserer Vision „become the most human-centric Fintech“ mit und gestaltest mit Konzepten und Projekten die Transformation unserer zunehmend selbstgesteuerten Organisation und Kultur.
Du bist für die Neuausrichtung der globalen Talentstrategie und des Talentidentifikationsprozesses sowie des Karriererahmens und des Skill- und Kompetenzmanagements verantwortlich.
Du begleitest das People & Culture Team bei deren Transformation Journey und Umsetzung der Employee Experience Strategie.
Du vermittelst agile Methodenkompetenzen, Wissen und Praxistipps in Form von Trainings, Workshops und Coachings.



Das bringst Du mit:

Du bringst mehrere Jahre Berufserfahrung und fundierte Fachkenntnisse im Talentmanagement, insbesondere Skill- und Komeptenzmanagement sowie in den Themen um agile und digitale Transformation mit.
Du besitzt Erfahrung im Umgang mit agilen Methoden, Planungs- und Entscheidungstechniken sowie in der Erstellung von Transformationsarchitekturen.
Du überzeugst mit Deiner strukturierten und selbständigen Arbeitsweise. Moderationsfähigkeit, Kreativität und analytisch-konzeptionelles Denkvermögen sowie eine hohe soziale Kompetenz runden Dein Profil ab.
Du bringst Erfahrungen im Projektmanagement (agil, hybrid, klassisch) mit.
Idealerweise hast Du bereits Weiterbildungen und Qualifikationen aus relevanten Kompetenzbereichen und Frameworks, Methoden und Tools besucht bzw. abgeschlossen.
Du verfügst über sehr gute Kommunikations- und Präsentationsfähigkeiten in englischer und deutscher Sprache



Wir bieten Dir:

Flexibilität, die begeistert: Damit Privates nicht zu kurz kommt, unterstützen wir mit einer flexiblen Arbeitszeitgestaltung, 30 Urlaubstagen im Jahr und bei der Familienbetreuung.
Benefits, die wertschätzen: Unsere Mitarbeitenden erfreuen sich an leistungsbezogenen Prämien, Urlaubs- und Weihnachtsgeld, vermögenswirksamen Leistungen und einer Erfolgsbeteiligung. 
Wohlfühlfaktor, der verbindet: Wir veranstalten jährlich ausgefallene Weihnachtsfeiern, Sommerfeste und After-Work-Partys für unsere Mitarbeitenden.
Angebote, die selbstverständlich sind: Unsere Mitarbeitenden erhalten subventionierte Essensangebote und bedienen sich an kostenlosen Obstkörben und Wasserspendern.
Weiterbildung, die begeistert: Mit der Bertelsmann University, über 4.000 E-Learning- und Trainingsangeboten und einem internationalen Talent Management fördern wir die Karriereentwicklung.
Sportangebote, die fit halten: Neben Sportkursen, Firmenläufen und Firmenfahrrädern erhalten Mitarbeitende Rabatte für Fitnessstudios in der Umgebung.
Leistungen, die absichern: Durch unsere betriebliche Altersvorsorge, den Betriebssozialdienst und eigene Betriebsärzte sorgen wir für die Gesundheit und Absicherung unserer Mitarbeitenden.
Rabatte, die überzeugen: Unsere Mitarbeitenden profitieren von großzügigen Mitarbeiterrabatten und weiteren Vergünstigungen bei Partnerunternehmen.
Respekt, der verbindet: Wir stehen für Vielfalt im Unternehmen - und das in jeder Hinsicht.


Das sind wir:
Mal ehrlich: Finanzthemen sind kompliziert. Darum sind wir bei Arvato Financial Solutions stolz darauf, sowohl international agierende als auch renommierte, lokale Unternehmen durch die komplexe Welt der Zahlungsströme zu steuern. Ganz gleich ob unsere Kunden im E-Commerce Schuhe verkaufen oder Telekommunikationsdienstleistungen anbieten, unsere Dienstleistungen sichern effizientes Credit Management für bestmögliche finanzielle Performance. Dazu lösen unsere rund 7.000 Mitarbeitende täglich neue Herausforderungen im Zahlungsverkehr und komplexe Datenrätsel – clever, analytisch und mit Blick für jedes Detail – denn das ist unsere DNA. Wir suchen Kolleg_innen, die Lust haben mitzugestalten und genau hinzuschauen - egal ob Berufseinsteigende, IT-Expert_innen, Data Analyst_innen, Sachbearbeiter_innen, Führungskräfte oder Quereinsteigende. Und dank unserer Präsenz in rund 20 Ländern mit Fokus auf Europa und Amerika ist ein passender Job zumeist in der Nähe. Innovate yourself.


Wir halten was wir versprechen:

Mehr Informationen unter www.arvatokarriere.de. 
Du bist schon überzeugt? Dann freuen wir uns auf Deine Online-Bewerbung mit Lebenslauf, Angaben zu Gehaltsvorstellung und frühestmöglichem Eintrittsdatum. Besonders freuen wir uns auf Bewerbungen von Kandidat_innen, die zur Vielfalt unseres Unternehmens beitragen. Vielfalt beziehen wir insbesondere auf die Dimensionen kulturelle oder soziale Herkunft, Religion, Alter, Behinderung, Geschlecht und sexuelle Identität.


Unternehmen: Arvato infoscore GmbH
Land: Deutschland
Region: Nordrhein-Westfalen
Stadt: Verl, Baden Baden, Berlin, Stockholm oder Amsterdam
Postleitzahl: 33508
Job ID: 230490
",PostedVor 19 Tagen geschaltet,Festanstellung +1,,https://www.indeed.com/pagead/clk?mo=r&ad=-6NYlbfkN0AQ3q6hdNRVltHcnBkMGn_sf3sMkkjlG5x9bDzaF0WbiIc7JDWnH8RDBBTS7AT8CDw2Gvura5BeqVfBxARuOQ7qS2gu_slDAjDWgx2l_QLy9lpC6d4e4thWttp-1nPIItBab6PQIrgXi6l34xsS0yJrHaqTFW235cXEOrz3vk3SEb_5r2XHDsQWEB_rLx5oWGR9lecmgEfOnIbCNlAmYcFC1H8NxnYo2rfJavDSulgSUhl3xcdR7w9RjAz1iksIFg3QULPhYwwnxiNL5uE21d3lhq7OJ4zGbHAiMju4hpHbc2x4v7xkcqzDU3Znz9QXs7oh7Eql-R_kXpujMFo4fgvUWWjr0tqDSAfTXAZQWcx3075Z9Nou0AFBjKt4-sVORHQ-Of5NaYAPCSu5ro5PncnfIZPGmUcwx8H-wjlAd9NENhjK87N7s-S3fvtIGGcgiEARewFnXB5CwrUWVPX3q4RXHkrumFQXoo4ahZ_8HuqxLFSRy50PKkiO-dVmwHs3TFKY-iy774xXNYxN4-mv9CE4yJf-thZCo7P-dXhwSm2e1-WQhk7Jm46WGkkzqDWohH8If9SGTwB3kCUi1UDNumCnSjYsf6Z9gW-hstdYq8qyzhJbnSOMHZi97NgS7qhHG96yRMwM1GVfcabm4O1gnoFY&xkcb=SoDq-_M3ZCumA0xr1J0JbzkdCdPP&p=9&fvj=1&vjs=3
Frontend Developer (m/f/x) / Berlin or remote,Pepper Media Holding GmbH,Homeoffice in 10115 Berlin,"About Pepper: At Pepper.com we believe people should be influenced by expert opinions and not by marketing strategies. We want people to find the right product that fits not only their budget, but also their needs. We all have this friend that we call if we need shopping advice and in the online world that is Pepper.com. Our mission is to achieve exactly that, by giving the reach and voice to people like you and me who are passionate about deals and are willing to share their expertise with our communities around the world. We are building the best place for consumers to share their knowledge and learn from other experts to make the best decisions.
*And we need you to achieve that! Someone who shares our values and is just as passionate as we are about helping over 25 million people every month to make better purchase decisions.*
We hire in our 6 beautiful offices around the world (Berlin, Lyon, London, Winnipeg, Belo Horizonte, Mumbai), but offer nearly all positions also remote.
*Join one of the best employers in Berlin according to all professional social networks: 5/5 on Indeed, 4.8/5 on Glassdoor, 4,4/5 on Kununu, and 4.9/5 on Stepstone.*
Your profile: We are looking for an experienced and passionate Frontend Developer to join our team in Berlin. You will play a central role in crafting high quality and elegant code for our communities around the world. You will build the frontend systems that power our fast-growing business, and continuously improve our engineering practices. Above all, your work will contribute towards creating a more attractive, helpful, and fashionable community for everyone!
Your responsibilities would include: 

Plan web components together with designers, product managers and backend engineers
Implement reusable and solid responsive frontend components
Identify and fix performance and maintenance problems
Ongoing improvement of our frontend infrastructure
Stay up to date with new frontend technologies and best-practices, and share them with the team

The qualities we are looking for: 

At least 3 years working experience as a full-time Frontend Developer
Extensive cross-browser CSS and JavaScript knowledge
Experience with mobile-first development and responsive layouts
Experience with CSS preprocessors (we use Sass)
Experience with VM libraries (we use Vue.js)
Ability to write/architect reusable and maintainable code
Working knowledge of what makes a good User Experience
Good English language skills

Bonus points for knowing/using any of the following: 

Experience with CSS methodologies (we use BEM)
Experience with component libraries/design systems
Experience with writing JavaScript unit tests
Experience with build tools (we use webpack)
Experience with typescript

Some perks of working for Pepper.com are: 

Flexible working hours, cozy and relaxed working atmosphere


Relocation assistance to move to Berlin and visa application support
International and professional team of motivated people
An agile team in implementing complex/innovative features
Professional development opportunities, incl. Training and further education
“Hack” days for learning new technologies and skills
5 Personal Development days
Employee Assistance Program


Great office in Torstraße, right at the city centre and easily reachable from any part of Berlin
The possibility to work fully remotely if you live in Europe (including Turkey)

Are you the person we are looking for?We're looking forward to receiving your application including your motivation letter and your CV.
*Data protection policy*The protection of your data is very important to us. Here you will find all the details of our privacy policy for applicants.
Job Type: Full-time",PostedGerade geschaltet,Vollzeit,,https://www.indeed.com/rc/clk?jk=cae6ccba94d32c7f&fccid=2483be466bfae1f9&vjs=3
Flutter Mobile Developer (m/w/d) in Stuttgarter Technologie...,Flip App,Stuttgart,"Flutter Mobile Developer (m/w/d) in Stuttgarter Technologie Start-up, ab sofort
Empowering every employee.Our mission is to be the world's most used employee app by changing the way frontline employees work.
StellenbeschreibungDu willst mit viel Eigenverantwortung und in Zusammenarbeit mit einem starken Team eine App bauen und entwickeln, die das Arbeitsleben von Millionen von Menschen nachhaltig verbessert? Als Teil unseres Entwicklungsteams arbeitest du daran, unsere App Cross-Platform mit Dart & Flutter weiterzuentwickeln. Du hast Spaß an modernsten Technologien und liebst es, bei der Lösung anspruchsvoller Aufgaben mit Kreativität und Biss über das Ziel hinauszuschießen? Dann bist du bei uns genau richtig!Das erwartet dich bei unsDu …

unterstützt auf Basis von Flutter/Dart die Entwicklung moderner, plattformübergreifender Anwendungen für Android und iOS
stellst die Code-Qualität durch Code Review, Pair Programming und Tests sicher
hast das Engagement, durch Feedback und Retrospektiven unseren Entwicklungsprozess im Team mitzugestalten und weiterzuentwickeln
coachst weniger erfahrene Kollegen und lässt dich von erfahreneren Mitarbeitern coachen

QualifikationenDas bringst du mit

Mindestens 3 Jahre praktische Erfahrung mit Flutter/Dart
Erfahrung mit Flutter-Design-Patterns (z.B. BloC, Material, Hive, SQlite o.ä.)
Berührungspunkte mit Typescript/ Swift/ Kotlin
Du schreibst gut testbaren und getesteten Code
Interesse sich selbst und das (Entwickler-)Team weiterzuentwickeln
Ausgeprägte Ownership für deine Themen
Sehr gute Deutsch- und Englischkenntnisse in Wort und Schrift

Nice-To-Have

Frontend (Typescript/Angular)
Webentwicklung

Good-To-Know

Wir fördern deine kreative Ideen, neue Wege und deine Weiterbildung; Der Mastery Day ist ein Tag im Sprint, an dem du eigene Visionen umsetzen oder deine Skills verbessern kannst
Hardware: Freie Hardwarewahl nach deinen Wünschen, wir empfehlen ein 16"" MacBook Pro M1 MAX 32GB RAM oder ein Thinkpad T14s mit Ryzen und Linux

Lass dich von unseren Mitarbeitern überzeugen: https://www.kununu.com/de/flip-app/kommentareDu hast noch Fragen? Schreib einfach unserem Head of Development Lukas Mader* auf LinkedIn*. Er freut sich immer von dir zu hören!Du kennst noch jemanden der Interesse haben könnte? Bewerbt euch beide und werdet gemeinsam zu neuen Flipstars!#Flutter #Dart #PWA #Git #GitLab #YouTrack #HomeOffice #Remote #Developer #RemoteDeveloper #Entwickler #Scrum #Agile #Sprint #Stuttgart #StartUpUnser Stack: https://stackshare.io/flip-app/flip-app-frontend
Zusätzliche InformationenDas bieten wir dir....

Home Office Friendly:  Entscheide selbst jeden Tag, wo du arbeiten möchtest
Modernes City-Büro mitten in Stuttgart mit idealer Anbindung und kostenlos nutzbaren Massage Stühlen
Work-Life-Balance:  Wir wollen nicht, dass Du an Deinem Schreibtischstuhl festwächst und übernehmen deshalb u.a. die Kosten für Deine Qualitrain- Mitgliedschaft, ermöglichen Dir den Kauf eines Job-Rads oder bieten ein monatliches Massageangebot im Office an
Erfolge feiern:  Dich erwarten hoch motivierte und engagierte Menschen in einer lockeren Arbeitsatmosphäre.
Mittendrin statt nur dabei:  Du gestaltest Flip aktiv mit. Ganz nebenbei bist Du Enabler des rasanten Wachstumsprozesses eines jungen Tech-Unternehmens und wächst an Deinen Zielen. Gute Laune garantiert
Happy to be a Flipster:  Freu Dich auf regelmäßige Teamevents, Buddy Lunches und Culture Days, die uns als Flipster zusammenschweißen
Arbeiten im Ausland: Bei Flip kannst Du auch im europäischen Ausland arbeiten. Lass uns im Interview über remote work sprechen.

Wir sind stolz, unseren nächsten Meilenstein in der Flip Geschichte verkünden und feiern zu dürfen - unser $30 Mio Series A-Funding! Hier* gehts zum TechCrunch Artikel und *hier* zum Handelsblatt Artikel.*
Damit unsere Stellenanzeigen leichter lesbar sind, verwenden wird im Textverlauf die männliche Form der Anrede. Bei Flip sind alle willkommen - ganz egal, welches Geschlecht du hast oder wie alt du bist. Sexuelle Identität, Herkunft, Religion, Weltanschauung und Behinderungen spielen keine Rolle. Das wichtigste ist, dass DU zu uns passt!
Art der Stelle: Vollzeit",PostedVor > 30 Tagen geschaltet,Vollzeit,,https://www.indeed.com/company/Flip-App/jobs/Flutter-Mobile-Developer-Stuttgarter-Technologie-Start-04082d11dc3edc3c?fccid=a73c8830acbc4df8&vjs=3
