job_title,company,location,job_summary,post_date,more_info,salary,job_url
"Frontend Developer (m/w/d), Vollzeit, unbefristet",BO1 Agentur für Handelsmarketing GmbH für BabyOne,48155 Münster+1 Ort,"Wir bei BabyOne verkaufen fast alles, was man für Babys und Kleinkinder braucht, und geben unser Bestes, um jungen Familien Sicherheit in einer unsicheren Zeit zu bieten. Trotz der Krise werden zum Glück weiterhin Kinder geboren! Und darum wachsen wir auch weiter. Mit über 100 Standorten in der DACH-Region sind wir Marktführer. Als inhabergeführtes Familienunternehmen sind wir überzeugt von der Zukunft des Handels und sind da, wo unsere Kunden sind, ob offline oder online.
Du hast Lust, uns bei unserer Mission zu unterstützen, indem du innovativ und mit technischem Know-How die Omnichannel-Strategie bei BabyOne voran treibst? Du möchtest in Sachen Digitalisierung nicht nur mitziehen, sondern vorangehen? Als Frontend Developer entwickelst du unseren Onlineshop state-of-the-art weiter und und schaffst gemeinsam mit deinen KollegInnen aus den Bereichen UX und Backend das beste Shopping-Erlebnis für diejenigen, denen etwas ganz Großes bevorsteht: Neues Leben.
Das wünschen wir uns: 

Du entwickelst unseren Onlineshop weiter mit Schwerpunkt auf HTML, CSS und Javascript


Dabei bist du in den gesamten Entwicklungsprozesses einbezogen - von der Analyse der Anforderungen über Implementierung bis hin zum Rollout


Du arbeitest eng mit deinen KollegInnen aus den Bereichen UX und Backend zusammen und weißt sie an den richtigen Stellen proaktiv einzubinden


Du treibst die Modularisierung des Frontends voran (Bootstrap und Twig) und berätst das Team zu Responsive Design, Accessibilty und Mobile First


Du sicherst die Qualität durch Code Reviews sowie durch die Integration und Auslieferung über Jenkins und Git und stetige Dokumentation


Du bist neugierig und entdeckst neue, vielversprechende Handlungsfelder und Technologien und bringst dich bei Themen wie Frontend-Architektur und Code Design ein


Auch die Zusammenarbeit und Koordination von externen Dienstleistern gehört zu deinen Aufgaben

Das bringst du mit: 

Du bringst mind. 2 Jahre Erfahrung im Bereich Frontend-Entwicklung mit, gern im Bereich eCommerce


Dein Schwerpunkt liegt auf HTML, CSS und Javascript


Du hast eine Ausbildung oder ein Studium im IT-Bereich erfolgreich abgeschlossen oder kannst vergleichbare Erfahrung nachweisen


Du bist bestens vertraut mit den Themen Mobile First, Webstandards und Responsive Webdesign. Außerdem bringst du Erfahrung in der Erstellung von Progressive Web Apps mit


Außerdem kannst du auch die Bereiche Test-Driven-Developement und Accessibilty bedienen


Tools wie GitLab (CI), Jenkins, webpack und PostCSS, Framework Bootstrap und der Template-Engine Twig sind dir nicht fremd


Du hast Spaß an neuen Herausforderungen und gestaltest Veränderungen begeistert mit


Du bringst eine analytische und strukturierte Arbeitsweise mit und arbeitest gern im Team mit den unterschiedlichsten KollegInnen


Mit deiner Hands-On-Mentalität, Neugier und ganz viel Lernbereitschaft begeisterst du deine Kolleginnen und Kollegen


Idealerweise hast du schon Erfahrung in der Anwendung agiler Methoden gesammelt

Das findest du bei uns: 
Wir sind kein Konzern, sondern ein familiengeführtes Franchise-Unternehmen, das neben langjähriger erfolgreicher Arbeit im Babyfachhandel auch soziale Verantwortung übernimmt. Unser Miteinander ist uns wichtig. Darum geben wir dir auch die Chance, deine direkten KollegInnen vor Vertragsunterzeichnung kennenzulernen. In unserer Zentrale in Münster arbeiten mehr als 100 tolle KollegInnen. Wir duzen uns und kleiden uns so, wie wir uns wohlfühlen. Es gibt flache Hierarchien und kurze, offene Kommunikationswege, viel Raum für eigenständige und verantwortungsvolle Entscheidungen und eigene Ideen. Flexible Arbeitszeiten und 30 Tage Urlaub ermöglichen auch noch genug Zeit für Hobbies und Privates. Und was gibt es noch? JobRad als Leasingangebot, Kaffee, Tee und wöchentliche Obstlieferungen, einen Kicker- und Billardtisch, viele Events und Aktivitäten, einen großen Co-Working Space und kostenfreie Parkplätze direkt vor der Tür (natürlich auch für Fahrräder). Bei uns bist du Teil einer Welt, in der die kleinen Menschen im Mittelpunkt stehen.
Das alles passt zu dir?
Dann freuen wir uns auf deine Bewerbung – Wir verzichten bewusst auf das Anschreiben. Schicke uns einfach deinen CV zu.
Art der Stelle: Vollzeit
Arbeitszeiten:

8-Stunden-Schicht
",Postedvor 30+ Tagen,Festanstellung +18-Stunden-Schicht,,https://www.indeed.com/pagead/clk?mo=r&ad=-6NYlbfkN0Du32PCEozxdxxGgvMRgzirzuPW9UKG4Mvadb-eofFhwpid_1oqkFUvJVnUZT9X5ncAlDvNWUJsuK-BjZVmrJDqzefyPJkhiOphBWRczmNRsa6Bnb6_yNQpQsgLQZn6_UuHLt3OFYaR0SaVccZmociIJ96rC7lDCuzmGxlSo_p8Bk_juxdum6BmU_21R9MrhuCfRksCGSp4ptIug9woZfHjzACcPvRm5up9LICluIKgjLHR7t499jqbCPNUsqVIoqLLK9GBwsAIZ7ckoRPc4yj6DbaYuxfTE9HBiI2Ks080DOjz7ZILDfnhmbbvln7ULr3Mdud7xNhpT9vLWtDHQI-e2bn1MFYCwWxONdCDRihCjRuaISZBp0uZx_9JC5U7XxtnS9W1_e3pNWfKYeMtKJKOF3abhTm5ZEQtCNaJC6ofXbIA98WSoL-SrPfbdhUIfn2ubBMJ2dD8FaHDDOxa7Z7U7fcX1bCFlbYEEv_cHeh5ALzGE20sXsDNNgKbJTZlG54=&xkcb=SoCS-_M3ZCuowUQFjp0LbzkdCdPP&p=0&fvj=1&vjs=3
Mobile Developer,Würth Cloud Services,Homeoffice in Berlin,"Würth Cloud Services - We create the digital tools and connections for the craftsmen who build our worldAs a recently founded corporate startup, Würth Cloud Services strengthens the 75-year success story of Würth. We support the digitization of craft businesses with various cloud solutions that are connected to each other.
Working in flat hierarchies, characterized by an exceptional team spirit and forward-looking projects - that's what you'll find!
If you want to be part of exploring new paths and taking the digitization of the crafts sector to the next level, then we look forward to getting to know you.
Mobile Developer (Berlin)
(m/f/d)
Your tasks

You design and implement exciting new mobile applications
In cooperation with our product management team, you will integrate mobile solutions into our craftsmen platform
You will support the development of our new cloud solutions for craftsmen and craftswomen
Together with the team, you are responsible for a scalable software architecture for our mobile applications and web-based systems.

Your profile

Preferably you have a master's degree in computer science or business informatics and several years of professional experience
You are passionate about and enjoy developing mobile applications with Flutter and have basic knowledge of web development
We definitely need your experience in the following technologies:

o Flutter on the Android and iOS platforms
o JavaScript, TypeScript are desirable
o GraphQL, REST APIs

Perhaps you have also worked in backend development and are familiar with, for example, Spring Boot / Kotlin, Node.js and databases such as Cassandra, MariaDB or event sourcing databases such as EventStore
You are used to working independently and agilely according to Scrum
You can communicate very well in English

Our promise to you

As a modern employer, we guarantee you a family-friendly level of flexibility, e.g. home office (50%).
Teamwork is not something to be forgotten - you will have the opportunity to work with highly qualified colleagues and to learn from each other.
Modern equipment enables you to achieve maximum success in our projects - which we like to celebrate as a team.
Our stylish office in Berlin Xberg located directly at the river “Spree” with access to the water is also worth mentioning.
To ensure that our employees have a chance to relax, we offer 30 days of vacation.
Employee discounts in the Würth Online Shop, company participation in the BVG ticket as well as the fitness studios of qualitrain and, of course, the best coffee in Berlin are additional benefits.

Art der Stelle: Vollzeit
Arbeitszeiten:

Montag bis Freitag

Flexible Sprachanforderungen:

Keine Deutschkenntnisse erforderlich

Leistungen:

Flexible Arbeitszeiten
Gleitzeit
Homeoffice
Mentoring-Programm für Mitarbeiter
Mitarbeiter-Rabatt
Preisnachlässe auf Produkte/Dienstleistungen des Unternehmens
",EmployerVor 2 Tagen aktiv,VollzeitMontag bis Freitag,,https://www.indeed.com/company/W%C3%BCrth-Cloud-Services/jobs/Mobile-Developer-4f94a66919950b1b?fccid=69b878cb05384dd1&vjs=3
Integration Developer (m/w/d),GHD GesundHeits GmbH Deutschland,Homeoffice in 22926 Ahrensburg+1 Ort,"Homecare bedeutet für die GHD GesundHeits GmbH Deutschland: Dienstleistungen für die Genesung zu erbringen, die über das Produkt hinaus gehen, denn bei uns steht der Mensch im Mittelpunkt. Seit fast 30 Jahren sind wir als marktführender Versorger deutschlandweit in den Bereichen Hilfs, Reha- und Arzneimittel tätig. Wir bedienen mit unseren regionalen Niederlassungen jede Versorgungsanforderung.
Wir verstehen uns als Patienten-Kümmerer. Werden Sie Teil des Erfolgs-Teams!
Für unsere Zentrale in Ahrensburg oder Hamburg suchen wir ab sofort einen Integration Developer (m/w/d)
Dein Aufgabenschwerpunkt: 

Umsetzung der Anforderungen und Abwicklung von projektbezogenen Aufgaben
Unterstützung bei der Übersetzung von Anforderungen von Integrationsszenarien in einen Business-Kontext, sowie im Aufbau und der Weiterentwicklung neuer Technologien


Du bist Verantwortlich für die Entwerfung, Implementierung, Bereitstellung, Verwaltung und Steuerung von APIs im globalen Unternehmensumfeld


Beratung fachliche/r Ansprechpartner*innen zu Integrationsfragestellungen des Business Applications Team sowie für den Application Manager


Aufbereitung und Durchführung von Unit Test und Integrationstest
Du verstärkst das bestehende Entwicklerteam im 2nd / 3rd Level Support bei SQL-Datenbank Themen

Dein Profil: 

Du hast ein erfolgreich abgeschlossenes Studium im IT-Bereich oder eine vergleichbare Ausbildung/Qualifikation als z. B. Datenbankentwickler, Data Engineer und bringst mindestens drei Jahre Berufserfahrung mit


Deine bisherigen Projekterfahrungen und Kenntnisse agiler Entwicklungsmethoden sprechen für sich
Sicherer Umgang mit SQL-Datenbanken (vorzugsweise MS SQL), Mulesoft Certified Developer wäre ein Vorteil


Du besitzt Kenntnisse in den gängigen Integrationstechnologien (HTTP, JMS, JDBC REST, SOAP) sowie in API Management Tools


Eine Leidenschaft in objektorientierten und funktionalen Programmiersprachen, vorzugsweise Java & Typescript, sowie Verständnis von Enterprise Integration Patterns

Deine Softskills: 

Team Player Mentalität innerhalb eines agilen Teams
Durch deine analytische und strukturierte Arbeitsweise mit Hands-on-Mentalität kannst du auch komplexe Situationen mit Leichtigkeit bewältigen
Eine hohe Kunden- und Serviceorientierung sowie Planungs- und Problemlösungskompetenz zeichnen dich aus
Fließende Deutsch- und Englischkenntnisse in Wort & Schrift

Das erwartet dich bei uns: 

Hohe Flexibilität & Work-Life-Balance:  Arbeiten soll sich nicht nach Arbeit anfühlen. Damit Privates nicht zu kurz kommt, unterstützen wir Dich mit flexiblen Arbeitszeitmodellen. Wir bieten dir an bis zu 40% im Mobile Office zu arbeiten. Tablet, Notebook und Mobiltelefon(auch zur privaten Nutzung) sind bei uns Standard.
Zeit:  Nichts ist wichtiger als ein umfangreicher Onboarding-Prozess der durch unseren hauseigenen Campus begleitet wird. Deshalb nehmen wir uns die Zeit, dir zu Beginn deiner Reise bei der GHD alle wichtigen Fachbereiche näherzubringen und uns kennenzulernen.


Vielfältige Entwicklungsmöglichkeiten: Wir fördern deine Stärken individuell – wenn du willst und bereit bist für die Challenge! Profitiere von umfangreichen Schulungsangebot über unseren hauseigenen Campus.
Selbstverständliche Angebote: Eine Kostenlose Getränkeversorgung für Deine tägliche Versorgung am Arbeitsplatz. Mitarbeiterrabatte über unser Corporate Benefits Portal, sowieVergünstigungen unserer unternehmenseigenen Produkte (Apotheke, etc.).
Gesundheit:  Unsere betriebliche Altersvorsorge ist mit einem attraktiven Arbeitgeberzuschuss von 20% versehen. Da uns die Gesundheit unserer Mitarbeiter*innen am Herzen liegt, unterstützen wir dies durch interne Veranstaltungen, wie z. B. Laufevents oder durch die Möglichkeit ein Business Bike zu leasen.

Bist du neugierig geworden? Dann möchten wir dich gerne kennenlernen und freuen uns auf deine aussagekräftigen und vollständigen Bewerbungsunterlagen über unser Bewerbermanagementsystem.
GHD GesundHeits GmbH DeutschlandConstanze RachowBogenstraße 28 a22926 Ahrensburg
Bewerberhotline 0800 / 51 67 206
Art der Stelle: Vollzeit
Arbeitszeiten:

Keine Wochenenden
Montag bis Freitag

Leistungen:

Betriebliche Altersvorsorge
Betriebliche Weiterbildung
Empfehlungsprogramm
Firmenhandy
Homeoffice
Kostenlose Getränke
Preisnachlässe auf Produkte/Dienstleistungen des Unternehmens
",Postedvor 30+ Tagen,VollzeitKeine Wochenenden +1,,https://www.indeed.com/pagead/clk?mo=r&ad=-6NYlbfkN0CoV73I6WkF0zvcLpJFIvZVuwp9nKZY6-w01WMYh3h08RfxBi5bbwuhXuevZe38GcIH2nByGpY3UgLHOzf3bdGiuQMnYjYTd75W68Ce6bBNY85SvwFZ_wvf9ALGPc1OAfPKta0GjW45JYlt566m6CbhcH5artgfMkBljws31TcYhUq2-_TG-35jitgr-ZdpzZocs1q2gtMXl0BnbkRzxEhsEBxmlyCn39U_sXAiz1ih5attKoIOykMyA9zsANpbzHC632LsWd6H59bOmBxWn8093zg1nUdxm1frXObggh8Fm1CYybC7qSv7Y82o2e3H2BJe-AHA9Sy6lMbFjIJ6b4mqIW5eLG5SSsrDK-5S9W0tM1ZRpwcR16-vG12dqk0A8Gq-pZwmPwgGFso4klNXe1Okr4kobpy9wtxrsLNOPy71UB-GdEYXH8ZdZ0Iqt5L6WxWjTolIuIJyavpARwbHXbLr5Ev07ZYE-iqeE2NiZT6_zXCShEAh59UDG6LMm66Nn3WHbZPTU_JcoJZHajrJ-42d7EaAGt7WBQQgFp5E2UhYmHGFOjoCmZ13B5alTA7y9CxJJPNqafPV-27N2oKX9mtqShqN7K6yat9XV0NXzWYIanaDWstMhlrL&xkcb=SoC7-_M3ZCuowUQFjp0JbzkdCdPP&p=2&fvj=1&vjs=3
Junior Frontend Developer (M/F/X),KptnCook,Berlin+1 Ort,"At KptnCook, we celebrate food and the fun of enjoying a home-cooked meal.
We are looking for a Frontend developer to join our team in Berlin and make significant contributions to our mission of empowering people to make the best food choices.WHAT'S IN IT FOR YOU

A major impact of helping to shape the cooking and eating habits of millions of people
Flat hierarchies and transparent communication in a highly motivated, friendly team
Varied tasks with a high degree of personal responsibility
Flexible working hours and the possibility for home office
The opportunity to promote professional development through regular check-ins
Free snacks and drinks, after-work BBQs in our backyard, team cooking sessions, team events, table tennis tournaments (currently limited)
Delicious food from our test kitchen
Free BVG Ticket all year around
An annual budget for continuous education in a field that suits you and your role

YOUR ROLE

You develop our website and internal CMS
You work on our voice assist of Google Home and Amazon Alexa
You take care of the implementation and enhancement of tools and algorithms
You're in charge of the maintenance and improvement of our system architecture
You deliver scalable and maintainable solutions

YOUR PROFILE

You have a degree in Computer Science/ Mathematics/ Engineering or working experience in this field
You have at least 2 years of experience with React
Good knowledge of HTML5 and CSS in a professional setup
Good knowledge in interacting with remote API‘s
Nice to have: Experience with Facebook Messenger Bot, Amazon Alexa Skills, Google, Amazon AWS and Google Cloud
Experience with git or similar version control systems, git-flow is a plus
Hands-on attitude, self-driven, analytical mindset combined with a strong interest in technology

No one is perfect. Please send us an email if you can check at least 4 out of the 8 characteristics mentioned! : )
ABOUT KPTNCOOK
After founding the company in 2014, KptnCook became Germany's leading mobile food & shopping app. We won several international awards like the Google Material Design Award 2018 and German Design Award 2020 and help hundreds of thousands of users to become better cooks at home every day. Currently, we are a team of around 45 based in Berlin Neukölln.
HOW DO YOU BECOME A KPTN?
If you’re excited by the idea of joining our crew and feel like your profile & our role expectations match, please apply with your CV, your earliest starting date, and a cover letter that best expresses your interest and unique qualifications.
We are looking forward to hearing from you!
Job Type: Full-time",Postedvor 23 Tagen,Vollzeit,,https://www.indeed.com/pagead/clk?mo=r&ad=-6NYlbfkN0D5Mh_COuFCfOu35uC-RykKo5NlIMQwsh9Z5f7DOjE_fevjFW73zly429x5wOkbS4xZAaXLXQdgQBcKirkYhkRLnRav-wEnijBz0qt-yAor6m5E1Nrc72NR-ejEnP2Wgnu9RG0BCemFYwMt0M93-4YDHHV76sbYYBFiAFM4xT_XkB2aCGBWxtSAckLt-CVH-ZlU0E83PZVQ-D3OIuUEv9mQchhMMN_YcvZ0ZmdcS69ioxLG2HYPUL649rSKT26C0_8glIbJDhlvxlD2uZpjiY0YxxZKojsPdyP1WwKYBIzVgCd_9mtTiWCP_o1VNucH1VkmLUnJztanSHGLM2pYG-uAhgoxeYkQb33jdkmELh-dlbSqvH4KStRi2_kvwWs5bp-9fUJ_HIISl0rzdDwCoIwgxI_Hk_iDZwGfPoAktHdIAFdHwseNM9KbuZpocpvzO9WGwV6q_Dah0c19fCYWT121xUX0Z8OPN47Y9-vxYwS4GhExy7QJQCunZLoAzwU15iqeqTxjeloPQC3gjm10r8TP1AT7FcqwouHxc_Dj8h7dCr58IFcRwoW21xBTW9omGvuq2hh2bmyJF4nju-qQ7iVurCzR-qzJF7o=&xkcb=SoAP-_M3ZCuowUQFjp0IbzkdCdPP&p=3&fvj=1&vjs=3
Senior Mobile Developer for Flutter / Dart,Gothaer Digital,Köln,"
Are you looking for a new challenge in software developing? You love clean code and technically smart software? You want to be at the frontline of a changing industry?
Then you've come to the right job posting. As a digital subsidiary of the Gothaer Insurance Company, we are looking for new colleagues with entrepreneurial spirit as teammates in our dynamic, interdisciplinary team. The start-up spirit in our office with a view over the roofs of Cologne provides a unique environment.
We are currently looking for a software developer for our tech team who is experienced with mobile / hybrid development and App store release (Android & Apple) and has project experience with Flutter / Dart projects.

Mobile development with Flutter (Dart) for different apps 
Project-based development of applications and MVPs for Gothaer Insurance Company
Implementation of UI and prototypes with excellent user experiences from our XD designs

Your profile:

Good experience with Flutter and other mobile technologies 
Interest in attractive modern design patterns and an ""eye"" for distances, layout and colors
 team player with the interest to cooperate in an interdisciplinary team 
Great interest in innovation (e.g. new programming languages and APIs as well as new technologies in general)
 optional experienced with web development with JavaScript based frameworks for web or mobile development
optional: experience with cloud computing and scaling (Azure, Docker, etc.)
Enjoy bringing complex projects to success as part of a team
German language is a plus but not mandatory

Gothaer Digital GmbH is a international team of experts and you can have a great influence on the path of our digital unit. We offer you a lot of space for the implementation of new ideas and your personal development. Convinced? Then we are looking forward to receive your application.
What we also offer:

A modern office with coffee, drinks and a great view of the city
A cross-functional team from different areas
Flexible working hours and home office
 Further training and paid tech meetings attendance 
Good connection to public transport and a discount for your monthly ticket
 german classes for our foreign employees

",Postedvor 30+ Tagen,Vollzeit,,https://www.indeed.com/rc/clk?jk=a284c64d3471b704&fccid=7c21c8098832bc3f&vjs=3
Software Developer (m/w/d) Mobile (Kundenapp) (auch zu 100%...,1&1 Telecommunication SE,+2 OrteHomeoffice,"



Software Developer (m/w/d) Mobile (Kundenapp) (auch zu 100% im Homeoffice möglich) 
bei unserer Tochtergesellschaft 1&1 Telecommunication SE in Home-Office, Karlsruhe oder deutschlandweit  Kennziffer: SF-1132 


    teilen 
    
facebook 
LinkedIn 
Twitter 
Xing 
E-Mail 

drucken 
  

Über uns
Als börsennotiertes Unternehmen mit rund 15 Millionen Kundenverträgen und 3.200 Mitarbeitenden zählt die 1&1 AG zu den führenden Telekommunikationsanbietern in Deutschland. 1&1 steht für innovative Mobilfunk- und Breitbandprodukte – zuverlässig, preisführend und mit vielfach ausgezeichnetem Kundenservice. Nun beginnt 1&1 das nächste Kapitel seiner Unternehmensgeschichte. Mit der erfolgreichen Teilnahme an der 5G-Frequenzauktion haben wir den Grundstein für ein leistungsstarkes Mobilfunknetz gelegt. Ziel ist es, das modernste 5G-Netz Deutschlands zu bauen.Sie wollen gemeinsam mit uns am Puls der Zeit innovative Kommunikationsdienste und technische Services vorantreiben? Dann gestalten Sie Ihre Karriere bei uns.
Ihre Aufgaben
Stillstand und Langeweile gibt es bei 1&1 nicht – das gilt auch für Ihre persönliche Entwicklung. Wenn Sie für Ihr Team etwas bewegen und sich mit Engagement einbringen möchten, stehen Ihnen bei 1&1 verschiedene Karrierewege offen. Unsere Mitarbeitenden verstehen sich als Innovator, Optimierer und Unterstützer gegenüber internen und externen Kunden. Wer Freude daran hat, gemeinsam erfolgreich zu sein und gemeinsam neue Wege zu finden, der ist daher bei uns genau richtig. Setzen Sie Ihre persönliche Erfolgsgeschichte mit uns fort. Unser Bereich ""Development Online"" ist innerhalb der 1&1 Technikdienstleister für alle Applikationen im digitalen Service und im Vertrieb verantwortlich. Durch unsere Shop- & Selfcare-Systeme geben wir unseren Produkten ein Gesicht und machen die Kundenreise möglich. Sie möchten Teil dieser Reise sein, Ideen entwickeln und unsere Kunden glücklich machen? Dann suchen wir genau Sie. Zusammen mit Ihren Teamkollegen in einem crossfunktionalen Team entwickeln Sie State-of-the-Art Apps nativ in iOS. Dabei arbeiten Sie eng im agilen Softwareentwicklungsteam zusammen.

 Sie konzipieren und entwickeln moderne iOS Apps in einem agilen Team.
 Bei der Entwicklung unserer Produkte sind Sie von der Idee, über die Implementierung bis zum Rollout mit dabei.
 Gemeinsam mit dem Team lokalisieren Sie häufige Fehlerursachen und -Pattern und steigern somit die Qualität in der Softwareentwicklung nachhaltig.
 Sie scheuen nicht den Blick in andere Technologien und Unterstützen Ihre Mitarbeitenden in der Backend-Entwicklung.
 Sie nehmen aktuelle Trends in Ihre Arbeit auf und teilen Ihr Wissen gerne proaktiv mit Team, im Tagesgeschäft und bei regelmäßigen TechDays.

Das wünschen wir uns
Neben einem abgeschlossenen technischen Studium oder einer vergleichbaren Ausbildung haben Sie eine große Leidenschaft für professionelle und qualitativ hochwertige Softwareentwicklung sowie agile Entwicklungsmethoden. Des Weiteren

 Clean Code, Testgetriebene Entwicklung, Continuous Integration und Delivery motivieren Sie in Ihrer täglichen Arbeit.
 Moderne mobile App Entwicklung ist Ihre Leidenschaft.
 Erfahrungen in der iOS- und Backendentwicklung.

 

Wir wertschätzen Vielfalt und begrüßen alle Bewerbungen – unabhängig von z.B. Geschlecht, Nationalität, ethnischer und sozialer Herkunft, Religion, Behinderung, Alter sowie sexueller Orientierung und Identität, körperlichen Merkmalen, Familienstand oder einem anderen sachfremden Kriterium nach geltendem Recht.


Kontakt
1&1 Telecommunication SE Talent Acquisition Team
 jobs@1und1.de

",Postedvor 26 Tagen,Vollzeit,,https://www.indeed.com/pagead/clk?mo=r&ad=-6NYlbfkN0AgOgO4_G1Y4bFiZbSAiHyyAiPnyUNqRAwDfvw98xLQiA2CIpF_XK5eUeGDHvpilzIbaSCZJT-CRhz7CZVpb4JDIIBi2L_d8Kqxg-JNJTkA5BBNP-rjCa7k8W-aVfzJggJFvAa5uqxX5CEtK0t11DdLyoORFKGScEO7D_Z5vPPWlvo1YcUUPdG4ch_DGe24qJHcJFKe5oDL9XhuYMVNQJQeKEUsW1Fi6RiEKLwNX7bdzG1ALqRN-EHNYQz27vuHZLYdvQDrsPOSKGACcvtw9PCZTQOlQUpqN-t-EhyLHDeuL5iUr5JErC2vqoEWXZNhtu5-N6NcOvoJe4T7jbey6-gHl10pNGCcgT0zVcaKHAzz7doLQ9hlhRnndgfPBsml4bEDJoW4-F_38PJx_CTkzBUDQ7Mzut5AR-fbZdyKaosUkNRHZN3-7irUiAiBT5jXocrcxkhzU3lCdOouXlLZwXZ--kSygnPDmUIb8zg83GqP4h50X4q6ldYrVHmH0SfA173hQMEqlfy-MkEZmQKUfzqgG4LU5V1YiHGe6I4ca9IeXcn6E_ChfXGX5YQNlOt63ERFPigASz2ef89qaXvJJ01gJsdZUAUsyajm2XEi8fp7h3-tSdqbpVAqJhEGdnL9mH3UZu86y5xayRgm7j0IeWopgYFSFXrDKyfWR6AWlJmjioMNB5nZfbdE1313y95wFlQ=&xkcb=SoBj-_M3ZCuowUwFjp0KbzkdCdPP&p=5&fvj=1&vjs=3
