job_title,company,location,job_summary,post_date,more_info,salary,job_url
Low Code Developer,Rockfeather,Postcode 3012 in Rotterdam,"
Are you passionate about developing software solutions based on low code technology, and do you want to help our customers create state-of-the-art web and mobile applications? Then Rockfeather is the place to be!

 Your role as Low Code Developer

 As a Low Code Developer, you develop state-of-the-art solutions using Low Code technology such as Outsystems and PowerApps. Together with the Rockfeather team, you will implement Low Code solutions that optimize operational excellence or support upcoming business processes. You will get the chance to work together with a team of passionate consultants at the most ambitious customers in a variety of sectors.

 Your most important tasks as a Low Code Developer:


 You create and develop applications that meet customer needs;
 You go through the whole process from design, implementation to support of applications;
 You consult with customers and team members and discuss functionalities;
 You work iteratively and have close contact with the users to build the best solutions;
 You work with several low code solutions such as PowerApps or Outsystems.

 
What does Rockfeather have to offer?

 Rockfeather gives you the complete freedom to continue your development as a Low Code developer if you want to combine challenging assignments, work for ambitious companies, and help build a team in an entrepreneurial environment. Together we are passionate about the possibilities of data-driven working and offering the best solution for our customers. Our teams with Data Analytics, Data Integration, Data Science, and Low-code colleagues share their knowledge and network so that together we can realize impactful projects and unique solutions.
 We understand that the quality of your life determines the quality of your work. That is why we offer a complete package to take good care of yourself and your loved ones.

 Like every other company, we think we are unique, and we are ‘the place to be.’ The truth is that we are not for a lot of people. If you are looking for a company to build a career in ‘management’ or if you like everything clean and crisp between 9:00 and 5:00, then look somewhere else.  At Rockfeather, we put craftsmanship first. We are passionate about what we do. If you want all the freedom and support to develop your skills to become the next ‘data guru’, then Rockfeather is a perfect match! We also offer the opportunity to buy shares of the team you work in, the ultimate way to bring your entrepreneurship to the next level!
 What do you bring to the table?


 You have a bachelor’s degree or experience that matches that level of education.
 You have a minimum of one year of experience with low code platforms such as Outsystems, Power Apps, or Mendix. Or you have other proven development skills.
 You have knowledge of application design, development, and support.
 You are result-driven, customer-oriented, and you consistently deliver top-notch quality.
 You like to share knowledge with others, and you’re a team player.
 You like to roll up your sleeves and are passionate about keeping up with the latest developments in technology.
 You live in the Netherlands.

",Posted30+ dagen geleden,Voltijds,,https://www.indeed.com/rc/clk?jk=f2f7bca5254c7075&fccid=61ab4f261812234a&vjs=3
Full Stack Developer,GÉANT,Postcode 1102 in Amsterdam-Zuidoost,"About The RoleWe are looking for a Full Stack Developer to join our growing development and eduTEAMS team, seeing a project through from conception to delivery.GÉANT operates a pan-European network to support researchers and academics across Europe and the world. In addition, GÉANT has a portfolio of Trust and Identity services, built on federated access - users log in via their home institution once and they can then access a range of services offered by different Research and Education establishments in other countries and locations. One of these Trust and Identity services is eduTEAMS, developed and operated by GÉANT to enable users to create and manage virtual collaborations to access and share common resources and services using federated identities from eduGAIN and trusted Identity Providers.As a full stack developer working primarily on eduTEAMS, you’ll spend a significant amount of your time initially designing and developing our front-end web architecture to improve our user experience. As well as ensuring that the visual design of applications is appealing, you’ll also be responsible for developing and managing our databases and applications and designing and developing effective APIs. You’ll test software to ensure responsiveness and efficiency, and troubleshoot, debug, and upgrade software when needed. Collaboration is important in this role as you’ll be working closely with both the development teams and product managers on design of software solutions.About YouAs our ideal candidate, you will love innovation and be a team player who likes to share ideas on software solutions that can improve eduTEAMS functionalities, building the front-end of applications through appealing visual design. You will be working in an international and distributed team and engaging with the research and education community in Europe and beyond, while designing client-side and server-side architectures.Whilst you need to have a certain level of technical skill and experience, the key thing for us is your proactive approach to work; we’re looking for someone tenacious who, when faced with challenging problems, will tackle them with drive, energy and creativity. If you have experience in working with large, complex software projects that would be beneficial, as would the ability to explain technical concepts to both technical and non-technical audiences.
You must be proficient with the following skills:

Python3
Front end languages and frameworks (such as HTML5, CSS, React, Vue.js)
Git and Git-based workflows

You will also have experience with:

Designing and developing HTTP APIs
Building containerised web applications
Relational databases (e.g. PostgreSQL) and key-value stores (e.g. Redis)
Designing and developing web applications for desktop and mobile platforms;
Working with Agile practices, particularly Scrum and Kanban;
Designing and developing effective APIs;
Testing software to ensure responsiveness and efficiency;
Troubleshooting, debugging and upgrading software;
Familiarity with distributed architectures using microservices, building features and applications with a mobile responsive design and the ability to write technical documentation is also desirable.

You will need to be fluent in English with the ability to build and maintain excellent working relationships with team members across multiple cultural environments.
About UsWhy work for GÉANT? As an organisation at the heart of research and education networking, we offer talented individuals the opportunity to be part of something worthwhile. Thanks to our terabit network, 50 million researchers, scientists, academics and students can share record volumes of data unconstrained by location, solving some of humankind’s biggest challenges. Work at GÉANT and you’ll be supporting critical research into sustainable energy, deep space, high-energy physics, earth observation, environmental disasters, medicine and much more!
As well as a competitive salary, you’ll receive excellent benefits including a generous holiday allowance, company pension scheme, option for medical insurance, and a 5% end of year allowance. We are keen to help our people to become the best at what they do so you will have plenty of opportunity to develop your skills through training. In addition, at GÉANT you’ll be able to work flexibly, spending a couple of days in the office each week with the rest of the time spent working remotely, although you can be based full time in the office if you’d prefer. You will need to be physically located in the country where the role is based and live within commuting distance of our office.
The role is offered as a 1-year definite contract with the possibility of an extension for a further year after that.
Location: Hoekenrode 3, Postcode 1102 in Amsterdam-Zuidoost
Job Type: Full-time",Posted10 dagen geleden,Voltijds,,https://www.indeed.com/company/G%C3%89ANT/jobs/Full-Stack-Developer-2020293eb625e937?fccid=22214f159c81bc0f&vjs=3
Technical Analyst - Mobile Pay,Underwriters Laboratories Inc.,Thuiswerken in Postcode 2314 in Leiden+1 plaats,"
 Â : 
  At UL, we know why we come to work.: 
 
   Thousands of us around the world wake up every day with a common purpose: to make the world a safer, more secure and sustainable place. Science is in our DNA; we are endlessly curious and passionate about seeking and speaking the truth. We take delight in knowing that our work makes a meaningful contribution to society, and we are proud that our culture is centered on integrity, collaboration, inclusion and excellence. UL stands at the forefront of technological advancement, and we are continually challenged to find new ways to foster innovation and positive change. Satisfying? Yes. Exciting? Absolutely!
 


 On a day-to-day basis, consumers use the global payment infrastructure by purchasing goods in shops, performing online checkouts, or withdrawing money from ATMs. UL supports customers, including the biggest brands in the world, in their ambition to make great digital payments products. Together with our partners in the industry we introduce and verify new payment technologies, mobile wallets, and innovative digital payment solutions.
  
 We are hiring a Technical Analyst to test, validate and certify mobile payment devices.
  
 In our Leiden lab and in our other labs, we are testing, analyzing, validating and improving products from local and global clients. You will work on certification projects with direct customer interaction and hands-on testing. With guidance and support from your team, you will develop personal, technical, and market domain knowledge and skills to become a highly skilled professional technical analyst.
  What youâll learn & achieve:: 
 
Test activities - use and configure tools, test samples and templates in the appropriate way, execute and analyze test results.
 Analysis and problem solving - analyze findings and validate test results, pinpoint issues and communicate issues with client’s developers and product owners.
 Daily communication with clients about their products – clearly report, both verbally as written, observations, verdicts and next actions.
 Quality and integrity - ensure high quality of client products, deliverables, input documents and test results.
 Innovations – have an open and creative mind, be able to recognize new business opportunities, improve internal processes. Develop knowledge about the newest released products and be on-top-of-the-market regarding mobile payment initiatives.
 Personal development - attend related training sessions to become expert in transaction technology, maintain knowledge of standards, specifications and rules of the international payment schemes, including new technologies and innovations.
 What makes you a great fit:: 
 
You are passionate about the latest developments in the mobile industry, e.g. newest phone models, newest features, mobile wallet initiatives.
 You have an innate sense of responsibility, you are accurate and attentive to detail, and you are able to follow given procedures.
 You can work independently to a deadline and you are capable to run your work efficiently.
 You have excellent communication skills and possess the ability to perform professionally in a client facing role and ensure the client’s needs are met.
 You are flexible to change of circumstances (e.g. short confirmation timelines)
 You are fluent in English both in written and in speech.


 Preferred experience:


 Knowledge of testing and compliance processes, technical analysis and reporting,
 Experience with mobile payments technologies and knowledge about payments standards such as EMV, ISO8583, MasterCard and Visa requirements.
 What youâll experience working at UL:: 
 
Mission: For UL, corporate and social responsibility isn’t new. Making the world a safer, more secure and sustainable place has been our business model for the last 125 years and is deeply engrained in everything we do.
 People: Ask any UL employee what they love most about working here, and you’ll almost always hear, “the people.” Going beyond what is possible is the standard at UL. We’re able to deliver the best because we employ the best.
 Interesting work: Every day is different for us here as we eagerly anticipate the next innovation that our customers’ create. We’re inspired to take on the challenge that will transform how people live, work and play. And as a global company, in many roles, you will get international experience working with colleagues around the world.
 Grow & achieve: We learn, work and grow together with targeted development, reward and recognition programs as well as our very own UL University that offers extensive training programs for employees at all stages, including a technical training track for applicable roles.
 Learn More:: 
 
   Working at UL is an exciting journey that twists and turns daily. We thrive in the twists and revel in the turns. This is our every day. This is our normal.
 

 Curious? To learn more about us and the work we do, visit our company page www.UL.com
 
",Posted4 dagen geleden,Voltijds,,https://www.indeed.com/rc/clk?jk=aa80a58e0ae64b9e&fccid=353853af3b99ac74&vjs=3
Mobile Security Expert,Adyen,Amsterdam,"
This is Adyen  We took an unobvious approach to starting a payments company, building a platform from scratch. Today, we're the payments platform of choice for the world's brightest companies. Our unobvious approach is a product of our diverse perspectives. This diversity, of backgrounds, cultures, and perspectives, is essential in helping us maintain our momentum. Our business challenges are unique, we need as many different voices as possible to join us in solving them - voices like yours. So no matter where you're from, who you love, or what you believe in, we welcome you to be your true self at Adyen.  Mobile Security Expert  We are searching for a Mobile Security Expert that will enhance and drive security due diligence activities for our In Persons Payment (IPP) offerings. You will work closely with the different streams developing the future of payments on mobile offerings. Your job will be to advise the streams how to maintain their security posture:

What are trends in the field of mobile payments?
What are threats and risks that the IPP streams should take into consideration?
What security due diligence activities should the streams initiate to provide confidence in the security posture of the products?

Two products that you might be working on are: Tap to Pay on iPhone. With this technology, we can transform an iPhone into a payment accepting device. With Tap to Pay on iPhone our customers can accept contactless card or wallet payments.
 Next to this, you might work on ""the card reader"", which is the companion to a merchant's smartphone or tablet. It connects via Bluetooth Low Energy and it can be attached to the mobile device with the use of a magnet which is built into the hardware.
 You will help find and drive solutions to the above issues with freedom, creativity and both tech and security passion.
  What you will do

Analyse threat intelligence sources for IPP relevant news and trends;
Facilitate threat modelling exercises and trainings for various IPP products;
Architecture current and future IPP products;
Advise on specific implementation questions that our IPP developers have;
Organise security assessments at both hardware and software level for our IPP fleet.

  Who you are

You get excited by new technology and want to work in a high paced environment where we build the future of payments on mobile;
You are an expert in the field of Mobile Security, both in Android and iOS;
You are an expert in the field of IPP on software level, preferably in mobile payments. Experience with hardware is a plus;
You have experience in threat and risk modelling, preferably experience with STRIDE assessments;
You have experience in the following areas: Software Development Lifecycle; Mobile Security; Development Security; Security Architecture;
You are familiar with at least one of the following topics: PCI SPoC, PoS-to-Host and Host-to-Host protocols;
You are a team player that wants to maintain Adyen's security posture.

  Our Diversity, Equity and Inclusion commitments  Our unobvious approach is a product of our diverse perspectives. This diversity of backgrounds, cultures, and perspectives is essential in helping us maintain our momentum. Our business and technical challenges are unique, we need as many different voices as possible to join us in solving them - voices like yours. So no matter where you're from, who you love, or what you believe in, we welcome you to be your true self at Adyen.
 Studies show that women and members of underrepresented communities apply for jobs only if they meet 100% of the qualifications. Even if you don't meet 100% of the criteria then Adyen encourages you to reconsider and apply. We look forward to your application.

",Posted9 dagen geleden,,,https://www.indeed.com/rc/clk?jk=276d38f37eaec9b4&fccid=b5c24474d328dbc6&vjs=3
Experienced mobile app developer,YTEC,Thuiswerken in Groningen,"




At YTEC we're looking for a Experienced mobile app developer to join our team.
Full-time · Groningen









About the job

       We are looking for a fulltime experienced mobile app developer to add to our team. We are a team of 12 backend developers and have an increasing demand regarding mobile app development. Our backend will be mostly Python/Django based (Django REST framework) and you will have to work together with the backend team to build and maintain mobile apps.
     









About you

Experience with flutter (dart)
Or experience with android (kotlin) and/or ios native app development
pre is having experience overseeing and technical managing mobile app projects (including working and managing external devs)
Pre is experience with Django / REST API / graphql
You have knowledge of the entire web development process (version control, design, implement, testing, debugging, maintaining). 
Must be proficient in English, fluent (Dutch is a pre) 










We offer


A competitive salary
Company laptop and phone
We provide pension provision
Training budget
25 holiday days
Flexible hours
A bonus system for when you work longer for the company
Working remote part of the week is no problem (not more than 50%)
Choose your own peripherals at the office (e.g. mechanical keyboard)










Apply for the job

       Do you want to join our team as our new Experienced mobile app developer? Then we'd love to hear about you!
     





",Posted30+ dagen geleden,VoltijdsFlexibel werkrooster,,https://www.indeed.com/rc/clk?jk=3f3c9b914db87495&fccid=839aa6b029837ad7&vjs=3
Frontend Developer,Tellow,Postcode 1013 in Amsterdam,"About usTellow is a fast-growing FinTech company with over 50.000 users, backed by world-class London and New York-based investors Investcorp and Lugard Road Capital. Working from a brand new water-front office in Amsterdam, our talented, ambitious team is committed to giving freelancers full commercial control and assist them with all their financial needs. From accounting, banking, payments and loans, and much more. Tellow is ready to build, innovate and grow. We are expanding our teams and looking for talented people to help us do so.
*About the role*By joining our frontend team, you will play a key role in delivering new features (and maintaining the current ones) to our user base, so that they can do their bookkeeping without any friction. You will proactively keep the web application in a good condition, by staying up to date, adding tests, and assertively optimizing wherever the opportunity presents itself (we’re a fan of the boy-scout rule!). We look for people who love coding and problem-solving and are ready to take full ownership of their work. In this role, you are welcome to come up with creative solutions, propose new ideas and be never satisfied with the status-quo!
*What you will be doing*As a frontend developer you will:

Building new features in our (Angular 14) web application, but also maintaining and refactoring, so it is reliable, performant, scalable, and good looking (we are the prettiest bookkeeping tool after all!).
Further develop our marketing website (in Gatsby) by implementing new components.
Work together with backend developers, UI/UX designers, and peers to deliver well-architected, high-quality solutions.
Implement new features in our web application.
Align features and UX/UI with our (recently refreshed and re-released React Native) mobile app.
Manage schedules, create presentations and updates for the team (for the rest of the team, we like to share!), and maintain your own sprint tickets.
Perform code reviews.

RequirementsWhat we are looking for ️‍ ️

1-2 years of experience (junior / entry-level)
Experience in working with a team of UX/UI-designers, engineers, support, and such
Experience with a framework like Angular, React, Vue (and/or willing to learn Angular)
Good understanding of frontend application structures
Experience with frontend testing techniques
Experience with CI/CD tools
Communicative and collaborative spirit
Have excellent English verbal and written skills
Can work from our Amsterdam office
You already have or are able to obtain an EU Employment Permit.

We don’t provide relocation and/or visa assistance for this role.
BenefitsWhat is in it for you

The opportunity to make an impact, by transforming an old-fashioned bookkeeping industry
Working in a trusting environment that entrusts you with crucial company responsibilities to drive your personal growth
Be part of a unique, dynamic and fast-growing tech company
Working in a work environment that values diversity, inclusivity, teamwork, cohesion, and fun
Be part of a talented and extremely driven team
Working in a brand new, state-of-the-art office in Amsterdam with a rooftop terrace, balcony and BBQ
Working in a healthy workspace with proper climate control, lighting, adjustable desks and 4K screens
Free laptop (Macbook Pro or Windows equivalent) and all necessary gear
Office lunch freshly cooked (it’s awesome!)
Weekly drinks and awesome office events, from roller disco in the kitchen to laser gaming between our desks

Apply for this role

Are you interested in this position? Please apply via the button below.

If you feel like you don't meet all the requirements for this role, we encourage you to apply regardless. We don't want a confidence gap and imposter syndrome to get in the way of meeting incredible candidates.
We are not interested in working together with recruitment agencies. Any acquisition based on this job description is not appreciated.
Job Type: Full-time",Posted30+ dagen geleden,Voltijds,,https://www.indeed.com/company/Tellow/jobs/Frontend-Developer-74bc64801c459049?fccid=f907a18d70455e18&vjs=3
