job_title,company,location,job_summary,post_date,more_info,salary,job_url
(Senior) Mobile App Developer (m/w/d),Endava Berlin GmbH,Homeoffice,"Bei uns übernimmst Du Verantwortung und entwickelst Dich weiter. Ob Du in Deinem Job aufsteigen oder innerhalb der Agentur in einen anderen Bereich wechseln möchtest: Wir unterstützen Dich gerne mit den nötigen Weiterbildungen, dem Besuch von Konferenzen und internen Schulungen. Und wir leben Work-Life-Balance! Die Vereinbarkeit von Familie, Beruf und Freizeit gehört zum Fundament unserer Unternehmenskultur. Wir haben flexible Arbeitszeiten und Teilzeit-Modelle, ermöglichen das Arbeiten aus dem Homeoffice und finden?für fast alle Bedürfnisse eine entspannte Lösung. 

 Was noch? Großartige Kollegen. Firmenevents. Agile Methoden. Ein internationales Umfeld. Spannende, abwechslungsreiche und herausfordernde Aufgaben. Die Chance, eigene Ideen einzubringen und dich zu beweisen. Und obendrauf ein gigantischer Ausblick auf die Tempelhofer Freiheit. 

 Bei Endava wirst Du Teil einer großen, internationalen Community, in der Du leidenschaftlich über technische Themen diskutieren kannst! Wir unterstützen uns gegenseitig dabei zu wachsen und unser volles Potenzial zu entfalten. Und auch außerhalb der Arbeit haben wir eine Menge Spaß zusammen, sei es bei Team-Events, Parties, oder in verschiedenen Freizeit-Gruppen! 

 Aufgaben 



Du bist verantwortlich für die Planung und Entwicklung von nativen iOS und Android Apps
Du arbeitest agil an betreffenden Applikationen
Du stellst zusammen mit dem Team sicher, dass die Leistungsanforderungen erreicht werden
Du unterstützest unsere Sales Teams und berätst sowohl intern als auch extern
Du führst die Kalkulation von Aufwandsabschätzungen durch
 Qualifikation 



Bereitschaft und Fähigkeit anspruchsvolle technische Probleme zu lösen und sich in neue Bereiche einzuarbeiten
Fließendes Deutsch- und Englisch
Hervorragende Kenntnisse in Swift, Objective-C und dem iOS-SDK
Hervorragende Kenntnisse in Kotlin, Java und dem Android-SDK
Sicherer Umgang mit Git, Xcode und Android-Studio
Fähigkeit zur schnellen Einarbeitung in fremden Source Code
Verständnis und Erfahrung bei der Umsetzung von Softwarearchitekturen
Kenntnisse bei der Nutzung von RESTful API’s
Fähigkeit einzelne Tasks in Dauer und Aufwand realistisch abzuschätzen
Erfahrung im Signierungsprozesses und im Deployment von iOS Apps und Android Apps im Apple AppStore und Google Play Store
Erfahrung in der technischen Konzeption und Dokumentation von Apps
 DAS MACHT DICH NOCH INTERESSANTER 



Vertrauter Umgang mit Continuous Integration, Crashlytics, MS AppCenter
Erfahrungen auf Cross-Plattform Technologien wie Flutter, React Native, Xamarin
Erfahrung mit Apple Watch und Apple TV, AndroidTV
Erfahrung in der Anwendung von unterschiedlichen Testverfahren
 Benefits 



Bei uns übernimmst du Verantwortung und entwickelst dich weiter.
Ob du in deinem Job aufsteigen oder innerhalb der Agentur in einen anderen Bereich wechseln möchtest: Wir unterstützen dich gerne mit den nötigen Weiterbildungen, dem Besuch von Konferenzen und internen Schulungen.
Wir leben Work-Life-Balance! Die Vereinbarkeit von Familie, Beruf und Freizeit gehört zum Fundament unserer Unternehmenskultur. Wir haben flexible Arbeitszeiten und Teilzeit-Modelle, ermöglichen das Arbeiten aus dem Homeoffice und finden für fast alle Bedürfnisse eine entspannte Lösung.
Großartige Kollegen. Firmenevents. Agile Methoden. Ein internationales Umfeld.
Spannende, abwechslungsreiche und herausfordernde Aufgaben. Die Chance, eigene Ideen einzubringen und dich zu beweisen.
Hardware Deiner Wahl
Karriere-Entwicklung und vieles mehr!
 INTERESSE? 

 Dann bewirb dich bei uns! Wir möchten deine Fähigkeiten und Motivation nicht nur anhand von Zeugnissen beurteilen. Zeig uns, was du bisher alles gemacht hast. Uns interessieren Projekte aus deiner bisherigen professionellen Tätigkeit, aus Eigeninitiative entstandene Projekte oder dein Code auf Github oder Stack Overflow. Bitte gib uns auch deinen nächstmöglichen Einstiegstermin und deine Gehaltsvorstellungen an.",Postedvor 1 Tag,Teilzeit +1,,https://www.indeed.com/rc/clk?jk=dc980a82221f42fe&fccid=4ec60f6d34889c80&vjs=3
Mobile Application Developer - Flutter,Blindside,10407 Berlin+1 Ort,"Tasks 



The opportunity to take on responsibility for your mobile projects.
You will have an active role in structuring and implementing mobile projects.
You will constantly be learning new skills. Researching, conducting trial & error experiments as well as maintaining full ownership of your code, from concept to deployment.
In your first month, you will be familiarized with our team and have already resolved some bugs and small requests. Your code has gone live multiple times in the first month.
In the following months, your knowledge of our codebase has drastically increased and you are offering your help in fundamental software architecture decisions. You also feel confident enough to change the team's workflow when you see it doesn't work.
At the end of your first year, you have successfully contributed to a wide range of projects, even spanning across multiple elements of our system, from backend to mobile. You have established yourself as a clearly spoken and core member of our team.
 Requirements 



Strong mobile background (3+ years) in mobile development (Android or iOS), as well as professional experience or a personal project in Flutter.
Ideally you have experience in other areas of software development outside of mobile (backend, frontend, infrastructure, etc.)
You can comfortably propose technical solutions to business problems and clearly communicate them to your colleagues.
You are transparent, mindful and empathetic towards your teammates.
You can easily express your ideas in written and spoken English
 Benefits 



The opportunity to establish yourself as a core member of our development team (currently at 4 team members)
An international team with a wide range of backgrounds
A salary that matches industry standards
A respectful atmosphere with a focus on professionalism
A family-friendly work environment
State of the art equipment to ensure that you can focus on the right things
Daily paid lunch at our local canteen
Yearly budget for individual professional development
 We’ve found that cover letters are a great way to separate your application from the sea of applicants. We strongly recommend submitting a cover letter together with your CV. 

 We are only considering applicants with EU work permission.",Postedvor 27 Tagen,Vollzeit,,https://www.indeed.com/rc/clk?jk=670e9ffac036a210&fccid=58ed26e7ffb773b6&vjs=3
Backend Developer Mobile App (f/m/d),Plantura GmbH,München,"

We are looking for an experienced backend developer for our mobile app, to join our development team full time. You will join an established small agile product team, working closely with our engineers, product owner, designer, and QA. You will be responsible for developing and maintaining scalable and performant backends to power our iOS and Android app. You will have the opportunity to shape our team and engineering processes.  YOUR RESPONSIBILITIES:

Develop and maintain the Plantura App backend and integrations with third party APIs and services
Write clean and maintainable code
Take up end to end ownership of your results
Define the architecture of our backends
Diagnose and fix bugs
Collaborate with app and frontend developers
Be ready to learn and stay up-to-date on emerging technologies



YOUR PROFILE:

Passionate about scalable, resilient, and fault tolerant systems
> 3 years of experience developing backend applications
Experience writing clean, testable, and well documented JavaScript code (preferable TypeScript)
Experience developing high-traffic backends
Experience working with AWS technologies is a plus
Having worked in a remote environment before is a plus
Excellent knowledge of software design principles
English working proficiency with strong communication skills




WHY PLANTURA?


High Impact: More than just a job: we don’t believe in strict hierarchies, but in ownership and drive.
Team Spirit: The team is our engine - get to know your colleagues better at frequent social events.
Personal Growth: We foster your professional and personal development on an individual basis.
Product Driven: Working in small teams using agile methods, we focus on our customers to build great products.
Technology Challenges: Using a modern technology slack, we care about maintainable code to build scalable systems that serve millions of users.


",Postedvor 2 Tagen,Vollzeit,,https://www.indeed.com/rc/clk?jk=605b55efd80b6210&fccid=0f685927c5b3ce38&vjs=3
Developer,Mooi Studios,Homeoffice,"Role & Responsibilities

Take ownership of the whole codebase
Implement systems and features from start to finish
Work with the rest of the team to iterate, balance and tune gameplay features based on data and feedback
Design and implement mobile-friendly optimized solutions

Required

Be nice =)
English
Good remote work skills
Good knowledge of the Unity engine and it’s quirks
Experience working on and shipping Unity games.
Not too far from the Central European timezone

Nice To Have

Experience working on crafting games
Experience with NFTs/web3
Experience in other areas of software engineering

Skills in other disciplines of gamedev

Comfortable with taking on multiple hats

What We Can Offer

Fully remote studio
A flexible work schedule
Full-time or freelance contract
Revenue Share

Job Type: ContractContract length: 8 months
Salary: 5,000.00€ per month",Postedvor 30+ Tagen,5.000 € pro MonatVollzeit +1,5.000 € pro Monat,https://www.indeed.com/company/Mooi-Studios/jobs/Developer-2b8e15596543d573?fccid=a018bdd4a084ade6&vjs=3
Backend Developer (M/F/D),gridX,Homeoffice,"Your responsibilities 

 We are an ambitious team. That means you can have a lot of responsibility in the beginning. But it also means that there are many interesting challenges you can specialize in. One of the exciting topics on which we work is: 



Distributed IoT Platform: We aim to create a system with no single point of failure. Therefore we are building a state-of-the-art platform
Highly-Available Cloud-Connected IoT Device: We brought the learnings from our cloud platform to the embedded world. Aiming to create a device that can be updated at any time. Assuring that it runs the latest newest software we built our own operating system running containers for the gridBox - gridOS X.
Data Centric Applications: Each gridBox produces plenty of data which needs to be stored, analyzed and visualized for our customers. We want to give our customers the best experience possible by providing insights and visualizations of their energy consumption and production.

Your responsibilities in detail:


Show the world how to change to a renewable and decentralized energy system
You are responsible for the backend services that power the gridX platform
You will support our Backend team by building new, innovative features that enrich the gridX platform
You build products that people love
 Your profile 



You have experience with Web Technologies (JSON, REST, HTTP, RPC)
You have experience with relational databases (we use Postgres)
You are proficient in at least one modern backend language (e.g. Go, Python, Java; we primarily use Go)
You are comfortable using version control systems (git, GitHub)
You know software development best practices
You like to be challenged and work with high-performing co-workers
Bonus points: You have experience using Linux systems
Bonus points: You have a record of open source contributions
Bonus points: You have experience with container technology
 Why gridX 



Flexible & mobile working: Remote work up to 70 days from anywhere in the EU
Vacation: 28 days + 2 fixed days special leave at the end of the year
Health & Sports: 30 Euros subsidy for Urban Sports Club or Qualitrain plus corporate health management & (mental) healthcare offers
Personal development: coaching, access to e-learning platforms & annual development budget of 1500 Euros per employee
Employee discounts: Access to gridX Corporate Benefits
Stay fit and safe the planet with our JobRad offer
Receive a fair monthly contribution to your company pension plan
City travel subsidy: 30 Euros monthly allowance for your monthly/annual ticket
Modern workplace in the hearts of Aachen and Munich with IT equipment of your choice
Relocation Support: We support your relocation to Germany
Experience the gridX culture at the annual team week, regular team events and receive 50 Euros on top per employee for your department event
We will donate 20 Euros to a charity of your choice on your birthday
 \*Our benefits differ for 100% remote employment! 

 If you want to take up the challenge, please send us your complete and detailed application and accompany us on our mission to disrupt the energy sector!\_\_",Postedvor 6 Tagen,Vollzeit,,https://www.indeed.com/rc/clk?jk=2f385997ac62eb26&fccid=fe641d006172a34e&vjs=3
Mobile App Developer (m/w/d),uptodate Ventures,München,"Über die Position 

 Die uptodate Ventures GmbH, das Corporate Startup der Versicherungskammer Bayern mit Standort in München, sucht zum nächstmöglichen Zeitpunkt einen ""Mobilen App Developer (m/w/d)"". 
Wir entwickeln innovative Lösungen mit dem Ziel, ein digitales Ökosystem rund um das Thema Leben und Wohnen zu schaffen, welches den Alltag der Menschen erleichtert. Dabei fokussieren wir uns auf die Themen Nachhaltigkeit, Gesundheit, Sicherheit. Unser aktuelles Angebot umfasst eigene digitale Dienste wie unsere Smartphone App Earnest zum nachhaltigen Leben (mit über 600K Downloads die reichweitenstärkste App zu dem Thema in Deutschland) sowie ein Portfolio an themenbezogenen Produkten & Services auf unserer Online Plattform. Gleichzeitig arbeiten wir an spannenden neuen Angeboten zu aktuell wichtigen Themen für unsere Kunden, wie z.B. Unterstützung bei nachhaltigen Gebäudemaßnahmen wie Photovoltaik. Bei uptodate vereint sich eine agile Startup Kultur und Fokus auf Innovation mit einem soliden Investor. 

 Deine Aufgaben 



Du entwirfst und entwickelst zusammen mit unseren Entwicklungs- und Projektteams neue Produkte und bringst bestehende Lösungen vom MVP zum Reifegrad
Du nimmst neue Funktionen schnell live - dabei stets mit Blick auf das große Ganze und die Qualität
Entwickle unsere Produkte “mobile first” und verbessere und pflege die CI/CD-Pipeline
Code-Reviews und automatisierte Tests sind dabei Teil deines Alltags
Du arbeitest in einem agilen Scrum-Team - in enger Zusammenarbeit mit Product Ownern und Designern
Du arbeitest mit React, React Native, TypeScript, HTML5, CSS, AWS, Serverless und vielem mehr. Auf unserem Uptodate Radar kannst du dir einen genaueren Überblick verschaffen, wie und mit welchen Tools wir arbeiten.
 Dein Profil 



Du hast Lust auf Entwicklung mobiler Anwendungen (Vorerfahrung in dem Bereich ist kein Muss)
Du verfügst über Kenntnisse in den folgenden Standards wie React Native, Expo, JavaScript, TypeScript, HTML5 und CSS
Du hast großes Interesse an der Entwicklung und der Veröffentlichung mobiler Anwendungen
Idealerweise hast du bereits erste Erfahrungen mit AWS und der Backend-Entwicklung
Du wolltest schon immer Entwickler werden - denn Programmieren ist Deine Leidenschaft!
Du hast gute Englischkenntnisse in Wort und Schrift
 Warum wir? 



Anspruchsvolle, abwechslungsreiche und eigenverantwortliche Aufgaben
Verantwortung von Anfang an – großer Gestaltungsspielraum in Hinblick auf unsere Produkte und Prozesse
Ein großartiges internationales Team und kollegiale Atmosphäre mit jeder Menge Spaß
Eine offene Unternehmenskultur mit flachen Hierarchien, kurzen Entscheidungswegen und Hands-on-Mentalität
Regelmäßige (virtuelle) Teamevents
Teilnahme an Corporate Benefits der Versicherungskammer wie z.B. Fitnessangebote und Kantine
Flexible Arbeitszeiten und Home-Office Regelung (ein Standort innerhalb von Deutschland/außerhalb von München ist nach Absprache möglich)
Ein neues, modernes Büro mit kostenlosen Getränken und frischem Obst
Attraktives Gehaltspaket und 30+ Urlaubstage
 Klingt gut? Dann bewerbe Dich jetzt mit einem Klick auf unserer Website. 
Wir haben einen transparenten, schnellen dreistufigen Recruiting-Prozess, der nach nur 2-3 Wochen komplett abgeschlossen ist - mit ausführlichem Feedback in jeder Phase, wenn Du möchtest.",Postedvor 11 Tagen,Vollzeit,,https://www.indeed.com/rc/clk?jk=e062d795e2109f9e&fccid=280cfdf95f13ccc6&vjs=3
PHP Developer,publicplan GmbH,Berlin,"
YOUR TASKS 

You document and maintain existing web applications. 
You will develop new features within existing software solutions based on the PHP programming language, completing and implementing individual increments. 
You present your created features and software improvements in the review to our customers and your team. 
You ensure the quality of your work through unit and integration tests (e.g.: PHPUnit) as well as peer reviews. 
Furthermore, you contribute to the knowledge transfer within the team and the company. 


REQUIREMENTS 

You have completed IT vocational training or a degree in the IT field. 
You bring at least 3 years of professional experience in a comparable position. 
Experience in the use of web frameworks ( Symfony or Laravel ). 
You have good knowledge with the web technologies HTML, CSS, JavaScript and MySQL. 
You have a very good command of English or German. Willingness to relocate to Germany is a prerequisite. 


BENEFITS 

With us, you can shape the administration of the future with open source solutions and thereby make the everyday life of many people more pleasant. 
Specific training opportunities that will help you develop professionally, but also personally. 
We offer flexible arrangements regarding working hours (part-time 30 hrs/week) and mobile working. 
Whether in the office in Düsseldorf or Berlin, but also at home: You will receive modern technical equipment.

",Postedvor 30+ Tagen,Festanstellung,,https://www.indeed.com/rc/clk?jk=287129add9dac159&fccid=bdd35204919246ea&vjs=3
Mobile Developer (m/w/d) in Hamburg,slashwhy GmbH & Co. KG,Hamburg+2 Orte,"
 Was dich bei uns erwartet? 
 
unser agiles Mindset
spannende Herausforderungen, die du gemeinsam mit deinen motivierten Entwicklungskolleg:innen lösen wirst
die Entwicklung von innovativen mobilen Anwendungen im Bereich Smart Home mit Xamarin und Xamarin.Forms, insbesondere für Android und iOS
die Mitwirkung bei der Konzeption und Entwicklung von nutzerfreundlichen Anwendungen, die genau auf den User zugeschnitten sind
der Freiraum für kreative Ideen und für deine persönliche Weiterentwicklung
ein großartiges Team und moderne Räumlichkeiten im Herzen von Hamburg-Hammerbrook
Wir freuen uns über 
 
ein abgeschlossenes Studium, gern mit Schwerpunkt Informatik oder eine vergleichbare Ausbildung
gute Kenntnisse in der Entwicklung mobiler Apps (Cross-Plattform mit Xamarin oder Nativ)
deine Erfahrung in C#
dein praktisches Know-How in den Bereichen Interaktionsdesign und Usability
deine Begeisterungsfähigkeit zur schnellen Einarbeitung in neue Sprachen, Frameworks und Technologien (z.B. Flutter, React Native, o.ä.)
dein kommunikatives Auftreten, deine selbstständige und strukturierte Arbeitsweise sowie deinen hohen Qualitätsanspruch
Bonus: Erste Erfahrungen mit Git, Test Driven Development, Unit Tests
deinen Spaß an einer agilen Arbeitsweise nach Scrum

",Postedvor 30+ Tagen,,,https://www.indeed.com/rc/clk?jk=6f031a50ee90bf27&fccid=fcbf150737eab0b7&vjs=3
Flutter Developer,Fastic GmbH,Homeoffice,"Your Role 

 We are seeking ambitious, self-motivated engineers with experience in cross-platform mobile development (flutter,IOS, Android) to help us take Fastic to the next level. You should enjoy working in a fast paced fully remote and a customer-oriented environment. 

 Responsibilities 



Improving the customer experience by continuously implementing new features, optimising user flows, and increasing technical performance
Be responsible for shipping cross-platform application for Android and iOS
Use your experience in front-end technologies to identify frameworks, libraries, techniques and strategies to be used to build world class mobile apps
Stay always up to date on Play/App store requirements and mobile application capabilities and trends to be able to help inform Product teams on possible roadmap features, including implementation breakdowns and prototypes
Collaborate with our user experience (UX) team and our designers to identify and solve key usability challenges for multiple applications
Develop integrations with various 3rd party tools and data platforms
Actively work with our backend team to define and implement APIs and rule sets for data access
Participate in code reviews with other team members
 Essential Requirements 



You have 3+ years of experience in building customer-facing applications
You have 1+ years experience working with Flutter – including BLoC pattern, animations and 3rd party library integration
You have experience in publishing and managing mobile apps in the Apple App Store/Google Play Store
You have experience with Firebase services like Auth, Analytics, Firestore, and Crashlytics
You write well-structured, efficient and maintainable code and actively keep the quality of the code base in check
You have a strong understanding of UI/UX principles and a critical, detail-oriented eye for design and mobile UIs
You have excellent analytical and problem-solving skills
You have the ability to analyze problems and implement solutions that trade off architectural, usability, performance, reliability, scalability, level-of-effort, and time-to-market
You have the ability to think/work creatively, independently and as part of a team
You are passionate about continually up-skilling and learning new technologies
You have strong verbal and written communication skills
 Application Process 



Screening Call - People and Culture Manager (30-45minutes)
Technical Call - Lead Flutter Developer (30-45minutes)
Technical Task - Home Assignment
Final Interview - CTO (30 minutes)
",Postedvor 3 Tagen,Vollzeit,,https://www.indeed.com/rc/clk?jk=eb20331d2f74bba7&fccid=a72e1e594f906bad&vjs=3
"iOS Mobile Developer January 9, 2019",iRewardHealth GmbH,Berlin,"
Job Title: iOS Mobile Developer Standard Weekly Hours: 40 (full-time)  Location: Berlin, Germany 

Who we are
 At iRewardHealth we are looking to make a difference in the world. We are passionate about what we do and are looking to continue building a team that is also passionate, driven, and determined. We are selective in who we bring on as we are a close-knit group, and personality is equally as important to us as technical fit.

 What you bring along

 Experience with the mobile app development lifecycle, including such tools as XCode, Fabric, and Fastlane (Bitrise)
 Experience in developing iOS applications with Swift and Objective-C
 Ability (and willing) to work in a fast and efficient agile framework.
 To work flexibly and independently to get tasks done as well as designing collaboratively with fellow engineers
 Language skill in English

 Nice-to-have

 Knowledge of mobile app testing best practices
 Experience with the AWS ecosystem

 Nice-to-have

 Knowledge of the asynchronous, event-based design of RxJava for the Android platform
 Knowledge of mobile app testing best practices
 Experience with the AWS ecosystem


 More About iRewardHealth
 iRewardHealth is a health incentive app with offices in Boston, MA USA and Berlin, Germany. We strive to help companies raise awareness about healthy lifestyles and habits by rewarding employees for logging behaviors. We are a team who believes in the power of the individual. Through our experience we have learned that successful businesses are lead by healthy and fulfilled people.

",Postedvor 30+ Tagen,Vollzeit,,https://www.indeed.com/rc/clk?jk=43756bebc9b66af8&fccid=68aef78a51f8cd10&vjs=3
