job_title,company,location,job_summary,post_date,more_info,salary,job_url
C# .Net Developer,Gemango Software Services Inc.,Singapore,"
C# .Net Developer 


August 24, 2022August 24, 2022




We are starting new exciting projects and are looking to expand our current team of .Net Software Engineers.

Do you talk C#, read API’s and like Angular or React poetry? Talk to us.
 You will be part of a small innovative team that designs and develops web and mobile applications, front-ends, API’s and are involved in the full development cycle.
 Join us and Stay up-to-speed regarding technologies and methodologies in your own domain.
 At Gemango you are an asset and not a number, we value personal development and individual ideas.
 Job Highlights

career growth opportunities in an open-minded workforce

Requirements:

1 year minimum experience in Dot Net / .Net Core (C#)
Entity Framework or any ORM
MySQL or MS SQL
Strong analytical skills and problem-solving aptitude
Attention to details
Proficient understanding of code versioning tools, such as Git or Svn
Javascript, CSS, HTML5 ( Angular, React or Vue is a plus)
Good oral and written communication skills for the regular scrum conference meetings with the overseas teams in Europe (Belgium)

What we offer:

Appealing compensation based on experience
Traffic-friendly office hours (1:00 pm to 9:30 pm in a non-pandemic situation) with a 2-hour flexible for your own convenience.
Daily office dinner included
Flexible break times
Convenient office location just across the street from Ayala mall
Medical insurance (dental and 1 dependent included) and several allowances
Above industry standard leave benefits
Opportunity to grow into a “lead” position.
No cubicle setup but a multi-screen open desk work setup.
Full support from the overseas development and management team
Travel opportunities in Europe
All the benefits of working in a lean and mean environment
You’re not a number but a true asset to the group.
Less hierarchy and enormous learning opportunities in the business since you are not placed in a typical roll
Make a significant impact and get credited for it.
Have a strong influence on business decisions and boost your personal skillset.
Possibility to develop your own personal ideas within the company
Regular outings and dinner treats with the whole team (non-pandemic period)
Training will be provided if necessary

Interested?
 Get in touch with us on Messenger (gemangoInc), By email at hrATGemango.com


",PostedPosted 10 days ago,,,https://www.indeed.com/rc/clk?jk=7d9fbb4114daddfa&fccid=958eaa3d87b97e8e&vjs=3
Android Mobile Developer,Accenture,Singapore,"
About Accenture
 Accenture is a global professional services company with leading capabilities in digital, cloud and security. Combining unmatched experience and specialized skills across more than 40 industries, we offer Strategy and Consulting, Interactive, Technology and Operations services—all powered by the world’s largest network of Advanced Technology and Intelligent Operations centres. Our 506,000 people deliver on the promise of technology and human ingenuity every day, serving clients in more than 120 countries. We embrace the power of change to create value and shared success for our clients, people, shareholders, partners and communities. Visit us at www.accenture.com.
 As a mobile developer, you will be responsible for building and testing the mobile applications to ensure that it will be fast, efficient and reliable.

 Key Responsibilities

 Work with the business and gather requirements and specifications
 Develop, build, test and maintain mobile applications
 Brainstorm new ideas improve UX/UI and fix bugs
 Perform troubleshooting and resolving of production issues
 Write presentation-tier HTML/CSS/JavaScript, using libraries and plug-ins, where necessary
 Ensure optimization of the mobile applications developed
 Work closely with the Mobile Architects, UX/UI Designers and other team members




Job Requirements

 Bachelor’s degree in computer science or equivalent
 Having 3 years above of hands-on experience developing and implementing mobile applications
 Experience in mobile web development using HTML/ React.Native/ CSS/ JavaScript/ Android SDK/ Kotlin
 Knowledge and/ or experience in Android development
 Good understanding of UI/ UX concepts for mobile devices
 Good working experience in C / C++ / C# / Java or other Object-oriented programming
 Experience in local testing using Appium, Cucumber or SeeTest for native app testing tools
 Familiarity with publishing of beta app through TestFlight / HockeyApp
 Familiarity with Agile/ Scrum delivery methodology; rapid prototyping is a plus


 You will also have opportunities to hone your functional skills and expertise in an area of specialization. We offer a variety of formal and informal training programs at every level to help you acquire and build specialized skills faster. Learning takes place both on the job and through formal training conducted online, in the classroom, or in collaboration with teammates. The sheer variety of work we do, and the experience it offers, provide an unbeatable platform from which to build a career.

 Accenture is an equal opportunities employer and welcomes applications from all sections of society and does not discriminate on grounds of race, religion or belief, ethnic or national origin, disability, age, citizenship, marital, domestic or civil partnership status, sexual orientation, gender identity, or any other basis as protected by applicable law.
",PostedPosted 30+ days ago,Full-time,,https://www.indeed.com/rc/clk?jk=14288b0f9d6a1039&fccid=a4e4e2eaf26690c9&vjs=3
MOBILE APPLICATION DEVELOPER (ANDROID/FLUTTER),OSIM International Pte. Ltd,Singapore,"



ROLES & RESPONSIBILITIES


Design and develop new projects using Flutter
Troubleshoot, maintain and support existing native iOS or Android projects and Flutter projects




 REQUIREMENTS


Diploma/Degree in Computer Science / Software Engineering / Computer Engineering or its equivalent
At least 1-2 years of working experience in Flutter development
Experience with Flutter plugin and using native SDK via Flutter
Experience with mobile app deployment and optimization
Familiarity with RESTful APIs
Experience with version control such as Git
Able to work in an agile environment




 ADDITIONAL QUALIFICATIONS


Knowledge in native development (iOS or Android) is a HUGE plus
Knowledge in Wi-Fi / Bluetooth Low Energy products is a plus
Knowledge in CI/CD is a plus




    Interested and suitable candidates, please send your resume and portfolio to hrenquiry@osim.com.sg.
  


 We regret that only shortlisted candidates will be notified.

",PostedPosted 30+ days ago,,,https://www.indeed.com/rc/clk?jk=fedb825da3f213c1&fccid=3de0fc0f3dd3c649&vjs=3
Senior Mobile App Developer (Flutter),SPARKLE NETWORKS PTE. LTD.,Singapore+1 location,"
Senior Mobile Developer (Flutter) 



Design and develop projects using Flutter 
Troubleshoot, maintain and support existing native iOS or Android projects and Flutter projects 

Requirement: 

Degree in Computer Science / Software Engineering / Computer Engineering or its equivalent 
Good data structure and algorithm foundation, solid programming skills. 
Rich experience in mobile app development 
Familiar with the Flutter framework and Dart. Understand the implementation principles of commonly used components in Flutter. 
Preferably with more than 2 years of iOS actual project development experience in Flutter. 
Positive and optimistic, strong sense of responsibility, serious and meticulous work, good team communication and collaboration skills. 



For more information about our company, please visit http://sparkle.com.sg/
",PostedPosted 30+ days ago,"$5,000 - $9,000 a monthFull-time","$5,000 - $9,000 a month",https://www.indeed.com/rc/clk?jk=c5920c5868bd274a&fccid=d4881813418d86a3&vjs=3
WordPress Web Developer,SLEEK TECH (PTE. LTD.),Singapore,"
WordPress Web Developer (SG) 
About Sleek 
Sleek is on a mission to revolutionize how entrepreneurs operate their business. We want to give small business owners peace of mind and the power of online solutions to allow them to focus on what they do best - growing their business. As we work for our thousands of customers, we gather millions of data points about their business, and in turn we transform those into useful, actionable insights and recommendations to accelerate their growth through smart algorithms. 
We are a team of 300 builders from 17 countries, with offices in Singapore, Philippines, India, Vietnam, Hong Kong, Australia and the UK committed to delivering a delightful experience to our clients! 
We are looking for a talented Web Developer that is experienced using WordPress. Reporting into the Head of eCommerce and working closely with the wider marketing & dev teams, you will be responsible to build, test and deliver best-in-class front-end website changes on Sleek.com for mobile & desktop users 
You will be proficient in HTML, CSS, and JavaScript and passionate about going above and beyond to delight customers. You will be responsible for all technical aspects of the site such as improving site speed, mobile responsiveness, accessibility and the development of new front-end features such as widgets and new plugins. You will also help to build and maintain a staging environment. 
This is a great opportunity to develop your technical knowledge whilst working with a dynamic team to deliver a world-class web experience for our customers. 
Position Duties 

Build high performing and optimised mobile first web pages using the latest technologies. 
Work with web designers and marketing team to translate visual concepts into functional online experiences. 
QA, test and deploy changes on production environment. 
Maintain ownership of the website IA (information architecture) and how it evolves over time. 
Implement A/B tests using Google Optimize and other testing tools to improve performance. 
Manage the website taxonomy and URL redirects in partnership with the SEO team. 
Ensure the website is tagged properly for various tracking tools. 
Implement personalization tools. 
Provide technical expertise and ownership of technical issues. 
Implement basic changes to graphics using Photoshop/Sketch/Illustrator. 
Must be available to occasionally work afterhours to deploy time-specific changes on the website. 

Requirements 

Minimum Bachelor’s degree in IT, Engineering, Computer science, or similar. 
At least 5 years of working experience as a web developer, Wordpress and Elementor. 
Experience in HTML, CSS, JavaScript (and JQuery) and PHP. 
Comfortable using Photoshop. 
Experience using A/B testing tools such as Google Optimize and Optimizely. 
Strong experience with responsive design. 
Experience with increasing website speed and optimization techniques especially Core Web Vitals. 
Experience of using various WebAnalytics software such as GA and Hubspot. 
Knowledge of user experience best practices and ability to implement solutions based on unique needs of specific users. 
Familiar with W3C standards. 
Comfortable with working independently or remotely. 
Great organizational skills and attention to detail. 
Excellent written and verbal communication skills in English. 

More about Sleek! 
At Sleek, we work in a fast-paced start-up environment. We have a strong culture built around our five core values: Simplicity, Loyalty, Excellence, Entrepreneurship, Kindness. As a deliberately multicultural team, our team comprises more than 18 nationalities and spoken languages. 
We consider the company’s success to be a result of committed individual and team efforts, and are looking to onboard talented and creative people who want to make a difference. Corporate social responsibility is a passion, and as an equal opportunity employer we aim at making the world a better place. With a strong commitment to also make Sleek a great place to work, we offer a flexible working environment where we empower every team member to be the best they can be - regardless of race, ethnicity, religion, gender, age or identity. 
If you think you would be a good fit for our mission, we look forward to hearing from you!
",PostedPosted 3 days ago,"$6,000 - $7,000 a monthFull-time","$6,000 - $7,000 a month",https://www.indeed.com/rc/clk?jk=dc26f2c12029680b&fccid=c03e92a5fbc2feaf&vjs=3
Mobile/Web Developer Internship,Motorist Pte Ltd,Singapore,"

We are looking for a technically gifted and ambitious individuals to join us as Mobile/Web Developer Interns. Ideally you are someone who can hustle and is willing to learn. You'll be treated just like any of your senior developers, so get ready for long hours, getting your hands dirty and lots of hard work. 
Responsibilities

Write well-designed, testable code.
Integrate software components into a fully functional software system.
Troubleshoot, debug and upgrade existing systems.

Requirements

Have at least 2 years of experience in one or more of these technologies
   
Backend - Rails, REST
Databases – MySQL, Redis
Frontend – Bootstrap, JavaScript, HTML, CSS
Mobile – Java, Swift

Excellent debugging, analytical, problem solving, and social skills

Qualifications
This position is open to students who are currently studying in Polytechnics or Universities.
",PostedPosted 30+ days ago,Internship,,https://www.indeed.com/rc/clk?jk=395fffd3e12616d2&fccid=5f81295f7189b1de&vjs=3
Internship - Front-end Developer/Mobile Developer (Aug to De...,IBM,Singapore,"

Introduction
 At IBM, work is more than a job - it's a calling: To build. To design. To code. To consult. To think along with clients and sell. To make markets. To invent. To collaborate. Not just to do something better, but to attempt things you've never thought possible. Are you ready to lead in this new era of technology and solve some of the world's most challenging problems? If so, lets talk.
  

Your Role and Responsibilities
 As a Front-end / Mobile Developer, you transform vital business needs into code and drive innovation in an agile environment. Your work will power IBM and its clients, collaborating and integrating code into enterprise systems. You will have access to the latest education, tools and technology, and a limitless career path with the world’s technology leader.
  

Your Role and Responsibilities

 Frontend development using web technologies
 Development of native or hybrid mobile applications
 Support the entire application lifecycle
 Produce code to the highest standards while adhering to industry accepted architecture and design pattern techniques and methodologies.
 Troubleshoot and debug to optimize performance
 Design interface to improve user experience
 Liaise with the team to plan new features
 Review of codes and conducting testing.


 Technical and Professional Expertise

 BS degree in Computer Science, Engineering or other related area required.
 Familiarity with the whole web stack, including protocols and server-side techniques.
 Understanding of modern databases and strong data modelling skills
 Good understanding of working with remote data via REST and JSON, HTML5, CSS, JavaScript, Typescript, 
Possess advanced problem solving, analytical and time-management skills
 Training or certification with experience in system analysis, design, and programming is desirable
 Experience with service-to-service API integration and consuming data from 3rd party SaaS application APIs is desirable
 Experience in Mobile Native Development (iOS or/and Android) is a plus
 Experience building frontend Applications with React JS and/or Angular JS and/or Vue JS, libraries and frameworks is a plus




Required Technical and Professional Expertise
 Refer as above
  

Preferred Technical and Professional Expertise
 Refer as above
 



 About Business Unit
 IBM Services is a team of business, strategy and technology consultants that design, build, and run foundational systems and services that is the backbone of the world's economy. IBM Services partners with the world's leading companies in over 170 countries to build smarter businesses by reimagining and reinventing through technology, with its outcome-focused methodologies, industry-leading portfolio and world class research and operations expertise leading to results-driven innovation and enduring excellence.
 



 Your Life @ IBM
 Are you craving to learn more? Prepared to solve some of the world's most unique challenges? And ready to shape the future for millions of people? If so, then it's time to join us, express your individuality, unleash your curiosity and discover new possibilities.
  
 Every IBMer, and potential ones like yourself, has a voice, carves their own path, and uses their expertise to help co-create and add to our story. Together, we have the power to make meaningful change – to alter the fabric of our clients, of society and IBM itself, to create a truly positive impact and make the world work better for everyone.
  
 It's time to define your career.
 



 About IBM
 IBM’s greatest invention is the IBMer. We believe that through the application of intelligence, reason and science, we can improve business, society and the human condition, bringing the power of an open hybrid cloud and AI strategy to life for our clients and partners around the world.
  
 Restlessly reinventing since 1911, we are not only one of the largest corporate organizations in the world, we’re also one of the biggest technology and consulting employers, with many of the Fortune 50 companies relying on the IBM Cloud to run their business. 
  
 At IBM, we pride ourselves on being an early adopter of artificial intelligence, quantum computing and blockchain. Now it’s time for you to join us on our journey to being a responsible technology innovator and a force for good in the world.
 



 Location Statement
 For additional information about location requirements, please discuss with the recruiter following submission of your application.
 



 Being You @ IBM
 IBM is committed to creating a diverse environment and is proud to be an equal opportunity employer. All qualified applicants will receive consideration for employment without regard to race, color, religion, gender, gender identity or expression, sexual orientation, national origin, genetics, pregnancy, disability, age, veteran status, or other characteristics. IBM is also committed to compliance with all fair employment practices regarding citizenship and immigration status.
 
",PostedPosted 30+ days ago,Full-time +1,,https://www.indeed.com/rc/clk?jk=3ca954429b2d85bc&fccid=de71a49b535e21cb&vjs=3
Flutter Developer,SCSoft Technologies,Singapore,"

Job Description
Design and development of Hybrid Mobile Applications (iOS and Android) using Flutter Framework.

Implement new technologies to maximize application performance and reduce load time.
Support the back-end developer in the process of building RESTful API.
Integration to backend systems using Restful services.
Integration of third-party API like Biometric GPS, Maps, etc.,
Unit-test code for robustness, including edge cases, usability, and general reliability.
Participating in the planning and design of future software and technical architecture.
Build reusable code, patterns, and libraries for future development using best practices.
Understand requirements, architecture decisions, assess the feasibility, and provide time estimates on implementing new features and functionalities.
Prepare any necessary technical documentation.
Debugging skills with Browsers Developer Tool Proficient understanding of code versioning tools, such as SVN or GIT


Qualification
B.Tech/MTech/MCA/BSC/MSC


",PostedPosted 30+ days ago,,,https://www.indeed.com/rc/clk?jk=d1a3087d02e2de0a&fccid=0e611b89c4869300&vjs=3
App Developer,FLEXOSENSE PTE. LTD.,Singapore+1 location,"
There is an opportunity to make a difference where it matters. We are looking for visionaries who are keen to make a positive impact on the way the world lives. 
At FlexoSense, the future is yours to determine, create and enjoy. Join us as the pioneering team on a game-changing journey. Our vision is to create a positive global impact by enabling healthy longevity for everyone with our sensor technologies. 
App Developer 
We are looking for an App Developer, preferably with UI/UX designing skillsets, who is able to understand our business requirements and translating them into sitemaps, user flows, customer journey maps, wireframes, mock-ups and prototypes. This person is expected to design the overall functionality of mobile app and dashboard. In order to ensure a great user experience, be able to iterate with user-testing. 
Roles & Responsibilities 

Design, develop, implement, and maintain interactive and user-friendly app 


Translate functional requirements from users into sound technical designs that meet the objectives 


Design and deliver wireframes, user stories, user journeys, and mock-ups optimized for a wide range of devices and interfaces. 


Prepare test plans and conduct SIT and UAT to ensure robustness and quality of app 


Troubleshooting and debugging to optimize performance 


Involve in applications roll-out to respective app stores 


Stay up to date with new technology trends 


Participate in full mobile/tablet application development lifecycle, including data to and from smart devices 


Deliver projects on time and ensure that it meets the business requirements 


Provide production support and ongoing maintenance and enhancement of mobile/tablet applications 


Identify design problems and devise elegant solutions. 


Make strategic design and user-experience decisions related to core, and new, functions and features. 


Take a user-centered design approach and rapidly test and iterate your designs. 


Collaborate with other team members and stakeholders. 


Ask smart questions, willing to take calculated risks, and champion new ideas. 


Able to work both independently as well as with a team on multiple projects 


Be flexible to undertake any ad-hoc duties assigned by management 

Requirements 

Minimum Diploma/ Degree in Information Technology, Computer Science, Digital Design, HCI or equivalent 


More than 2 year related software/app development working experience is preferred 


iOS developer candidates need to have solid understanding of iOS development in Objective-C/Swift 


Android developer candidates need to have solid understanding of Android development in Java/Kotlin 


Prefer developer with experience in cross platform mobile application development (e.g. ReactNative, Ionic) 


Familiar with common third-party libraries and APIs 


Experience in web service integration with apps (JSON, XML, SOAP, REST) 


Working knowledge of the general mobile landscape, architectures, trends, and emerging technologies 


Good understanding of the full mobile development lifecycle, including publishing mobile apps on App stores/Google play 


Preferred experience in using UI/UX design best practices to design solutions, and a deep understanding of mobile-first and responsive design. 


A solid grasp of user-centered design (UCD) and design thinking, planning and conducting user research, user testing, A/B testing, rapid prototyping, heuristic analysis, usability and accessibility concerns 


Must be analytical, self-driven and proactive in keeping up with new technologies and programming languages 


Be open to receiving feedback and constructive criticism. 

About FlexoSense 
FlexoSense is a startup with co-founders from the National University of Singapore. Our flexible sensors enable new experiences in markets like healthcare, lifestyle, sports, industrial and more. 
Our vision is to create a global impact through personalising digital health and well-being with our platform sensor technologies. Our initial focus is on a smart insole solution targeting the wellness, industrial and medical markets.
",PostedPosted 2 days ago,"$3,500 - $5,000 a monthPermanent +1","$3,500 - $5,000 a month",https://www.indeed.com/rc/clk?jk=f11fce2b789cf7b1&fccid=0082156ec92831fa&vjs=3
