job_title,company,location,job_summary,post_date,more_info,salary,job_url
Senior Hybrid Mobile Developer JavaScript / Angular 2 (m/f),JetApp,70173 Stuttgart,"
At our Stuttgart location we are looking for a: Senior Hybrid Mobile Developer JavaScript / Angular 2 (m/f)
Experienced private jet customers say that JetApp is the most powerful booking platform for private charter flights.
 If you are at the top of your field and are looking for a multi-faceted career as part of a team of high-caliber experts and enjoy top level networking, then you have come to the right place at the right time. 

Your role:

You will be responsible for designing and implementing completely new mobile apps for the aviation sector.
You will develop platform-independent hybrid mobile apps using Angular 2.
You will work closely with the founding team and our desktop developers.


Your profile:

You are an experienced developer and write clear, concise, and well-structured code that you can be proud of.
You are experienced in hybrid app development using Angular 2 or React.js.
HTML5, CSS, responsive layouting, and relevant frameworks (e.g. Bootstrap) are part of your everyday work.
You are familiar with PHP and Symfony and you know everything they can be used for.
You are comfortable working with Linux, Git, Vagrant, PHPStorm, and continuous integration.
Ideally, you will have comprehensive experience in e-commerce.
You are experienced in working with automated and manual testing methods.
You enjoy the challenges of helping to develop JetApp and emerging software.


What we offer:

An exciting startup work environment with numerous growth and development opportunities
State-of-the-art workplace equipment to give you the ideal foundation for your everyday work
Competitive remuneration with the opportunity to rise through the ranks quickly
Free coffee, tea, mineral water and fruit
A positive company culture that allows everyone to grow and develop
A workplace in the heart of Stuttgart, directly on Marktplatz Square with plenty of culinary offers


Sounds good? Then we want to hear from you! Please email your application to career@jetapp.com.

",Postedvor 30+ Tagen,,,https://www.indeed.com/rc/clk?jk=d5a068663722a358&fccid=5f93e1c4b43192be&vjs=3
Frontend Developer - Wiesbaden (M/W/D),Avameo,65195 Wiesbaden,"


   Stellenbezeichnung
  

    Frontend Developer - Wiesbaden (M/W/D)
  



    Beschreibung
  

 Du liebst UI/UX-Design und kannst anspruchsvolle Benutzeroberflächen in modernen Frameworks umsetzen und bringst eine ordentliche Portion Berufserfahrung mit? Wireframes, Mockups, Barrierefreiheit und Usability sind keine Fremdworte für Dich.
 Als Frontend-Developer kannst Du auch mit Top-Profis im UI-Design arbeiten und wahrnehmungspsychologische Fachtermini, wie Z-Pattern und F-Pattern schrecken Dich nicht ab.
 Selbst für komplexe Interaktionsprozesse findest Du einfache Lösungen für User-Interfaces, die der Anwender gerne nutzt. Durch deine Benutzeroberflächen kommt der Nutzer schnell zu seinem Ziel. Deine Frontends machen dem Endanwender Spaß und Plausibilitätstest gehören zu deinem Repertoire.
 Dein Arbeitsumfeld ist geprägt durch

Moderne Technologien 
     
Angular
React.js
Vue.js

Agile Projekte 
     
Meistens Scrum
Enge Abstimmung im Team und mit dem Endanwender






   Deine Qualifikationen
  


Abgeschlossenes Studium
Min. 3 Jahre Berufserfahrung
Teamfähigkeit
Verständnis für agile Entwicklungsprozesse





   Deine Benefits
  

 Mindestens 10 Weiterbildungstage pro Jahr

steigere Dein Wissen
erlange internationale Zertifizierungen
erhöhe Deinen Marktwert

Individuelles Mentoring und Coaching

für Deine persönliche Karriereentwicklung
damit Du noch weiter kommst

Mitbestimmung bei Projektauswahl

finde Dein optimales Arbeitsumfeld
mit Deinem Techstack
für hohe Motivation im Projekt

Private Altersvorsorge

mit überdurchschnittlicher Beteiligung
für Wohlstand im Alter

Mobile Massage am Arbeitsplatz

Entspannung und Wohlgefühl
Deine Gesundheit

Jobrad

für Deine Fitness
und moderne umweltfreundliche Mobilität




Jetzt Bewerben



    Kontakte
  

 Andreas Mertens
 E-Mail: andreas.mertens@avameo.de
 Telefon: 0611 181 7739







   Arbeitspensum
  

    Full-time
  



   Dauer der Anstellung
  

    Unbefristet
  



   Industrie / Gewerbe
  

    IT-Consulting
  



   Arbeitsort
  

    Unter den Eichen 5 G-I, Wiesbaden, Hessen, 65195, Deutschland
  



   Arbeitszeiten
  

    Vollzeit
  





     Veröffentlichungsdatum
    

      30. August 2022
    



",Postedvor 11 Tagen,Festanstellung +1,,https://www.indeed.com/rc/clk?jk=bd9dda00ef13951c&fccid=07840dbcc52d64c9&vjs=3
Backend Developer für Daten- & Umweltschutz (m/w/x),Appmelder,Homeoffice,"Unsere Mission 

 Wir bringen Verbraucher und die Umwelt auf Augenhöhe mit Unternehmen, in dem wir die rechtliche Durchsetzung von Privatsphäre und Werbepräferenzen einfach und kostenlos machen. 

 Über Dich 

 Interessen 

 Wir brennen für die Themen Verbraucherrechte & Datenschutz und haben unsere Wurzeln im Umweltschutzbereich. Wir würden uns freuen, wenn Du dich auch mit diesen Themen identifizieren kannst. 

 Zeit 

 Wir wünschen uns jemand, der uns mindestens 2 Tage die Woche, gerne auch länger unterstützt. Vielleicht nutzen wir die ersten paar Monate um uns kennen zu lernen, und entscheiden dann, ob Du mehr Zeit mit uns verbringst oder sogar Vollzeit einsteigst. 

 Aufgaben 

 Aufgaben 

 Wir suchen jemand, der uns in verschiedenen Bereichen unterstützt: 



Mentoring für unsere beiden sehr talentierten Junior Developer
Operative Mitarbeit bei Systemarchitektur und Programmierung
Mitentwicklung der Unternehmens-Strategie
 Qualifikation 

 Wir verwenden Django/Python (+ Django-Rest-Framework) im Backend und arbeiten für interne Prozesse stark mit dem Django Admin-Interface. Wir deployen auf AWS und definieren unsere Cloud-Infrastruktur mit Terraform. Für unsere mobile App nutzen wir Dart/Flutter. Du solltest mindestens drei Jahre Erfahrung als Entwickler haben. Besonders mit Django solltest du dich sehr gut auskennen. Wir sind bei der Entwicklung unserer Software sehr fokussiert auf Qualität, Clean Code und Sicherheit und wünschen uns dies auch von Dir. 

 Benefits 

 Vergütung 


Wir sind für verschiedene Vergütungsmodelle offen: Sei es ein Dein Tagessatz als Freelancer, ein festes Gehalt als (Teilzeit-)Angestellter, Anteile am Unternehmen oder eine Kombination aus allem. 

 Remote First & Flexible Arbeitszeiten 

 Du kannst über Deinen Arbeitsort sehr gerne frei entscheiden. Bis auf sehr wenige Meetings und Kernarbeitszeiten steht es Dir auch frei, zu welchen Zeiten Du dich engagierst.",Postedvor 2 Tagen,Teilzeit +2,,https://www.indeed.com/rc/clk?jk=6543c4ea7e49da5b&fccid=c1019f02bc825d12&vjs=3
"Android Developer January 7, 2019",iRewardHealth GmbH,Berlin,"
Job Title: Android Mobile Developer Standard Weekly Hours: 40 (full-time)  Location: Berlin, Germany

 Who we are
 At iRewardHealth we are looking to make a difference in the world. We are passionate about what we do and are looking to continue building a team that is also passionate, driven, and determined. We are selective in who we bring on as we are a close-knit group, and personality is equally as important to us as technical fit.

 What you bring along

 Experience with the mobile app development lifecycle, including such tools as Android Studio, Fabric, and Fastlane (Bitrise)
 Experience in Java for Android apps
 Ability (and willing) to work in a fast and efficient agile framework.
 To work flexibly and independently to get tasks done as well as designing collaboratively with fellow engineers 
Language skill in english

 Nice-to-have

 Knowledge of the asynchronous, event-based design of RxJava for the Android platform
 Knowledge of mobile app testing best practices
 Experience with the AWS ecosystem


 More About iRewardHealth
 iRewardHealth is a health incentive app with offices in Boston, MA USA and Berlin, Germany. We strive to help companies raise awareness about healthy lifestyles and habits by rewarding employees for logging behaviors. We are a team who believes in the power of the individual. Through our experience we have learned that successful businesses are lead by healthy and fulfilled people.

",Postedvor 30+ Tagen,Vollzeit,,https://www.indeed.com/rc/clk?jk=b750b2c9de57ca82&fccid=68aef78a51f8cd10&vjs=3
Full Stack Developer (m/w/d),Hermes Germany GmbH,Hamburg,"



   In unserer IT stimmt die Chemie: mehr als 300 Spezialist*innen arbeiten daran, unsere Logistiklösungen noch smarter und innovativer zu machen. So entwickeln wir gemeinsam eine der zukunftsträchtigsten Branchen überhaupt. Denn als zweitgrößter deutscher Paketdienst sorgen wir mit unserem flächendeckenden Logistiknetz, neuester Technik und über 6.000 Mitarbeiter*innen dafür, dass jeden Tag mehrere Millionen Pakete genau dort ankommen, wo sie bereits erwartet werden.
   
 Für unser Team Portable Platform Services suchen wir einen Software Entwickler. Das Team ist das Bindeglied zwischen den Teams der mobilen Applikationen für die letzte Meile in der Paketzustellung. Darüber hinaus entwickelt und betreibt das Team eigene Services rund um die mobilen Endgeräte. Hierzu zählen beispielsweise die Mobile Device Security und das Asset Management.
  


Was dich erwartet:


Du stellst innovative Lösungen für 60.000 mobile Endgeräte zur Verfügung
Als Mitglied eines jungen crossfunktionalen und agilen Software-Entwicklungsteams arbeitest du an innovativen Lösungen für unsere Paketzusteller und Paketshops auf der letzten Meile
You build it – you run it: Die Verantwortung für die Anwendungen von der Umsetzung bis zum produktiven Betrieb liegt im Entwicklungsteam
Moderne Cloud-Infrastrukturen in der AWS bzw. GCP bilden die Grundlage für deine resilliente Software
Mobiles Arbeiten/Homeoffice
Freiraum zur Technologie-Auswahl: Zusammen evaluiert ihr neue Technologien und Frameworks, die euch unterstützen
Eine individuelle Weiterentwicklung und themenübergreifender Austausch mit anderen Teams




Was du mitbringen solltest:


Du hast mehrjährige Berufserfahrung als Entwickler
Du entwickelst bereits mit Spring und Kotlin
Du hast Lust zu React-en und hast vielleicht bereits eigene Android Apps geschrieben
Kenntnisse mit Cloud Umgebungen, wie z.B. AWS oder GCP sind ein Plus, aber kein Muss
Du legst Wert auf Security und die Produktqualität
Du verfügst über eine strukturierte Arbeitsweise und die Fähigkeit zielorientiert zu denken und zu handeln
Problemlösungs- und Analysefähigkeiten sowie selbständiges Arbeiten zählen zu deinen Stärken
Du hast Spaß an Teamarbeit und verfügst über eine hohe Kommunikationsstärke
Sichere Deutschkenntnisse runden dein Profil ab
Du hast bestenfalls eine Ausbildung Bereich Informatik erfolgreich abgeschlossen oder verfügst über eine vergleichbare Qualifikation




Was wir dir bieten:


Einsatz führender Technologien und agiler Prozesse
Du arbeitest für einen mehrfach ausgezeichneten Arbeitgeber, dessen Unternehmenskultur geprägt ist durch ein offenes und kooperatives Miteinander
Flexible Arbeitszeiten, nach Absprache auch Homeoffice möglich
Umfangreiches Weiterbildungsangebot
Personalrabatte auf das gesamte Sortiment der Otto-Group
Bezuschussung der HVV-ProfiCard, Altersvorsorge, JobRad, verschiedene Sport- und Freizeitangebote uvm.
Vergünstigte und vielfältige Speiseauswahl in unserer modernen Kantine

 Die Hermes Gruppe bietet vielseitige Arbeitsplätze mit langfristigen Perspektiven und täglich wechselnden Herausforderungen in einer sicheren und zukunftsorientierten Branche. Unser Arbeitsfeld bewegt sich über die Landesgrenzen hinaus: wir sind ein international tätiges Unternehmen und leben eine multikulturelle Arbeitsatmosphäre. Unsere Wertschätzung gilt allen Menschen gleichermaßen - unabhängig von Geschlecht, Nationalität, ethnischer Herkunft, Religion, Behinderung oder sexueller Orientierung.
   
 Logistik bewegt die Welt - beweg dich mit!
  



   Haben wir dein Interesse geweckt? Dann mache jetzt den ersten Schritt und bewirb dich gleich online bei uns oder informiere dich auf unserer Homepage.
  




Emre Ünal
 HR Manager Recruiting





Michael Kunze
 Teamleader Portable Platform Services


",Postedvor 30+ Tagen,Vollzeit,,https://www.indeed.com/rc/clk?jk=24dd550a6461dd30&fccid=f29a37c685359049&vjs=3
Mobile Developer,Safety io,Berlin,"
Who we are…?
 Safety io provides cloud-based/IoT solutions for the live monitoring of workforces in hazardous areas; fleet management for market-leading MSA safety products; on-scene monitoring for the global fire service; and many other compelling products and services. We are an international company with offices in Germany and the USA. Our parent company, MSA, is an international company, employing about 5000 people, operating all over the globe.
  What we are looking for?
 We are looking for Software Developers to join our team. In an agile and cross functional team you will help to
 improve and grow the Safety io FireGrid mobile app eco system. You will contribute to the health and safety of
 firefighters all around the world.
  Responsibilities:

Being part of a cross functional team of different domain experts
 Develop, release and monitor features for the Safety io FireGrid app eco system
 Use continuous delivery practices to improve software delivery speed and quality
 Constantly improve processes and services

Experience
 Junior

 Fluent in at least one programming Language, preferably C#/Kotlin/Swift/Dart
 Bachelor's Degree in Computer Science/Engineering or comparable
 Experience in Software as a Mobile Developer is a plus


 Senior

 Experience in working with cross-platform frameworks (Xamarin.Forms is a plus)
 Test automation using Appium
 Communication protocols for connecting to external hardware (BLE/BTE)
 Amazon Web Services
 CI/CD

What we offer?

A startup-like environment with the backing and security of a market leader over 100 years old
 Meaningful projects that make a difference — at Safety io, you will save lives
 Flat company hierarchy & modern agile structure with a culture that embraces diversity, individual input, and knowledge sharing
 Flexible working hours and possibility of home office
 Fantastic work / life balance
 Competitive salary
 Free BVG Travel Pass or “Jobrad” bicycle
 Opportunity to attend conferences and provided learning tools
 Contributions to language courses (e.g. German)
 Modern office spaces and an international team

",Postedvor 30+ Tagen,,,https://www.indeed.com/rc/clk?jk=f96e3850324dd118&fccid=972bdf78d8a53948&vjs=3
Senior Mobile Developer (m/f/d),trinamiX GmbH,Ludwigshafen am Rhein,"
RESPONSIBILITIES
 

In your position as a Senior Mobile Developer you design and implement a framework for our mobile spectroscopy solution to be used in native android and iOS mobile applications. 
Furthermore, you contribute to the development of the trinamiX spectroscopy mobile apps. 
You use your experience to shape the technology behind our products and make them ready for large user numbers. 


QUALIFICATIONS
 

degree in the field of computer science or a comparable training 
at least 3 years experience in Android app and framework development 
proficient knowledge of Kotlin (multiplatform) and C# 
willingness to work in an agile environment within a highly motivated team 


BENEFITS
 

We combine the agility of a startup with the stable cash flow, infrastructure and benefits of a multinational corporation. 
An attractive salary based on business success and your individual performance while working on an exciting, revolutionary technology. 
Mobile working and work-life balance, so you can organize your working day and your private life more flexibly to better combine them. 
We offer a culture of learning, individual career paths, feedback discussions and the opportunity to develop your career. 
You will be part of a highly professional, diverse and supportive team with a positive work culture that is at the forefront of technology innovation. 


ABOUT US
 We are stepping up to change the world!   trinamiX is a high-tech company developing innovative solutions in the fields of biometric authentication and mobile NIR spectroscopy. Through them, we are completely redefining the boundaries of what is possible for industrial customers and consumers alike - whether it is the security of personal data, the ability to conserve natural resources, or the shaping of one's own health.   To do this, we harness the hidden world of data around us and work closely with strong partners from a variety of international markets, including the smartphone and automotive industries.   Headquartered in Ludwigshafen am Rhein, trinamiX GmbH was founded in 2015 as a wholly owned subsidiary of BASF SE. While we live the spirit of a high-tech startup, we are supported by one of the world's leading chemical companies. As a result, more than 200 employees worldwide work operationally independently while being able to rely on the security, expertise and experience of the BASF Group.   We are looking for highly motivated, enthusiastic people to join our team and change the world together with us!   First information about our application process can be found here: http://on.basf.com/applicationprocess.  Do you have any questions about the application process or the position? Please reach out to: Larissa Wiedenroth, larissa-anna.wiedenroth@basf.com, Tel.:+49 30 2005-56384
 At BASF, the chemistry is right. Because we are counting on innovative solutions, on sustainable actions, and on connected thinking. And on you. Become a part of our formula for success and develop the future with us - in a global team that embraces diversity and equal opportunities irrespective of gender, age, origin, sexual orientation, disability or belief. 
 
 Please note that we do not return paper applications including folders. Please submit copies only and no original documents. 
 
 Please upload the documents, summarized in a PDF if possible.
",Postedvor 16 Tagen,Festanstellung,,https://www.indeed.com/rc/clk?jk=afb0929a2707eb90&fccid=3d4f3b259ee912f7&vjs=3
Fullstack Developer (w/m/d),MCA Engineering,München,"
Ich bewerbe mich




 MCA ist ein internationaler Akteur in der Ingenieurs- und Hightech-Beratung. 
Unser Know-how und unsere Erfahrung haben wir seit über 25 Jahren in vielen Branchen gesammelt und dies macht uns zu einem anerkannten Partner unter den weltweit größten Industrieunternehmen.








 Please read the required qualifications carefully and note that fluency in German language is a requirement.
 Ihre Rolle an unserer Seite

 Usability Design, Modellierung, Programmierung und Test im agilen Umfeld
 Pflege und Weiterentwicklung bestehender Produktkomponenten
 Web-Komponentenbasierte Produktentwicklung für Bedienoberflächen (AngularJS, Angular2, NodeJS, ExpressJS)
 Modernisierung und Neuentwicklung von UIs entlang Googles Material Design Richtlinie
 Beschreibung und Absicherung der Funktionalität mit BDD-Techniken
 Spezifikation, Implementierung und Integration von öffentlichen Schnittstellen zusammen mit internen und externen Partnern

 Ihr Profil

 Dipl./Msc. Informatik, Computer Science, Elektro- und Informationstechnik o.ä. oder ein abgeschlossenes Bachelorstudium mit entsprechender Berufserfahrung
 Berufserfahrung in der Full-Stack-Entwicklung, idealerweise mit AngularJS, NodeJS, SASS, Jade/Pug, Jasmine, ES6, Typescript, Python, MongoDB, Elastic, o.ä.
 Kenntnisse in objektorientierter Entwicklung, Java, XML, JSON, Linux, Git, Eclipse, o.ä.
 Gute Kenntnisse der Programmierung für smarte, mobile und Web-Endgeräte (HTML5, Android, Xamarin, Angular) wünschenswert
 Verhandlungssichere Deutschkenntnisse und fließende Englischkenntnisse vorausgesetzt

 Was wir zu bieten haben? Eine ganze Menge!

 Abwechslungsreiche Projekte bei renommierten Industrieunternehmen
 Traumkarriere: Individuelle Förderung und Weiterbildungsmöglichkeiten
 Work-Life-Balance (u.a. Home Office, Events)
 Betriebliche Altersvorsorge
 Zahlreiche Mitarbeiterrabatte

 Ihre Entwicklungsperspektiven

 Wir möchten mit Ihnen langfristig zusammenarbeiten! Unser erstes Ziel ist daher Ihr Erfolg – damit Sie die vielfältigen Möglichkeiten, die wir zu bieten haben, ergreifen können. Mit der Zeit können Sie in andere Tätigkeitsbereiche wechseln oder auch intern, z.B. in Teamleiterpositionen, aufsteigen. Bei Interesse bieten wir Ihnen auch gerne Stellen in unseren europäischen Tochtergesellschaften an




",Postedvor 30+ Tagen,Festanstellung,,https://www.indeed.com/rc/clk?jk=dc90c1f2e5bcb6ae&fccid=8a2125c3dc707544&vjs=3
Frontend Developer,SAG Digital Innovation GmbH,Homeoffice,"
Wir, die SAG Digital Innovation GmbH, eine 100% Tochtergesellschaft der Swiss Automotive Group AG (SAG), bauen einen Digital Hub in der Medienstadt Köln sowie ein Finance Office in der bayerischen Metropole München auf.
 Die SAG zählt zu den führenden Unternehmen in Europa im unabhängigen Autoersatzteilehandel und bietet eine breite Dienstleistungspalette für den Automotive Aftermarket in der Schweiz und in 12 europäischen Ländern an.
 Wir konzipieren, entwickeln und betreiben Webshop-Plattformen und Apps für die europäischen SAG Gesellschaften, die es ihnen ermöglichen, ihre Produkte zu vermarkten und neue Use Cases zu erschließen.
 Um die digitale Entwicklung der SAG auf das nächste Level zu bringen, suchen wir Talente, die motiviert sind, diesen Weg mit eigenen Ideen gemeinsam zu gestalten.


 Unsere Werte
 Wir möchten mit der Gründung des SAG Digital Hub einen nächsten Schritt in eine moderne und agile Unternehmensorganisation gehen. Wir möchten mit Dir ein wertschätzendes Arbeitsumfeld, eine offene Unternehmenskultur aufbauen sowie Dir Möglichkeiten für Deine fachliche und persönliche Entwicklung eröffnen.


 Unsere Mission
 Wir wollen mit Unternehmergeist und digitalen Lösungen neue Kundengruppen erschließen und Automotive Aftermarket-Champion werden!
 Wir bauen mit dem SAG Digital Hub ein Start Up auf, in dem Du mit Deinen Produkt- und Entwicklungs-Team Kollegen die Freiheit lebst, Innovationen zu denken und zu produzieren. Die Start Up Atmosphäre wird geprägt sein, durch ein professionelles, agiles, kreatives und innovatives IT-, Produkt- und Marketing-Umfeld. Deine Aufgaben 
 
Du machst es zu deiner persönlichen Mission unseren Online-Shop, ATP-Autoteile mit ca. 40 Mio. € Jahresumsatz zu Europas führender Adresse für Autoteile zu machen
Du übernimmst gemeinsam mit dem Product Owner und dem UX-Designer die Neugestaltung unseres Shops auf Basis der Erkenntnisse aus unseren A/B-Tests und Web-Analytics
Du verbesserst unseren Shop in Bezug auf Performance, Wartbarkeit und Erweiterbarkeit
Du teilst unser hohes Qualitätsverständnis, hilfst bei Code-Reviews und schreibst automatisierte Tests
Dein Profil 
 
Du verfügst über mehrjährige Erfahrung als Frontend-Entwickler und hast bereits digitale Produkte in einem agilen Umfeld erfolgreich umgesetzt
Du hast eine Affinität für das Frontend und weißt, was es bei der Umsetzung hinsichtlich Performance, Cross-Device-Kompatibilität usw. zu beachten gilt
Die Vorteile agiler Arbeitsweisen ist dir vertraut und du hast Lust dein Arbeitsumfeld weiterzuentwickeln und mitzugestalten
Du hast Spaß an neuen Technologien und kannst dich in diese schnell einarbeiten
Du sprichst fließend Englisch
Unser Angebot 
 
Spannende & eigenverantwortliche Projekte in einer dynamischen, sich transformierenden Branche mit starkem Wachstum
Eine Arbeit, die auf Vertrauen, Eigenverantwortung und Feedback basiert
Motivierende, inspirierende Arbeitsatmosphäre und ein vertrauensvolles Miteinander
Agile Arbeitsprozesse und Strukturen
Unbefristeter Arbeitsvertrag
6 Wochen Erholungsurlaub & 2 extra Tage Urlaub an Karneval
Flexible Arbeitszeiten & Mobile Office
Garantiertes Weiterbildungsbudget, persönliche Entwicklungsmöglichkeiten
Betriebliche Altersvorsorge
Regelmäßige Teamevents

Du hast Lust, diesen Weg gemeinsam mit uns zu gestalten?
 Dann bewirb Dich!
",Postedvor 17 Tagen,Festanstellung,,https://www.indeed.com/rc/clk?jk=a501da4e1371eeb2&fccid=5836677f58522a64&vjs=3
