job_title,company,location,job_summary,post_date,more_info,salary,job_url
Junior Hue Mobile App Developer,Signify,Eindhoven,"

  Job Title
  Junior Hue Mobile App Developer
 

   Job Description
 


    Want to work on the world’s leading smart home lighting system? Join the global development team of Philips Hue as a Junior Mobile App Developer.
  


    Working for Signify means being creative and adaptive. Our culture of continuous learning and commitment to diversity and inclusion creates an environment that allows you to build your skills and career. Together, we’re transforming our industry.
  


    As the world leader in lighting, we’re constantly ahead of the curve. Through our leadership in connected lighting and the Internet of Things, we’re breaking new grounds in data analytics, AI, and smart homes, offices, cities and more!
  


    Signify is one of the few companies in the world to achieve carbon neutrality and our next sustainability goals are even bolder: doubling our positive impact on the environment and society by 2025.
  


    We’re on the lookout for forward-thinking innovators with a passion for sustainability. If you match this description, get in touch!
  



   What you’ll do
 






       Join the R&D team in Eindhoven working on new features for the Hue mobile application.
     


       Expand and improve the feature set of our mobile apps build with the Flutter framework (Android and iOS) through prototyping, implementation, and launch.
     


       Contribute to the design and architectural decisions of complex App features that connect with cloud and embedded components.
     


       Perform data analytics, analyze issues, and identify improvement opportunities.
     





   Your qualifications
 






       A fresh graduate in computer sciences (or related) with some previous internship experience in the relevant fields.
     


       Experience with mobile app development for iOS and/or Android. Experience with Dart is a plus.
     


       Experience with the publication process of Apple and/or Google.
     


       Have good analytical and problem-solving skills to write scalable, well tested and clean code. Being familiar with functional and reactive programming principles is a plus.
     





   What you’ll get in return…
 






       An unique experience in designing software for one of the leading smart home systems in the world. Right here, in the Netherlands!
     


       Have fun working in a passionate team that enables the coolest features for Philips Hue.
     


       Extensive set of tools to drive your career, such as a personal development budget, free training and coaching.
     


       Competitive salary depending on experience.
     


       A variable bonus based on both Signify results and personal performance.
     


       25 Days of holidays and the possibility to purchase up to 20 extra days off annually.
     


       Solid company pension scheme and attractive collective health insurance package.
     


       Opportunity to buy Signify shares and products with discount.
     





   We’re offering multiple opportunities for career development, like mentoring, coaching and stretch assignments, with strong international exposure for dynamic profiles. Learning is fundamental to our culture. Through continuous learning, we are transforming the industry. You have the chance to learn every day, acquire new skills and perspectives through customized online programs, and on-the-job experiences.
 


   See 
  
   #SignifyLife
   through the eyes of our employees!
 

 Who we are
 

   Signify is the world leader in lighting. We provide professional customers and consumers with quality, energy-efficient LED lighting. And our lights, when connected, bring data to devices, apps and people – redefining what light can do and how you use it. Today, our innovations, such as LiFi – internet connectivity through light – and UV-C, solar and horticultural lighting, contribute to a safer, smarter, more sustainable world. We’re operating in 74 countries with 32,000 people worldwide.
 
",PostedMeer dan 30 dagen geleden geplaatst,Voltijds +1,,https://www.indeed.com/rc/clk?jk=bfa44c5f9e4b0283&fccid=a745863897d3e6ba&vjs=3
Android/Kotlin Developer,AMDAX,Postcode 1082 in Amsterdam,"
Wil je graag samen met ons pionieren in het crypto domein en zie je de uitdaging van deze rol? Dan willen we graag met jou kennis maken! 
AMDAX zoekt een ervaren Android/Kotlin Developer die binnen ons groeiende Products & IT-team een rol gaat spelen voor de toekomst van onze mobile app. Samen met onze iOS developer speel je een enorm belangrijke rol bij de verdere ontwikkeling van onze diensten via de app. Er is daarom veel ruimte voor jouw eigen input.

 Wat ga je bij AMDAX doen? Als Android/Kotlin Developer maak je impact doordat jouw werk direct zichtbaar is voor de organisatie en de eindgebruikers. Onze app staat nog relatief in het begin van de ontwikkeling en het implementeren van nieuwe features en mogelijkheden zullen voornamelijk door jou (in samenwerking met het development team) verder ontwikkeld worden.
 De app geeft eindgebruikers inzichten in balansen en transacties in de crypto posities. Ook het uitvoeren van orders is een belangrijke feature. Verder is het belangrijk om eenvoudig in contact te treden met Amdax, waarvoor bijvoorbeeld Chat wordt geimplementeerd. De app wordt gebouwd op basis van verschillende design principles, zoals persoonlijk & exclusief als begeleidend en transparant. Dit gebeurt in samenwerking met UX/UI experts.
 Je bent als developer betrokken bij het hele proces: van concept tot technisch ontwerp, van het programmeren tot het testen. Er is veel ruimte voor jouw eigen input, je hebt dus echt de mogelijkheid om hier het verschil te maken. Hieronder jouw belangrijkste taken:

 Het ontwikkelen en optimaliseren van nieuwe en bestaande Android apps in Kotlin;
 Je werkt samen met het development team o.a. bestaande uit iOS, Back-end, UX&Design en Product Owner;
 Je deelt je ervaringen tijdens de weekly check-ins en stand-ups met het team;
 Je ondersteunt de Tech Lead met het coachen van de junior developers binnen het team;
 Je denkt mee aan de standaard Android/Mobile coding guidelines.

 Wat we jou bieden

 €4.500 - €6.500 bruto p/m, afhankelijk van jouw kennis en ervaring
 8% vakantiegeld
 Variabele beloning
 25 vakantiedagen
 Laptop en headset
 AMDAX participatieregeling; word zelf ook aandeelhouder van AMDAX!
 Pensioenregeling in bitcoin
 Reiskostenvergoeding incl. NS Business Card en/of leasefiets regeling
 Flexibiliteit om vanuit huis te werken
 Goede ontwikkel- en opleidingsmogelijkheden

 Over AMDAX
 AMDAX (2019) is het eerste Nederlandse cryptobedrijf dat een registratie ontving van De Nederlandsche Bank. Met cryptodiensten helpt AMDAX het vermogen van klanten te behouden en te laten groeien. Diensten met cryptovaluta zijn nodig, omdat de financiële wereld verandert. Stijgende inflatie en een negatieve spaarrente zorgen ervoor dat we 'slapend arm' worden.
 De diensten van AMDAX doorbreken die negatieve trend. Wij geloven in een decentrale financiële toekomst. AMDAX wil Bitcoin en andere digitale assets tot een logisch onderdeel maken van ons dagelijks leven. Voor ons is verantwoord investeren in bitcoin en andere cryptomunten dan ook investeren in de technologie van de toekomst. Als vaste partner van de BNR Cryptocast draagt AMDAX naast diensten, ook met kennisdeling bij aan de ontwikkeling van het financiële systeem van de toekomst.
 Je leest het: AMDAX is voortdurend in beweging en groeit hard. In het vermogen dat we beheren, maar ook in het aantal nieuwe collega's dat we verwelkomen. Samen pionieren we in het cryptodomein en dat zorgt voor een energieke en inspirerende sfeer op kantoor.

 Solliciteren
 Mocht deze functie goed bij jou passen, stuur dan ons jouw CV met een korte motivatie. We reageren snel, dus je hoeft niet lang in spanning te zitten!
 Als we op basis van jouw sollicitatie zien dat je wel eens een nieuwe Amdaxied zou kunnen zijn, dan nemen we contact op om een afspraak te maken voor een interview. 
In de regel hebben we met elke kandidaat 2 gesprekken. We werken ook met een persoonlijkheidstest en afhankelijk van de functie is er ook een assessment, test of case die je moet maken. Als daar sprake van is laten we je dat meteen aan het begin van het proces weten.
 Wat we van je vragen

 Voor de functie van Android/Kotlin Developer vragen we het volgende van je:

 HBO/WO werk- en denkniveau
 Minimaal 3 jaar relevante werkervaring als native Android Developer
 Ervaring met Kotlin is een must;
 Je bent gewend om zelfstandig te werken, maar ook om nauw samen te werken met verschillende disciplines binnen een Scrum team.
 Je hebt een proactieve houding;
 Goede beheersing van de Nederlandse en Engelse taal
 Zelfstandig, praktisch, oplossingsgericht, analytisch en communicatief sterk
 Fulltime beschikbaar


",Posted25 dagen geleden geplaatst,€ 5.500 - € 7.000 per maandVoltijds,€ 5.500 - € 7.000 per maand,https://www.indeed.com/rc/clk?jk=e58d17cdbcde69fe&fccid=76293eb9090e1e43&vjs=3
Traineeship: Developer (Mobile / SAP),Ideo B.V.,Thuiswerken in Den Bosch,"Job Alert! Digital natives opgelet: 
Ideo is op zoek naar trainees. Niet zomaar trainees. We zoeken hét toekomstige talent van de IT-branche. De meest innovatieve bedrijfssector van dit moment. Bij ons werk je in een dynamische omgeving – bij de klant, vanuit ons kantoor en vanuit huis – aan IT-projecten. Daarbij ben jij de persoon die als developer ervoor zorgt dat de processen van de klant nog efficiënter worden.
Droom jij van een baan als IT-professional en ben je er klaar voor om hier je werk van te maken via een IT-Traineeship? Ben jij nieuwsgierig aangelegd en heb je de wil om grenzen te verkennen en ze te verleggen? Ben jij iemand met een analytische geest en een kritische blik? Start dan vandaag nog het traineeship: Developer bij Ideo. Dit IT Traineeship is dé manier om op een leuke en leerzame manier opgeleid te worden tot developer binnen de SAP wereld.
Hier draait het om: jij gaat samen met ervaren collega’s Field Service en Asset Management processen bij onze klanten verbeteren met behulp van slimme IT technologie. Onze klanten zijn grote bekende merken en stuk voor stuk leiders in hun industrie. Een betere uitdaging en carrière ervaring kan je je niet wensen.
Jij gaat leren hoe je nieuwe ideeën, de beste oplossingen met de nieuwste technologieën zo slim mogelijk kan inzetten in de nieuwe cloud omgeving van SAP. Met dit IT-Traineeship leiden we je op tot Young Professional of wel developer met specialisatie op SAP S/4HANA (het ERP systeem van SAP), SAP Business Technology Platform (het technologische cloud platform van SAP) en/of mobile apps. Je maakt kennis met SAP, de technology van SAP en met de mobiele apps van SAP en natuurlijk met alle ontwikkeltools die hierbij horen. Na dit geweldige traineeship kan je als ware developer doorstromen naar de functie: Junior Consultant, en uiteindelijk naar Medior Consultant en Senior Consultant.
Maak impact met baanbrekende oplossingen
Jij realiseert tastbare oplossingen voor onze klanten om hun efficienter in te richten. Je denkt samen met de SAP Consultants de oplossing uit en zorgt voor de realisatie. Met de technische kennis die je op doet ben jij in staat om de wensen van de klant te vertalen naar werkende technologische hoogstandjes. Dit doen we natuurlijk samen, want je gaat het leren van de besten uit het vak. Je gaat sparringpartner voor onze SAP consultants en klanten worden en denkt mee over de inzet van nieuwe technologieën, zoals Big Data, Machine Learning en IoT, om daarmee Field Service management processen en Asset Management processen verder te optimaliseren en zo de waarde van elke klant interactie te optimaliseren. Bij Ideo word je ingezet bij een klant, waarbij je zult werken op diverse uitdagende projecten. Je werkt in een team met gedreven en ervaren collega’s die jou begeleiden en opleidingen, waarbij jij als developer de ruimte hebt om jezelf te ontplooien op jouw interessegebieden.
Wie is Ideo?
Ideo is een IT-consultancy bedrijf en expert op het gebied van service- en onderhoudsprocessen. Wij adviseren bedrijven hoe zij hun service- en onderhoudsprocessen zo optimaal mogelijk kunnen inrichten met behulp van software van SAP, Salesforce en ClickSoftware, met een focus op planning en mobiele vraagstukken. Onze klanten zijn grote nationale en internationale organisaties. We zijn een hecht team van ondernemende professionals met een voorliefde voor technologie.
Locatie: Den Bosch
Wat kan je verwachten van ons?
Ideo kent een platte structuur met korte communicatielijnen. Wij zijn een informele organisatie en hebben een open en collegiale werksfeer. We zijn ervan overtuigd dat de persoonlijke ontwikkeling van onze medewerkers in hoge mate de kwaliteit van Ideo bepaalt. Vandaar dat Ideo haar medewerkers alle mogelijkheden biedt om dit te verwezenlijken, waaronder passende opleidingen en trainingen. Wil jij expert worden binnen 1 technologie dan is de route naar een expert consultant een logische route. Ligt je passie meer in het gehele landschap dan ben je wellicht meer een full stack ontwikkelaar of een technische architect. Ligt je kracht meer in de afstemming met de klant dan is een route als solution architect of consultant een logisch vervolg. Er is een zeer laag verloop van medewerkers door de mogelijkheden die Ideo biedt op het gebied van ontwikkeling, flexibiliteit, leerzame en uitdagende projecten.
Arbeidsvoorwaarden

Je kan een goed salaris verwachten
Je krijgt een auto van de zaak of een reiskostenvergoeding
Goede flexibele pensioenregeling (3/4 deel betaald door Ideo)
Laptop en mobiele telefoon
Ruim opleidingsbudget
Fijne collega’s
Uitdagende projecten
Uitstekende begeleiding en coaching van je collega’s
Aan de slag in een inspirerend, mooi en modern kantoor

Wie zoeken wij?

Je bent schoolverlater of je hebt bij voorkeur 1 of 2 jaren werkervaring op de IT afdeling bij een bedrijf waarbij je eventueel ook betrokken bent geweest bij implementatie van software
Je beschikt over een HBO of WO IT opleiding
Je bent klantgericht en communicatief vaardig
Je werkt graag in een team, zowel bij de klant als bij ons op kantoor
Je bent klantgericht en communicatief vaardig
Je wilt in de ICT aan de slag en wilt je kennis up-to-date houden in deze snel veranderende wereld
Je bent flexibel ingesteld en vindt het leuk om ook bij de klant op locatie te zijn


Je bent proactief en resultaatgericht


Je werkt gestructureerd, bent analytisch en accuraat
Je bent de Nederlandse en Engelse taal machtig

Voldoe jij aan dit profiel en heb je interesse in dit uitdagende traineeship?
Wacht dan niet langer en neem direct contact op met HR Manager Tanja Zavodna via 06 – 824 565 89.
Acquisitie naar aanleiding van deze vacature wordt niet op prijs gesteld.
Soort dienstverband: Fulltime 32 tot 40 uur, bepaalde tijd met uitzicht op vaste aanstelling
Soort dienstverband: Voltijds, Deeltijds, Vaste baan, TijdelijkContractduur 12 maandenParttime uren: 32-40 per week
Salaris: €2.875,00 - €3.400,00 per maand
Rooster:

Dagdienst

Secundaire arbeidsvoorwaarden:

Auto van de zaak
Bedrijfsfeesten
Bedrijfsfitness
Budget voor professionele ontwikkeling
Kerstpakket
Pensioen
Reiskostenvergoeding
Telefoonplan
Vrijdagmiddagborrel
Werk vanuit huis

Soorten aanvullende vergoedingen:

Bonusregeling
Overuren uitbetaald
Vakantiegeld
",Employer15 dagen geleden actief,€ 2.875 - € 3.400 per maandVaste baan +3Overwerk +1,€ 2.875 - € 3.400 per maand,https://www.indeed.com/company/Ideo-B.V./jobs/Traineeship-97f499ccbb36f433?fccid=2366f8622189e8ce&vjs=3
Junior Software Developer,PVH Mobile Automation B.V.,Prinsenbeek,"Bedrijfsomschrijving
Als Developer ga je aan de slag om voor onze eigen hard- en softwareproducten tooling en nieuwe functionaliteiten te implementeren. Voor onze klanten maken we maatwerk oplossingen en producten daar verbind je de electronica met de online platformen en ontwikkel je user interfaces en backend systemen (met cloud technologie).Je komt in aanraking met diverse technologieën, tooling en frameworks zoals: C#, F#, Elm, TypeScript, Html, Css, Postgres, C , C++. Je bent gemotiveerd om deze te leren en/of je daar verder in te ontwikkelen. Je gaat versiebeheer, test driven development en continuous integration toepassen om goede kwaliteit te leveren. Naast het implementeren, draag je ook zorg voor het uitrollen en onderhouden van de ontwikkelde software.

betrokken bij alle fasen van het product- en software ontwikkelingsproces;
vertalen van specificaties naar een softwareontwerp en realisatie vanuit een klant- en gebruikersgedreven benadering;
ontwerpen, implementeren van diverse oplossingen in een multidisciplinair team van elektronica-, embedded-, front-end- en backend-engineers;
kwaliteitscontrole o.a. aan de hand van design- en code-reviews, en het schrijven van unit- en integratietests;
je hebt persoonlijk contact met klanten als OEM’ers en machinebouwers;
samenwerken met ervaren collega’s die jij durft uit te dagen en die jou begeleiden.

Wat breng je mee?

werkervaring op het gebied van front-end en/of software ontwikkeling;
een relevante HBO studie of gerelateerde opleiding in het vakgebied gevolgd;
bekendheid met één of meerdere programmeertalen is mooi meegenomen maar niet noodzakelijk: C#, F#, Elm, C, C++;
interesse voor de verschillende facetten van productontwikkeling;
je bent zelfstandig en proactief;
je bent gemotiveerd om te groeien in je vakgebied;
je hebt een positief kritische houding en weet collega’s te inspireren.

Wat bieden we jou?
Een uitdagende werkomgeving met hoogwaardige en vooruitstrevende technologie bij een jong en snelgroeiend bedrijf. In jouw rol bij PVH Mobile Automation kun je impact maken, echt van waarde zijn en jezelf daarbij verder ontwikkelen. PVH Mobile Automation staat voor.

prima arbeidsvoorwaarden;
een open werkomgeving met o.a. flexibele werktijden en thuiswerkmogelijkheden;
vrijheid in het organiseren van je eigen werk;
een uitdagende en dynamische werkomgeving;
coaching en een eigen opleidingsprogramma dat je persoonlijk en vakinhoudelijk continu helpt te ontwikkelen;
werken in een multidisciplinair team.

Soort dienstverband: Voltijds, Deeltijds
Salaris: €2.600,00 - €6.000,00 per maand
Rooster:

Flexibel werkrooster
ma-vr

Secundaire arbeidsvoorwaarden:

Flexibele werkuren
",Employer3 dagen geleden actief,€ 2.600 - € 6.000 per maandDeeltijds +1Flexibel werkrooster +1,€ 2.600 - € 6.000 per maand,https://www.indeed.com/company/PVH-Mobile-Automation-B.V./jobs/Junior-Software-Developer-8f5e5168dccbe643?fccid=a9fd3f6dfa803c3c&vjs=3
Mobile Developer,APG,Hybride werken in Amsterdam,"




Dit wordt je functie



Ben jij de onderzoekende DevOps Engineer met een voorliefde voor hands on realisatie van echte toegevoegde waarde. Pas jij niet in een (functie)hokje, maar creëer je je eigen plek en omgeving? Dan ben jij wellicht de Mobile Developer die wij zoeken voor de job bij de Valuestream Concepting & Experimenting (C&E).  De Valuesteam Concepting & Experimenting is onderdeel van de Business Improvement & Change organisatie en bestaat uit zo’n 30 medewerkers, die in zowel Amsterdam als in Heerlen aanwezig zijn. Voor locatie Heerlen of Amsterdam zijn we op zoek naar een ontwikkelaar.  Binnen de functiefamilie DevOps Engineer ben je als Flutter ontwikkelaar verantwoordelijk voor het ontwerpen, realiseren en beheren van Apps. Als C&E ontwikkelaar ben je werkzaam in een omgeving van nieuwe technologie. Je maakt gebruik van deze moderne methoden, technieken en werkwijzen om met name front-end applicaties en apps te realiseren. Je bent communicatief en sociaal.









Dit breng je mee




Informatica (software engineering) of gelijkwaardig;
 Functionele en technische kennis van iOS en/of Android;
 Kennis en ervaring met Flutter en Dart, kennis van andere mobile frameworks (bvb React Native) is een pré;
 Kennis en ervaring met Git is een pré;
 Kennis en ervaring met CI/CD pipelines in Azure Devops is een pré;
 Minimaal 5 jaar ervaring als software ontwikkelaar;
 Minimaal 2 jaar werkervaring met ontwikkeling van mobile apps;
 Ervaring opgedaan in een Agile werkomgeving (Scrum, Safe, Kanban);
 Goede beheersing van de Nederlandse en Engelse taal, zowel mondeling als schriftelijk;
 Een onderzoekende houding;
 Positief kritische instelling;
 Oplossingsgericht;
 Stevig in je schoenen, ook als een experiment niet lukt.









Hier ga je aan de slag



      We bieden je een bruto salaris van maximaal € 5.350 (38 uur) schaal 9 en mooie arbeidsvoorwaarden gericht op flexibiliteit, zoals:
      


Een gegarandeerde eindejaarsuitkering van 8,33%;
Veel aandacht voor jouw vitaliteit en persoonlijke ontwikkeling;
Hybride werken: thuis én in één van onze prachtige kantoren;
En uiteraard een goed geregeld pensioen.

 Voor pensioenuitvoerder APG gaat pensioen over mensen, leven en samenleven. Met zorgvuldig vermogensbeheer, pensioenadministratie, communicatie en advies wil APG meehelpen aan een leefbare toekomst waarin we welvaart en welzijn eerlijk en duurzaam samen delen. Voor huidige en toekomstige generaties. Voor nu, straks, en later.
       APG zet zich in voor 4,7 miljoen mensen in Nederland. Daarom vinden wij het belangrijk om ook een afspiegeling te zijn van de Nederlandse maatschappij. Dat betekent dat APG streeft naar een inclusieve werkomgeving, waarin iedereen zichzelf kan zijn én waarin iemands unieke kwaliteiten omarmd worden.
       Als je kiest voor APG, kies je voor een baan waarin je bijdraagt aan een mooie toekomst. Solliciteer dus nu!
     




",PostedMeer dan 30 dagen geleden geplaatst,Tot € 5.350 per maand,Tot € 5.350 per maand,https://www.indeed.com/rc/clk?jk=fbc2dfc926710d88&fccid=113bb7f6362ec380&vjs=3
Mobile App Developer,Dexels BV,Postcode 1031 in Amsterdam Noord,"

Dexels is looking for developers to work on a wide range of Android and iOS apps for the sports, events and entertainment sectors.
 You are an eager and autonomous developer with a passion for developing for mobile platforms. You know that writing excellent and clean code is essential for successful software. You are able work well in a group but are also able to plan, manage and develop individual projects.

 Functieomschrijving
 You will work on the development cycle of our iOS and Android apps, including prototyping, validation, implementation, launch and support. You will work within a group of highly skilled software engineers but you will also work individually on projects
 Wij vragen

 BS in Computer Science or equivalent
 3+ years experience in software development
 A strong conceptual understanding of User Interfaces
 Proven track record of developing high performing mobile apps
 Experienced with Java, iOS, Swift, MySQL
 Understanding of version Control (Git)


 Wij bieden
 An inspiring work environment with plenty of career opportunities. At Dexels you get every opportunity to show your talents as a developer and to develop further! Dexels employees belong without a doubt to the upper-class software architects and developers in the Netherlands. 85% of them have relevant university degrees and/or bachelor degrees in computer science.
 Ben jij geïnteresseerd in bovenstaand profiel? 
Dexels BV ziet graag jouw sollicitatie tegemoet! Door middel van het klikken op de solliciteerbutton kom je in een overzichtelijk sollicitatiescherm waar je direct kan reageren op de vacature van Mobile App Developer.
",Posted12 dagen geleden geplaatst,,,https://www.indeed.com/pagead/clk?mo=r&ad=-6NYlbfkN0DOA4tO99L-MhY6gQC2OUHal7OK87CicMfZT7oQ9CaZWa4kUd-uAoc74gd1Bmh5J1USGN61woDqIaIkBoZfIlmVYFY4z0mlgPCre5EkQQ5XZnuqIPNPzIVDweXevNpKTYyek8UL-gOn2NEdm0LgLLeX7bhVt5_CqV9CCVduTJn46YafDD2slEywb_H43IaK_-OuwFx6LrpyFyBv3Sz6gm0bE6M__mA7R2aj95bFAVfidTgYQUkZzDfMqYIiQhYf8G_QL_5rm98FzdpXAIo43KxU2KAQodFpzqi-2-awTLvG8yoRGa6boLgB668rXM05gBfhWCFSDFYKqTDd9BegXVO4sE-jKCqY9MIGhCEA2GaAoro1OlUEO9Kc140L5TF3-1gbmrji00qSlwy5m4pUZIrKMzcaYBIhowFz9_bH0l-J1BwZ-N3Gc9frT9uzmm4aK-RooDILzZ72P_RrUcs_HZsDknNl3si8O_wUGg1aPcuN5YqyQq2Fovzl9HkzB6Ud47RD9O3z5JgwtXB8e4OXS9jF7oa2XuieWQKhHiSpFennzMp2H90zM0tPy5P23LMCyfDk3Extm5vl8TY2qB_xhX8sA1nrKibW41brcMOGoUXf7YEXoRlGER3a90khFJk9tOLaOrcIf2j9g8KJv_IuikBlAI7LQlpTysexTRy009gLhflRMEuu4t5KUQEaRSBNIbtTxiK6AQVEoXc6UI_P1ayCu0aUkZKbU9fZvke_PANAgwcBaond679lGFH5Qm57tpYZFiFd9jLGtfmcbjjpfNcrBin3M1NmcS2tYnQT_AMHbEtyUJx_ZrOOLskNXvN0lKGNlO3Z3ynvHA==&xkcb=SoBj-_M3ZBVGkTynQR0JbzkdCdPP&p=2&fvj=0&vjs=3
