job_title,company,location,job_summary,post_date,more_info,salary,job_url
Mobile App Developer,Luminis,Thuiswerken in Arnhem,"Werk aan meerdere apps, voor verschillende klanten en in verschillende branches.
Van een bestelapplicatie voor boodschappen en maaltijden tot een app voor mantelzorg op afstand en een commissioning wizard voor installateurs van warmtepompen. Lever je expertise in de keuze voor techniek en richting de beste oplossing voor complexe problemen. Samen met een open, ervaren en nieuwsgierig team van mobile app developers bij Luminis in Arnhem.Wat ga je doen?
Jij lost technisch complexe problemen op, waardoor een eindgebruiker merkt dat er iets verbeterd of toegevoegd is. Zo maak je het leven van klanten, en van klanten van klanten, steeds een stukje makkelijker. Je werkt nauw samen met een designer (UX). De designer draagt een ontwerp over voor development. En leunt dus op jou voor de nieuwste technische ontwikkelingen die interessant zijn voor een klant. Concreet betekent dit:

meedraaien in een agile-projectteam met een designer, scrummaster, product owner en soms iemand vanuit de klant.
ontwikkelen van nieuwe apps en features in alle soorten en maten.
continu verbeteren van apps en van jezelf in je persoonlijke en professionele skills.
je draagt bij aan onze Mobile Way of Working groep om onze mobile kennis op een steeds hoger niveau te brengen.

Wat vragen we van jou?
Jij haalt je motivatie uit het samenwerken met een projectteam. Je durft in gesprek te gaan met collega’s en klanten. Samen kom je tot het beste resultaat. Technische complexiteit, zoals het werken met hardware-integraties op basis van bluetooth low energy? Daar schrik je niet van. Omdat je van nature nieuwsgierig bent, lees je op allerlei platformen alles over de nieuwste ontwikkelingen in mobile development. Ook beschik je over:

minimaal hbo-werk- en -denkniveau.
minimaal 2 jaar werkervaring, bijvoorbeeld als Android developer, iOS developer of mobile developer.
een brede interesse in zowel Android als iOS en cloudtechnologie. Je bent bereid te leren wat je nog niet weet!
ervaring met agile-werken.
goede kennis van de Nederlandse én Engelse taal.

Dit krijg je er voor terug
Een team van ervaren mobile app developers waar je van kunt leren. Niels, Ties, Tom, Theo en de anderen staan voor je klaar en leren natuurlijk ook graag van jou. Jezelf continu ontwikkelen staat centraal bij Luminis. Daar krijg je een mentor voor die je coacht in je ambities. Met tools, cursussen, certificaten en de juiste opdrachten, zodat je uitgedaagd blijft. Wil je meer dan alleen mobile development? Dat kan in deze rol ook! Je werkt minimaal 32 uur per week en in overleg met je scrum-projectteam waar en wanneer jij wilt. Verder kun je rekenen op:

een uitstekend salaris.
een budget om je eigen apparatuur samen te stellen (laptop, telefoon, tas, muis, et cetera).
een winstdelingsregeling.
ontwikkelingsmogelijkheden en een opleidingsbudget.
een leaseauto of mobiliteitsregeling.
29 vakantiedagen op basis van een fulltime dienstverband.
een goede pensioenopbouw, waarvoor Luminis 55% van de premie betaalt en 100% van de premie voor de ANW- en WIA-hiaatverzekering.
de mogelijkheid om hybride te werken en een nettothuiswerkvergoeding van € 50.
een maandelijkse netto-onkostenvergoeding van € 75.
mogelijkheden tot deelname aan trainingen en activiteiten van onze Luminis Academy.
de mogelijkheid om het podium te pakken tijdens onze conferentie DevCon.

Soort dienstverband: Voltijds, Deeltijds, Vaste baan
Salaris: €3.500,00 - €5.000,00 per maand
Rooster:

Dagdienst

Secundaire arbeidsvoorwaarden:

Aandelenopties
Auto van de zaak
Bedrijfsfeesten
Budget voor professionele ontwikkeling
Dienstreizen vergoeding
Extra vakantiedagen
Flexibele werkuren
Kerstpakket
Mogelijkheid tot promotie
Pensioen
Reiskostenvergoeding
Telefoonplan
Vrijdagmiddagborrel
Werk vanuit huis
",Posted1 dag geleden geplaatst,€ 3.500 - € 5.000 per maandVaste baan +2Flexibel werkrooster +1,€ 3.500 - € 5.000 per maand,https://www.indeed.com/pagead/clk?mo=r&ad=-6NYlbfkN0Csv6ZgOV9RRe7ThyxxUWVX4pvY1cMdRdyK50b-ecqXkve_neokwekC8ajzOh2nLOpb0Z_TqcnmmZW5Ow99zGkTaRD6Pvl1uzhCF8JKQzI83mJCzU9UkfDNUGXtRLL6F7_4BcpIzXlR8rgrjKMWNax3XvAIQx-lC6ggIy666J0ZUomZrtEPegSjA6DfiaaN6BkvHHf_xQbMnvzrRCMNwpWlMC5nRZVDeakmV3HAbXaqrq0XbxpTyWCPLA9gnc0RJVcT1JA5kqHvDFZnpLNqZT7K6ZhbUvxwU26akgAx5LNl0ZYLwoJv20ip30eK4mxif5rchaLTlcWdM34o4ul53RyqvulFaf3powNtmIPIC-a0HXTucP5dcoMv54Z502BxqfoJ0EG-U-65cvgkXQfOFA2E_IvDlxsktjZ8hmtbEFDBzOksscz1LyFgF9vaHMkSU86vIR1DJMP_9-E0XUXc6coDwFMahmQQO6N8ag68qw-Wc-5tXCNI8l9RY6uME5DMdAs=&xkcb=SoBz-_M3ZBVJTNx_oh0NbzkdCdPP&p=0&fvj=1&vjs=3
Mobile Flutter Developer,Staffyou,Thuiswerken in Rotterdam,"Welkom, wij zijn Staffyou
De huidige jonge generatie is de eerste welke volledig met het internet is opgegroeid. Het internet heeft transparantie en keuzevrijheid gebracht in veel branches. Nu ook in de bemiddelings- en uitzendbranche, wij zijn Staffyou, een data gedreven platform voor klussen in horeca, logistiek, retail en meer!
Over jou
Programmeren is jouw passie, jij denkt in code. Je blijft op de hoogte van de veranderingen en nieuwe ontwikkelingen in jouw vakgebied. Je kan zelfstandig werken maar kan je in teamverband ook laten gelden. Je bent kritisch op je eigen werk en neemt geen genoegen met de quick and dirty fix.
Wat ga je doen

Je voert taken uit in ontwikkeling en testing.
Je draagt bij aan de kennis van het team, door het uitwisselen van feedback en het geven van jouw mening over verbeterpunten.
Je werkt nauw samen met de business, de UX-experts en designers om tot het beste resultaat te komen.
Samen met het team zorg je voor periodieke uitrol van nieuwe iOS en Android updates.
Je zorgt ervoor dat de apps blijven voldoen aan de gestelde eisen van beide appstores.
Je houdt je tevens bezig met het optimaliseren van diverse prestaties zoals data- en batterijverbruik.
Je maakt gebruik van diagnostic tools om complicaties op te sporen en te verhelpen.

Wij bieden

Een fulltime baan voor langere tijd binnen een snelgroeiende organisatie;
Ruimte voor nieuwe ideeën en optimaliseren van onze huidige processen;
Een team dat staat voor eerlijkheid, gezelligheid en professionele motivatie;
Een vrijdagmiddagborrel in onze eigen bar om gezellig het weekend in te gaan;
Een passend marktcomform salaris;
Werken in de Maastoren op de 33ste (fantastisch uitzicht)
Optie tot thuiswerken, op kantoor of een gezonde mix.

Wij vragen

Jij hebt een HBO- of WO-werk- en -denkniveau;
Jij werkt zelfstandig en georganiseerd;
Jij hebt ruime ervaring met Flutter development voor zowel iOS als Android;
Jij hebt 5+ jaar ervaring met App development voor zowel iOS als Android;
Jij bouwt apps met onderhoud en uitbreiding in gedachte.

Diversiteit, gelijkheid en inclusie
Onze diversiteit aan achtergronden, culturen en perspectieven is essentieel om ons te helpen ons momentum vast te houden. Onze zakelijke en technische uitdagingen zijn uniek, we hebben zoveel mogelijk verschillende stemmen nodig om ze samen op te lossen - stemmen zoals die van jou. Dus het maakt niet uit waar je vandaan komt, van wie je houdt of waar je in gelooft, we heten je welkom om je ware zelf te zijn bij Staffyou.Studies tonen aan dat vrouwen en leden van ondervertegenwoordigde gemeenschappen alleen solliciteren naar banen als ze aan 100% van de kwalificaties voldoen. Klinkt het als jou? Dan moedigt Staffyou je aan om te heroverwegen en te solliciteren.
Interesse?
Klink dit als de baan voor jou? Wij zien je CV en korte motivatie graag verschijnen. Voor vragen kun je contact opnemen met CEO Pavle / 0621893888.
Tot snel bij Staffyou!
Soort dienstverband: Fulltime
Salaris: €3.500,00 - €5.000,00 per maand",PostedMeer dan 30 dagen geleden geplaatst,€ 3.500 - € 5.000 per maandVoltijdsWeekendbeschikbaarheid,€ 3.500 - € 5.000 per maand,https://www.indeed.com/pagead/clk?mo=r&ad=-6NYlbfkN0CizxrhkHKm2_4nXt0OH-0Bvyf6GkTUkQNnyiul5mJxHbkRjKqPP3hhXCZa7rVjaJyE-dMYiVlsT_uprb3BZqVDMpV8ilEFOrsW-MTrUY3LiqlbjlN1ETF0BiYrHXqSKU0vsmHBNU9uInTuhrLM1u9O5Sv_CKR3baLjsXsThFVy-BzLi15SzE7SpvAGqMOY7yH5yciCtrRMEWNN2h71eKFyUaQ1446Vs54Flbwgo7b60bFDB1ZwRhVnOJqZoz6WUENpgGCY-Jw52K7fHlKbo21Xjo3woqVzqpByLg8VMGSS4c6LEmZx1PKuKgcW2gMjoF54jNs6x_BKZmxpBHnZ001LSqHONvDjVeiRII8ViDH_3pGPYat8RAu9NbWHSD3PU21Vp4e9EiY6by--XKhSwRmlcLeYpu5tf9cc4q9vKOhiZwywwOD4czZjQ5UJKO2wxsHVSUKXatjFwOlETtXfEH9VAjsysRqq7wZujaldTDlp_bAvQZ1BeyuRVlDbyelL35k=&xkcb=SoCa-_M3ZBVJTNx_oh0CbzkdCdPP&p=1&fvj=1&vjs=3
Flutter Developer,Kabisa,Thuiswerken in Amsterdam,"Kabisa is volop in ontwikkeling. Wij zijn een snelgroeiend maatwerksoftware bedrijf gespecialiseerd in het ontwikkelen van web- en mobiele applicaties. Software ontwikkelen is mensenwerk. We vinden het daarom erg belangrijk om in onze mensen te investeren. Niet voor niets is Kabisa al meerdere jaren uitgeroepen tot Beste Werkgever van Nederland. Voor de uitbreiding van ons team zijn wij op zoek naar Flutter developers.
Werken bij KabisaAls Flutter Developer werk je in een multidisciplinair Scrum team. Je ontwerpt en bouwt innovatieve Flutter apps die voorzien in de wensen en behoeften van eindgebruikers.
Je hebt ruime ervaring in het ontwikkelen van mobile apps, native iOS/Android of React Native. Je kent iOS en Android van binnen en van buiten en volgt de nieuwste trends op mobiel gebied. Je houdt van een uitdaging, bent creatief en stopt nooit met leren. Je draagt bij aan het continu verbeteren van het ontwikkelproces en de organisatie.*
Waar ben je goed in?*We leggen de lat graag hoog en willen altijd voorop lopen in software ontwikkeling. We willen de verwachtingen van onze klanten overtreffen, elke dag weer. Daarom vinden we het belangrijk dat je diverse jaren ervaring hebt als Mobile Developer.
Je hebt een HBO+ -denk- en werkniveau en jouw persoonlijkheid speelt een belangrijke rol. Je bent iemand die voor topkwaliteit gaat en die in staat is te werken in een multidisciplinair team. Je kijkt niet alleen naar de beste technische oplossingen, maar houdt hierbij rekening met de huidige en toekomstige wensen, behoeften en mogelijkheden van de klant. Je vind het geen probleem buiten je comfort zone te treden en nieuwe talen en technieken te leren. We verwachten van je dat je op termijn door een opdrachtgever niet alleen gezien wordt als een uitstekend developer, maar ook als functioneel sparring partner.
Je hebt ervaring met- en kennis van onderstaande tools/technieken: 

Flutter
Werking van iOS en Android
Native Android en/of iOS ontwikkeling, of ervaring met React Native

Verder:

Is kennis van Clean Code en TDD een pré
Heb je een goed oog voor usability
Schrijf je modulaire en herbruikbare code

Quote van Hans ''Na verschillende jaren als software developer gewerkt te hebben, was ik op zoek naar een bedrijf waar ik mezelf verder kon uitdagen en ontwikkelen. Zo ben ik in 2017 bij Kabisa terecht gekomen. Doordat je mag werken aan uitdagende en innovatieve projecten, samen met gepassioneerde collega's, word je gedwongen om het beste uit jezelf te halen ''
ArbeidsvoorwaardenKabisa biedt haar medewerkers zeer goede arbeidsvoorwaarden aan, enkele hiervan staan onderstaand opgesomd. Wij kiezen bewust voor dit uitgebreide pakket, zodat jij helemaal ontlast bent tijdens je werk en de focus kunt houden op de core-business.

Ruime verlofregeling met 30 vakantiedagen & vakantiegeld
Aantrekkelijk salaris
Collectieve bonus
Goede regeling rondom pensioenopbouw
Ruime mobiliteitsvergoeding (€750,-). Wordt het een leaseauto of het OV?
Je eigen Macbook Pro & iPhone, ook voor privé gebruik.
Ontspanning met tafelvoetbal, pingpong, fitness, of de Xbox
Leuke personeelsuitjes, vaak met partners
Werken in een uitdagende en informele omgeving
Eigen inbreng en creativiteit wordt gewaardeerd
Wij hebben veel aandacht voor je persoonlijke missie en ontwikkeling
Onbeperkt bestellen van vakliteratuur
Ruime opleidingsmogelijkheden (nog nooit heeft Kabisa een opleiding geweigerd)
Home office pakket t.w.v. €1500,-

Ben jij onze nieuwe Software Developer?Solliciteer direct!
Soort dienstverband: Voltijds, DeeltijdsParttime uren: 32 per week
Salaris: Tot €70.000,00 per jaar
Rooster:

Dagdienst
",PostedMeer dan 30 dagen geleden geplaatst,Tot € 70.000 per jaarDeeltijds +1Dagdienst,Tot € 70.000 per jaar,https://www.indeed.com/pagead/clk?mo=r&ad=-6NYlbfkN0CH_HHPeXATAwU4v03ZQylxMnGo9meoKi76lr9524B8r2BgT-nhY2SpXzHcFSlyBu-SFI7txGmjrV5VoqD-mfpJhWGqomtBHvOLllB9kh2kdW4LVGySuXP9U0-82DPyxayrmVALQypxGtcu-F-0TEIcO-uKYfiZXRWbHg6K-YvrqOySZa-mCWzZfqGfKISU2Bs9hgd_qGL1zTqWqA8hpSamIi_pE9jfJ0gYEJc45F7urmqE05bbqMLqkmrYYSRg3e0vC3oQJGJmmXyrQ7-4NFZZFMn1bxLlm_FMUn85h9ji4pDCYNZluHm2gSvjjfLkLhqSk0iQ8XT4msAnO8ZDpA8cpHcrR8nC5aQytUjz9c7Tfacvnc9-fRtQ8dn4NplKFTEKNdfbtz_6mOgci8_8YSaEQ1IKO3yN-rOzoE-_dDV_RAheImngFDx0iLuPD4KiO9JscRHUV_6RI4SztxSpBSyVzJplQFWPd2QgXhCC0uxEzoXiJ8MX-xhgxI90pFUMJ58=&xkcb=SoCz-_M3ZBVJTNx_oh0AbzkdCdPP&p=2&fvj=1&vjs=3
Android Developer - Accommodations Tech,Booking.Com,Amsterdam,"
At Booking.com, data drives our decisions. Technology is at our core. And innovation is everywhere. But our company is more than datasets, lines of code or A/B tests. We’re the thrill of the first night in a new place. The excitement of the next morning. The friends you make. The journeys you take. The sights you see. And the food you sample. Through our products, partners and people, we can empower everyone to experience the world.
 The Accommodations Technology team is responsible for the design, delivery and reliability of services used by millions of customers and partners on the Web, via mobile and through our extensive APIs. With 28 million places to stay listed on our platform, we work hard to develop products that make it easier for travellers to find the best place to stay in destinations across the globe – in 42 languages and across dozens of currencies.
 You will participate in a global interview process to join one of the teams of the Accommodations Tech Business Unit. If you are successful, you’ll be joining a cross-functional team in the department to innovate and maintain a set of products within our core customer journey.
 
B. Responsible

Builds and delivers app-wide features, systems and services - regardless of the technology and programming language;
Identifies and escalates flaws and potential issues of app-related infrastructure;
Continuously improves services they own making them more performant, and utilising resources in the most optimised way;
Lead initiatives for improvement of development processes and business opportunities for your team’s product and the company as a whole;
Identify, foster, and proactively help colleagues to grow professionally, taking a significant role in on-boarding new team members;
Represent Booking.com values both in the company and in the external community;
Advocate a collaborative working environment - make “my ideas” into “our ideas”;
Lead, manage and resolve technical or design discussions or conflicts;
Contribute to Booking.com's growth through interviewing, on-boarding, or other recruitment efforts

B. Skilled
We expect our developers to know the ins and outs of the Android framework and to deliver polished products that customers want to use. We need self-starters who are great at solving problems, initiate solutions and discussions and are not afraid of solving challenges due to our large scale.
We have found that people who match the following requirements are the ones who fit us best:

5+ years of experience as a Developer with Java and/or Kotlin and other languages;
At least 3 years of this experience must be from working with the Android SDK;
Strong interaction and design sense, excellent attention to detail;
Experience with automated testing and deployment of Android apps;
Self-motivated to explore new technologies, applications and environments;
Self-starter, highly motivated, team-player.

Bonus points for:

Experience with Google Play Store & Apps Distribution Process;
An approved Play Store app;
Experience with server-driven UI framework development;
Experience working with A/B testing;
You have an intrinsic curiosity in technological innovations and you are always on top of the latest trends.

B.Offered

Living and working in Amsterdam, one of the most cosmopolitan cities in Europe
Contributing to a high scale, complex, world renowned product and seeing real-time impact of your work on millions of travellers worldwide
Working in a fast-paced and performance driven culture
Opportunity to utilize technical expertise, leadership capabilities and entrepreneurial spirit
Promote and drive impactful and innovative engineering solutions
Technical, behavioural and interpersonal competence advancement via on-the-job opportunities, experimental projects, hackathons, conferences and active community participation
Competitive compensation and benefits package and some great added perks of working in the home city of Booking.com

Booking.com is proud to be an equal opportunity workplace and is an affirmative action employer. All qualified applicants will receive consideration for employment without regard to race, colour, religion, gender, gender identity or expression, sexual orientation, national origin, genetics, disability, age, or veteran status. We strive to move well beyond traditional equal opportunity and work to create an environment that allows everyone to thrive.

 Pre-Employment Screening:  If your application is successful, your personal data may be used for a pre-employment screening check by a third party as permitted by applicable law. Depending on the vacancy and applicable law, a pre-employment screening may include employment history, education and other information (such as media information) that may be necessary for determining your qualifications and suitability for the position.

",PostedMeer dan 30 dagen geleden geplaatst,,,https://www.indeed.com/pagead/clk?mo=r&ad=-6NYlbfkN0AmrGAcUObcwAjPaeUiGTovJrD0KzlVENlQnoZzJA5kiLlESDLx_a95Nt4RDQGIlIsl7rmelMrCTIkOSB9uAyvHJRpRC9M-eLyLnneBpnXh40fh_iDeIPOIl2GTseGOLKgC0XDFMWI7B1yzKh1FWKdbFrhEX3DNtXVThmRgY2gxR3wWsKqXM6WTDCrSFnbTzVWbxrBfw7kBqcubGr5gPtUpwBCK1tbMk0WrRPXFgWs0dNteN3nt9uTuMmX_seRF78sOJ_m7LiNKdpJQgT5gbJy8xjZlyEb6-69Z0PPEIcsby1Ac39ZuHGRkbWSv_IkdDXZANqn5V5_bsizf-h4tyyyRXm7FWqJfV992ZzfxQNZUDlIDv08wgq9v9zufvqlyUhccCEdXZ6uAm1wph5ZY2CagrbJ-x7K8LGx1J7cOexnOS2ryBm0W9U3tMm0YDfansjMdxkbaDSESE0UQkqQIjF-J61iKPGN9-lxgzhSX_afzY77YC18YNraP5aVyIjtjJ0qEynJgm9S9evkHVkfWRv_AFhpjdL42xl9tZvSvq2fk821zEiBnZYIL31O_q6MSp2cL6CIheikiEexFbovjqRyiuZRe-G_NCz1oHDCUJpsB1BKUSjI4q3v8OqYDXCvovFqUCzH5d3yBHHkvEQ9wTWrdxarS_YidifPo-Ejp-h6f26lSVRO9nLDcOSvAIfD6aABzh02afNbgKXuyJ8oP_xCujVntakb2Q0yhRy48ksFNqjxhkH9b06FH&xkcb=SoBz-_M3ZBVJTMR_oh0KbzkdCdPP&p=3&fvj=0&vjs=3
Mobile App Developer,ChipSoft,Amsterdam+2 plaatsen,"








Mobile App Developer
Locatie: Amsterdam Niveau: HBO / WO Dienstverband: 40 uur per week 
Ons Mobile-ontwikkelteam zoekt een gedreven Mobile App Ontwikkelaar. Ben jij analytisch en heb je passie voor het ontwikkelen van apps? Dan zijn wij op zoek naar jou! 



 























             Jouw baan 
            
ChipSoft heeft al diverse apps uitgebracht en het aantal gebruikers hiervan neemt snel toe. Je kunt hierbij denken aan apps voor verpleegkundigen, thuiszorgmedewerkers, de sterilisatieafdeling en - natuurlijk - de artsen zelf. Door jouw hands-on-mentaliteit, eigenwijsheid en technisch inzicht kun je nauwkeurig herbruikbare software schrijven. Die software sluit naadloos aan op onze 'back end' (HiX, onze ICT-totaaloplossing voor de zorg). Samen met je collega's ben je verantwoordelijk voor alle aspecten van het ontwerpen, ontwikkelen en gereedmaken voor uitlevering van onze apps. Dit doe je met de nieuwste versie van Visual Studio voor IOS, Android en UWP. 
Jouw team
 Je komt te werken bij het Mobile team in vestigingen Amsterdam. De gemiddelde leeftijd van de meiden en jongens in ons App ontwikkelteam is 28 jaar. Samen hebben jullie ontzettend veel kennis op het gebied van app-development. Je kunt je collega's dus altijd gebruiken als sparringpartner. Professioneel teamwerk staat centraal.
 Jouw werkdag
 Direct na de dagelijkse stand-up ga je aan de slag met je huidige project: een oplossing waarmee patiënten via hun mobiele telefoon hun medisch dossier in kunnen zien. Je werkt hierin nauw samen met teamgenoten. In de middag staat er een code review gepland van een onderdeel dat net is afgerond. Daarnaast wordt er gekeken naar het ontwerp voor het volgende onderdeel waar jullie aan gaan werken om het project naar een volgende fase te brengen. Dit gaat iets gaafs worden! Aan het einde van de middag help je nog een collega consultant met technische vraagstukken die bij klanten vandaan zijn gekomen. Vandaag heb je wederom je steentje bijgedragen aan een betere en efficiëntere zorg!  

























           Wat bied jij?
          

WO/HBO werk- en denkniveau
Je weet een (software)probleem te herkennen en te beschrijven. 
Teamspeler
Je kan concept vertalen in functionele software
Enthousiasme en interesse in mobiele toepassingen in de zorg
Ervaring met security technieken is een pré

 • Je bent de Nederlandse taal machtig / Mastery of the Dutch language
          



            Kennis van de volgende technieken is een pré:
          

C# / XAML
Android en/of iOs
Scripting ter ondersteuning van het automatiseren van CI/CD processen.
Visual studio
Xamarin





















Wat bieden wij?

 Om het werken bij ChipSoft nóg aangenamer te maken, bieden wij:
 Een aantrekkelijk salaris (mogelijkheid tot een 13de maand, 8,25% vakantiegeld etc.)
 Uitstekende secundaire arbeidsvoorwaarden (o.a. premievrij pensioen, reiskostenvergoeding/mobiliteitskaart en 25 vakantiedagen)
 Uitgebreide interne opleidingsmogelijkheden via onze eigen ChipSoft Academy daarnaast is het ook mogelijk om externe opleidingen te volgen.
 Veel vrijheid en verantwoordelijkheid in het uitvoeren van je werkzaamheden
 Verschillende doorgroei mogelijkheden (o.a. Product Owner of Teamleider)
 Veel sociale activiteiten denk aan: bedrijfshockey/voetbal team, squashtoernooien, wielrentochten, get together workshops, bedrijfsbarbecues, CS-Bios en natuurlijk de maandelijkse bedrijfsborrel.
 Gebruik van onze Chip sportschool inclusief personal trainer, met onder andere groepslessen boksen, circuittraining, BBB. (incl. voedingsadvies en trainingsschema's).
 Goede werk/privé balans
 En als laatste maar zeker niet de minste onze eigen Chipcafé zij zorgen voor een gezonde en gevarieerde lunch tegen kostprijs (vega/halal opties beschikbaar) op de vrijdagmiddag kan iedereen van ons Chipcafé genieten want dan is de lunch gratis.











",PostedMeer dan 30 dagen geleden geplaatst,Voltijds,,https://www.indeed.com/pagead/clk?mo=r&ad=-6NYlbfkN0BrQ6c-x1kauNDry2rheojozIb2maOx9tO6SqBrj9jfYtHtEtvpoo3achhHUnMOEZLYP2hy9ixe6lNxoJsGtZfRHtHom2uhuOlQaW5jVm3NRSQ0uutcyfKMqr7ShKZOIf3X44ZbeT7EOLpjOacU60iB3H9TAUft5a3oWK9NPirGniglxs4L-0_9eM1cD6R2SvQ-4aKer1di4zcL5idYjaTAyORmqPWJRslFfrcvX02Og-_7T0yv6OxDoXah99i_qYSyvwo8zFIMaJNNlRywFHBCONMfj-aj6hqtyvZYmPgdgLJWdrOPbN00ol2j-AZx9-aVdCaLgATx81Rejf3BGxVgQIBiy-ed7ZtDsZ_iIiu0yzd6bNku-zkJCBP07GhrLPxJoIpAEzj7Z84JSBeyqRrsG5fsLGce3qF-42QzuGrJBKN_gG1GsXf9AEfdJm42LsmsyMp1lkLuUvYa6lu5MvX2Fhk4flosn189jaoZG62L-4tvYWbCeSeWjSoxXxv7QHkR9y1kf9XkHeqaOR__nMBRUhsJxsN3krSEc_PuBxC_lTUQpbnntVk3BriFdkpa521mWYUnPh7uGfBc-RAO0DU0or5GLjkcQeydCKxjNKz2rh1B2frJ4MCI7Rqb-OdNHZ0ep3jLYYb-Nv8xSkqloICj3km2h36McaC3Wa5eABU66X7FmjqQeyoIzA73LWvYPLb98w2wtQLmSl7_zVgC8A58JaIgBI5ek0s=&xkcb=SoDU-_M3ZBVJTMR_oh0PbzkdCdPP&p=4&fvj=0&vjs=3
