companyName,company_starRating,job_title,employee_residence,listing_jobDesc,salary,requested_url,company_location,company_size
VinkOS,NA,Data Scientist Trainee,México,"En VinkOS somos una empresa especializada en consultoría en Big Data, realizamos desde arquitecturas, administración de base de datos, pipelines de ingesta, modelos de análisis, hasta capacitación en herramientas de Big Data.Seguimos en crecimiento, y en esta ocasión estamos en busca de nuestros nuevos Data Scientist Trainees para diversos proyectos desde el ramo de telecomunicaciones, bancario, fintech, automotriz y muchos más con empresas con presencia mundial, el objetivo es formar a nuestros nuevos cientificos de datros para realizar modelos de análisis que supervisados y no supervisados, buscamos que estos perfiles hayan trabajado con sus propios ETLs y ELTs, también es importante que hayan trabajado en proyectos de Big Data, ya que trabajaremos con bases de datos de grafos Neo4J.Un plus es que hayan trabajado todo el proceso de creación de modelos en la nube.La experiencia que buscamos en nuestros nuevos integrantes es:Conocimiento en SQL intermedio.Conocimiento de bases de datos no relacionales (Plus).Manejo de Python y RAdemás ofrecemos de manera gratuita cursos y certificaciones directamente con nuestros proveedores (Pentaho, Cloudera Neo4J)No lo pienses más y únete al equipo innovador de VinkOS.¡Postula ya!Tipo de puesto: Tiempo completoSalario: $4,000.00 - $5,000.00 al mesTipo de jornada:Turno matutinoTurno vespertino En VinkOS somos una empresa especializada en consultoría en Big Data, realizamos desde arquitecturas, administración de base de datos, pipelines de ingesta, modelos de análisis, hasta capacitación en herramientas de Big Data.Seguimos en crecimiento, y en esta ocasión estamos en busca de nuestros nuevos Data Scientist Trainees para diversos proyectos desde el ramo de telecomunicaciones, bancario, fintech, automotriz y muchos más con empresas con presencia mundial, el objetivo es formar a nuestros nuevos cientificos de datros para realizar modelos de análisis que supervisados y no supervisados, buscamos que estos perfiles hayan trabajado con sus propios ETLs y ELTs, también es importante que hayan trabajado en proyectos de Big Data, ya que trabajaremos con bases de datos de grafos Neo4J.Un plus es que hayan trabajado todo el proceso de creación de modelos en la nube.La experiencia que buscamos en nuestros nuevos integrantes es:Conocimiento en SQL intermedio.Conocimiento de bases de datos no relacionales (Plus).Manejo de Python y RAdemás ofrecemos de manera gratuita cursos y certificaciones directamente con nuestros proveedores (Pentaho, Cloudera Neo4J)No lo pienses más y únete al equipo innovador de VinkOS.¡Postula ya!Tipo de puesto: Tiempo completoSalario: $4,000.00 - $5,000.00 al mesTipo de jornada:Turno matutinoTurno vespertino Mostrar más ","Est. del Empleador:MX$48,000 - MX$60,000 ",https://www.glassdoor.com.mx/partner/jobListing.htm?pos=102&ao=1136043&s=58&guid=00000182784ef607ad03640a169f8f41&src=GD_JOB_AD&t=SR&vt=w&ea=1&cs=1_d5994f95&cb=1659875817242&jobListingId=1008003947676&jrtk=3-0-1g9s4tti9298b001-1g9s4ttir2f34000-b42c0ff488590a49-,NA,NA
Getecsa,4.2,Data Scientist Jr.,,"¿Quiénes Somos? GETECSA es una empresa joven con la visión clara de lograr solidez y reconocimiento a nivel Latinoamérica como una de las mejores compañías en servicios de tecnologías de la información y comunicaciones.En Getecsa tenemos como objetivo principal ofrecer servicios con un alto sentido de calidad de tal manera que nuestros socios comerciales puedan alcanzar sus objetivos de forma ágil y con calidad a fin de que estén altamente satisfechos con nuestro apoyo.Candidatura: Actualmente estamos buscando un Data Scientist Jr. para laborar con uno de nuestros principales clientes.Requisitos: Ingeniería en Ciencias, Física o Matemáticas aplicadas.Esquema: 100% remoto.Habilidades Técnicas: Programación en R, Python.Desarrollo, implementación y productivación de aprendizaje automático (Machine Learning).Exploración, análisis y generación de valor en bases de datos masivas (Big Data).Simulación y modelado de fenómenos físicos y digitales a través de algoritmos matemáticos.Ofrecemos: 100% Nómina ¡SUELDO COMPETITIVO!.¡Prestaciones superiores a la ley!.Contratación directa con nuestro cliente.Seguimiento, claridad y honestidad en procesos.Amabilidad y empatía.¡¡Unete a Getecsa!!.Tipo de puesto: Tiempo completoSalario: Hasta $25,000.00 al mesBeneficios:Descuentos y precios preferencialesDías de maternidad superiores a los de la leyDías de paternidad superiores a los de la leyOpción a contrato indefinidoSeguro de gastos médicos mayoresSeguro de vidaTrabajar desde casaVales de despensaPago complementario:Bono anualBono trimestralTipo de jornada:Turno de 8 horas ¿Quiénes Somos? GETECSA es una empresa joven con la visión clara de lograr solidez y reconocimiento a nivel Latinoamérica como una de las mejores compañías en servicios de tecnologías de la información y comunicaciones.En Getecsa tenemos como objetivo principal ofrecer servicios con un alto sentido de calidad de tal manera que nuestros socios comerciales puedan alcanzar sus objetivos de forma ágil y con calidad a fin de que estén altamente satisfechos con nuestro apoyo.Candidatura: Actualmente estamos buscando un Data Scientist Jr. para laborar con uno de nuestros principales clientes.Requisitos: Ingeniería en Ciencias, Física o Matemáticas aplicadas.Esquema: 100% remoto.Habilidades Técnicas: Programación en R, Python.Desarrollo, implementación y productivación de aprendizaje automático (Machine Learning).Exploración, análisis y generación de valor en bases de datos masivas (Big Data).Simulación y modelado de fenómenos físicos y digitales a través de algoritmos matemáticos.Ofrecemos: 100% Nómina ¡SUELDO COMPETITIVO!.¡Prestaciones superiores a la ley!.Contratación directa con nuestro cliente.Seguimiento, claridad y honestidad en procesos.Amabilidad y empatía.¡¡Unete a Getecsa!!.Tipo de puesto: Tiempo completoSalario: Hasta $25,000.00 al mesBeneficios:Descuentos y precios preferencialesDías de maternidad superiores a los de la leyDías de paternidad superiores a los de la leyOpción a contrato indefinidoSeguro de gastos médicos mayoresSeguro de vidaTrabajar desde casaVales de despensaPago complementario:Bono anualBono trimestralTipo de jornada:Turno de 8 horas Mostrar más ","Est. del Empleador:MX$300,000 ",https://www.glassdoor.com.mx/partner/jobListing.htm?pos=111&ao=1136043&s=58&guid=00000182784ef607ad03640a169f8f41&src=GD_JOB_AD&t=SR&vt=w&ea=1&cs=1_85013d0e&cb=1659875817244&jobListingId=1008012192025&jrtk=3-0-1g9s4tti9298b001-1g9s4ttir2f34000-ed9bd3f005f9a1eb-,"Monterrey, México",De 51 a 200 empleados
Garantiplus,NA,Data Scientist,Ciudad de México,"GARANTIPLUS MÉXICOhttps://www.linkedin.com/company/garantiplus-m%C3%A9xico/mycompany/Somos una compañía de clase mundial, líder en España en la creación y gestión de productos de Garantía Extendida. Contamos con más de 400 puntos de venta alrededor de la República Mexicana. Garantizamos unidades nuevas, seminuevas, motocicletas, llantas y equipo pesado, con el objetivo de proporcionar seguridad y confianza a nuestros clientes.Por crecimiento y expansión, estamos en búsqueda de una persona para Data Scientist. El principal objetivo de la posición es extraer y analizar datos e información valiosa para mejorar y optimizar la operación, así como para proponer estrategias que faciliten la toma de decisiones con los líderes de la empresa.Actividades: Identificar, extraer y analizar información a partir de los datos y proporcionar recomendaciones y acciones que impulsarán la toma de decisiones para la mejora continua e identificación de oportunidades de diversas áreas de la compañía. (Marketing, CH, Operaciones, Finanzas, etc.)Requisitos: Formación: Licenciatura o ingeniería en sistemas, administración, actuaria, ingeniería Industrial, economía, finanzas, matemáticas; área afín relacionada en el manejo y análisis de datos.Experiencia mínima de 4 años trabajando como Data Scientist en el análisis y manejo de datos para la toma de decisiones, deseable experiencia en sector seguros, financiera, automotriz y/o start up. Así como en:Construcción de algoritmos de acuerdo a los modelos analíticos creados.Implementar los algoritmos generados por medio de los modelos estadísticos.Manejo de datos a través de herramientas estadísticas, programación para crear modelos matemáticos. Minería de Datos.Cruce de información proveniente de distintas fuentes (internas y externas) identificando patrones que deriven en insights relevantes para detonar iniciativas comerciales, mercadológicas, financieras u operativas.Elaboración de dashboards en herramientas como Tableau, Data Studio, Looker y/o programas similares.Análisis de datos para la mejora y detección de necesidades de los pilares de la operación, identificar métricas clave y oportunidades para mejorar el negocio, rendimiento de los modelos, procesos, productos y servicios.Crear procesos y sistemas de información automatizados y de modelos predictivos.Buscar activamente y probar nuevas fuentes de datos para mejorar el rendimiento de los modelos.Realizar estimaciones, análisis de datos de forecast y rentabilidad del negocio.Generación de presentaciones estratégicas con recomendaciones para la mejora de los resultados obtenidos.Análisis de las principales métricas para la toma decisiones, dirigida a los principales stakeholders de la compañía.Experiencia y conocimientos técnicos requeridos: Data miningData Studio o herramientas similares.Plataformas Cloud (AWS)Excel avanzadoAnalytics de fuentes secundarias (Google Analytics, Digital Analytics).Conocimiento avanzado de SQL y RHabilidades:Excelente manejo de las relaciones interpersonales y comunicación.Proactividad, análisis y organización, creatividad, trabajo en equipo, liderazgo, toma de decisiones.Ofrecemos: Contratación directa por la empresaPago 100% nóminaPrestaciones de leyTrabajo remotoCaja de ahorroSeguro de vidaSGMMHorario de trabajo: lunes a sábadoTipo de puesto: Tiempo completo, Por tiempo indeterminadoSalario: Hasta $50,000.00 al mesBeneficios:Caja de ahorroSeguro de vidaTrabajar desde casaTipo de jornada:Turno de 10 horasConsideraciones ante el COVID-19:Uso de cubrebocas GARANTIPLUS MÉXICOhttps://www.linkedin.com/company/garantiplus-m%C3%A9xico/mycompany/Somos una compañía de clase mundial, líder en España en la creación y gestión de productos de Garantía Extendida. Contamos con más de 400 puntos de venta alrededor de la República Mexicana. Garantizamos unidades nuevas, seminuevas, motocicletas, llantas y equipo pesado, con el objetivo de proporcionar seguridad y confianza a nuestros clientes.Por crecimiento y expansión, estamos en búsqueda de una persona para Data Scientist. El principal objetivo de la posición es extraer y analizar datos e información valiosa para mejorar y optimizar la operación, así como para proponer estrategias que faciliten la toma de decisiones con los líderes de la empresa.Actividades: Identificar, extraer y analizar información a partir de los datos y proporcionar recomendaciones y acciones que impulsarán la toma de decisiones para la mejora continua e identificación de oportunidades de diversas áreas de la compañía. (Marketing, CH, Operaciones, Finanzas, etc.)Requisitos: Formación: Licenciatura o ingeniería en sistemas, administración, actuaria, ingeniería Industrial, economía, finanzas, matemáticas; área afín relacionada en el manejo y análisis de datos.Experiencia mínima de 4 años trabajando como Data Scientist en el análisis y manejo de datos para la toma de decisiones, deseable experiencia en sector seguros, financiera, automotriz y/o start up. Así como en:Construcción de algoritmos de acuerdo a los modelos analíticos creados.Implementar los algoritmos generados por medio de los modelos estadísticos.Manejo de datos a través de herramientas estadísticas, programación para crear modelos matemáticos. Minería de Datos.Cruce de información proveniente de distintas fuentes (internas y externas) identificando patrones que deriven en insights relevantes para detonar iniciativas comerciales, mercadológicas, financieras u operativas.Elaboración de dashboards en herramientas como Tableau, Data Studio, Looker y/o programas similares.Análisis de datos para la mejora y detección de necesidades de los pilares de la operación, identificar métricas clave y oportunidades para mejorar el negocio, rendimiento de los modelos, procesos, productos y servicios.Crear procesos y sistemas de información automatizados y de modelos predictivos.Buscar activamente y probar nuevas fuentes de datos para mejorar el rendimiento de los modelos.Realizar estimaciones, análisis de datos de forecast y rentabilidad del negocio.Generación de presentaciones estratégicas con recomendaciones para la mejora de los resultados obtenidos.Análisis de las principales métricas para la toma decisiones, dirigida a los principales stakeholders de la compañía.Experiencia y conocimientos técnicos requeridos: Data miningData Studio o herramientas similares.Plataformas Cloud (AWS)Excel avanzadoAnalytics de fuentes secundarias (Google Analytics, Digital Analytics).Conocimiento avanzado de SQL y RHabilidades:Excelente manejo de las relaciones interpersonales y comunicación.Proactividad, análisis y organización, creatividad, trabajo en equipo, liderazgo, toma de decisiones.Ofrecemos: Contratación directa por la empresaPago 100% nóminaPrestaciones de leyTrabajo remotoCaja de ahorroSeguro de vidaSGMMHorario de trabajo: lunes a sábadoTipo de puesto: Tiempo completo, Por tiempo indeterminadoSalario: Hasta $50,000.00 al mesBeneficios:Caja de ahorroSeguro de vidaTrabajar desde casaTipo de jornada:Turno de 10 horasConsideraciones ante el COVID-19:Uso de cubrebocas Mostrar más ","Est. del Empleador:MX$600,000 ",https://www.glassdoor.com.mx/partner/jobListing.htm?pos=114&ao=1136043&s=58&guid=00000182784ef607ad03640a169f8f41&src=GD_JOB_AD&t=SR&vt=w&ea=1&cs=1_f586a712&cb=1659875817244&jobListingId=1008032008413&jrtk=3-0-1g9s4tti9298b001-1g9s4ttir2f34000-87f4a014fa8bd7dd-,NA,NA
Cyber Resource,NA,Data Scientist,Ciudad de México,"ABOUT THE ROLEThe Virginia Office of Data Governance and Analytics is an exciting new agency under the Secretary of Administration. The agency’s primary focus is Data Sharing and Data Governance. The agency manages the Commonwealth Data Trust to facilitate data sharing across the Commonwealth and its partners; and provides administrative support to the Commonwealth Data Commission, Executive Data Board, Data Governance Council, and Data Stewards Group. In addition, the Office of Data Governance and Analytics (ODGA) will provide guidance, support, oversight, and technical assistance to data trust member agencies and Commonwealth organizations in the implementation of data governance, sharing, security, and analytics projects.Responsibilities:     Understand and translate business needs into data models supporting long-term ODGA solutions.     Develop and maintain conceptual, logical and physical data models along with corresponding metadata.     Develop best practices for data standards and coding practices to ensure consistency in data models.     Perform reverse engineering of physical data models from databases and SQL scripts.     Examine new application design and recommend corrections if required.     Develop tools for data science staff that enable them to derive actionable insights into business operations and performance measures from data sets.     Develop successful prototypes and proofs of concept to improve system components and tools and to demonstrate new functions.     Advise technical staff on data flow, processing issues, and other topics pertinent to the generation of data that meets business requirements.     Collaborate effectively with partner agencies and business stakeholders in order to address data-related technical issues, clarify business requirements, and resolve conflicts and ambiguities.     Serve as a data scientist resource to data trust member agencies and Commonwealth organizations regarding machine learning issues.     Support data quality, integrity, security services in partner agencies as a core value.Competencies Required:     Considerable experience using statistical computer languages (R, Python, etc.)     Considerable experience working with and creating data architectures.     Considerable knowledge of a variety of machine learning techniques (clustering, decision tree learning, artificial neural networks, etc.) and their real-world advantages/drawbacks.     Considerable knowledge of advanced statistical techniques and concepts (regression, properties of distributions, statistical tests and proper usage, etc.) and experience with applications.     Excellent written and verbal communication skills for coordinating across teams.     A drive to learn and master new technologies and techniques.Qualifications:     Bachelor’s degree plus 5+ years of Data Science experience.     Practical programming experience in Python, R, Spark, SQL, and/or other data scripting languages (3 years preferred).     At least 3 years of experience in Python, R, and/or other data scripting languages.     At least 3 years of experience utilizing a business intelligence visualization tool (Power BI, Tableau, etc.).     At least 3 years of experience in querying and analyzing and working with data languages and platforms (SQL) to investigate large and diverse data sets.SkillRequired / DesiredAmountof ExperienceConsiderable experience using statistical computer languages (R, Python, SLQ, etc.) to manipulate data and draw insights from large data sets.Required5 YearsConsiderable experience working with and creating data architectures.Required5 YearsConsiderable knowledge of a variety of machine learning techniques (clustering, decision tree learning, artificial neural networks, etc.).Required5 YearsConsiderable knowledge of relational databases such as SQL Server.Required5 YearsJob Type: Full-timePay: $100,000.00 per monthAbility to commute/relocate:44970, Ciudad de México, Méx.: Reliably commute or planning to relocate before starting work (Required) ABOUT THE ROLEThe Virginia Office of Data Governance and Analytics is an exciting new agency under the Secretary of Administration. The agency’s primary focus is Data Sharing and Data Governance. The agency manages the Commonwealth Data Trust to facilitate data sharing across the Commonwealth and its partners; and provides administrative support to the Commonwealth Data Commission, Executive Data Board, Data Governance Council, and Data Stewards Group. In addition, the Office of Data Governance and Analytics (ODGA) will provide guidance, support, oversight, and technical assistance to data trust member agencies and Commonwealth organizations in the implementation of data governance, sharing, security, and analytics projects.Responsibilities:     Understand and translate business needs into data models supporting long-term ODGA solutions.     Develop and maintain conceptual, logical and physical data models along with corresponding metadata.     Develop best practices for data standards and coding practices to ensure consistency in data models.     Perform reverse engineering of physical data models from databases and SQL scripts.     Examine new application design and recommend corrections if required.     Develop tools for data science staff that enable them to derive actionable insights into business operations and performance measures from data sets.     Develop successful prototypes and proofs of concept to improve system components and tools and to demonstrate new functions.     Advise technical staff on data flow, processing issues, and other topics pertinent to the generation of data that meets business requirements.     Collaborate effectively with partner agencies and business stakeholders in order to address data-related technical issues, clarify business requirements, and resolve conflicts and ambiguities.     Serve as a data scientist resource to data trust member agencies and Commonwealth organizations regarding machine learning issues.     Support data quality, integrity, security services in partner agencies as a core value.Competencies Required:     Considerable experience using statistical computer languages (R, Python, etc.)     Considerable experience working with and creating data architectures.     Considerable knowledge of a variety of machine learning techniques (clustering, decision tree learning, artificial neural networks, etc.) and their real-world advantages/drawbacks.     Considerable knowledge of advanced statistical techniques and concepts (regression, properties of distributions, statistical tests and proper usage, etc.) and experience with applications.     Excellent written and verbal communication skills for coordinating across teams.     A drive to learn and master new technologies and techniques.Qualifications:     Bachelor’s degree plus 5+ years of Data Science experience.     Practical programming experience in Python, R, Spark, SQL, and/or other data scripting languages (3 years preferred).     At least 3 years of experience in Python, R, and/or other data scripting languages.     At least 3 years of experience utilizing a business intelligence visualization tool (Power BI, Tableau, etc.).     At least 3 years of experience in querying and analyzing and working with data languages and platforms (SQL) to investigate large and diverse data sets.SkillRequired / DesiredAmountof ExperienceConsiderable experience using statistical computer languages (R, Python, SLQ, etc.) to manipulate data and draw insights from large data sets.Required5 YearsConsiderable experience working with and creating data architectures.Required5 YearsConsiderable knowledge of a variety of machine learning techniques (clustering, decision tree learning, artificial neural networks, etc.).Required5 YearsConsiderable knowledge of relational databases such as SQL Server.Required5 YearsJob Type: Full-timePay: $100,000.00 per monthAbility to commute/relocate:44970, Ciudad de México, Méx.: Reliably commute or planning to relocate before starting work (Required) Mostrar más ","Est. del Empleador:MX$1,200,000 ",https://www.glassdoor.com.mx/partner/jobListing.htm?pos=123&ao=1136043&s=58&guid=00000182784ef607ad03640a169f8f41&src=GD_JOB_AD&t=SR&vt=w&ea=1&cs=1_2943c2c7&cb=1659875817245&jobListingId=1008007774691&jrtk=3-0-1g9s4tti9298b001-1g9s4ttir2f34000-c5e91fec4880177e-,"Toulouse, Francia",No se sabe
Comstrat,NA,Sr Data Scientist,México,"Licenciatura en matemáticas, actuaria, carreras de ciencias exactas, ingeniería o computacionalesRequisitos:Experiencia de 2 a 3 años en posiciones similares.Experto en lenguajes de programación.Experto en R, Python y/o MATLAB.Conocimiento básico en programas de BI y visualizadores.Experiencia media en la gestión de base de datos (extracción, limpieza y manejo)Conocimiento sobre las librerías de algoritmos y herramientas disponibles en las plataformas.Sólidos conocimientos en estadística aplicada modelos matemáticos.Grado en ciencias informáticas, ciencia de datos, matemáticas o en un campo similarExperiencia demostrada como científico de datos o en un puesto similar.Capacidad organizativa y de liderazgoCapacidad de comunicaciónMentalidad retadora y proactivaIdealmente que tenga experiencia realizando modelos de riesgos para el sector financiero mas no necesarioSalario abierto, basado en aptitudes y conocimientos del aplicanteTipo de puesto: Tiempo completoSalario: A partir de $50,000.00 al mesTipo de jornada:Turno de 8 horas Licenciatura en matemáticas, actuaria, carreras de ciencias exactas, ingeniería o computacionalesRequisitos:Experiencia de 2 a 3 años en posiciones similares.Experto en lenguajes de programación.Experto en R, Python y/o MATLAB.Conocimiento básico en programas de BI y visualizadores.Experiencia media en la gestión de base de datos (extracción, limpieza y manejo)Conocimiento sobre las librerías de algoritmos y herramientas disponibles en las plataformas.Sólidos conocimientos en estadística aplicada modelos matemáticos.Grado en ciencias informáticas, ciencia de datos, matemáticas o en un campo similarExperiencia demostrada como científico de datos o en un puesto similar.Capacidad organizativa y de liderazgoCapacidad de comunicaciónMentalidad retadora y proactivaIdealmente que tenga experiencia realizando modelos de riesgos para el sector financiero mas no necesarioSalario abierto, basado en aptitudes y conocimientos del aplicanteTipo de puesto: Tiempo completoSalario: A partir de $50,000.00 al mesTipo de jornada:Turno de 8 horas Mostrar más ","Est. del Empleador:MX$600,000 ",https://www.glassdoor.com.mx/partner/jobListing.htm?pos=127&ao=1136043&s=58&guid=00000182784ef607ad03640a169f8f41&src=GD_JOB_AD&t=SR&vt=w&ea=1&cs=1_1bb30d0c&cb=1659875817245&jobListingId=1008015259179&jrtk=3-0-1g9s4tti9298b001-1g9s4ttir2f34000-57627eab310f44f2-,NA,NA
