job_title,company,location,job_summary,post_date,more_info,salary,job_url
DevOps Engineer,Hansen Technologies,"Buenos Aires, Buenos Aires","
Job Title: DevOps Engineer 
Location: Buenos Aires, Argentina or Remote in Argentina 
Why work for Hansen? 

We are a global organization 
We are proud of our products, services, and people 
We value our family culture and provide company benefits including holiday and paid time off 
We have a fun environment where people are the key to our success 
Most of all, we are a profitable, stable company who develop people and provide great opportunities. 

How you will contribute: 

Collaboration with team(s) to evaluate Monitoring and Performance of the Environment(s) 
Identify opportunities to automate scripts for software builds/deployments and help streamline the CI/CD process 
Participate in technology and design discussions 
Build libraries, modules, and packages for other engineers 
Support for Production Environment 
Develop and maintain CI/CD processes to deliver better software faster 
Assist in planning releases and designing release guidelines 
Assist in scheduling release windows and related activities 
Configuring: overseeing various aspects of the project before deployment and coordinating with cross-functional teams 
Testing and reviewing the quality of the release before launch and ensuring QA teams understand the guidelines of the project and test against these standards 
Deployment: ensure the timely and smooth progress of projects in line with timelines, budget, and requirements 
Risk Management: provide input and guidance into risks that may affect the release scope, measure and monitor progress to mitigate risks 

Our Ideal Person: 

3+ years of experience in Release/Configuration 
Tertiary qualification in Computer Science, Information Systems or Business, or comparable industry experience 
2+ years solid experience with Agile/Scrum methodologies 
Understanding of CI/CD pipelines and use of tools such as Git, JIRA, Bitbucket, Jenkins, Sonatype Nexus, Yum Repos 
Ability to coordinate across multiple geographic teams 
Strong communication skills, both verbal and written 
Experience with container services like Kubernetes and Docker 
Strong Linux and Shell experience required 
Experience with development in Go, C/C++, Java, JavaScript, PL/SQL 


EEO/M/F/D/V - Please note that we will not be offering sponsorship for this role 
#Argentina 
#LI-Remote 
#US
",PostedPublicado hace más de 30 días,Tiempo completo,,https://www.indeed.com/rc/clk?jk=581f0bd53a888515&fccid=1521aad676a6f1c9&vjs=3
Consultor DevOps - TANDIL 100% REMOTO! en Tandil,TSOFT SA,"Tandil, Buenos Aires","
Â¿Te apasionan los desafÃos y tu objetivo es dar la milla extra siempre? Â¡Tsoft es tu lugar!
 En TSOFT nos encontramos en la bÃºsqueda de un Consultor DevOps Ssr/Sr para sumarse a nuestros equipos de trabajo de manera 100% remota!


Si sos de Tandil o alrededores esta es tu oportunidad!

 Experiencia y conocimientos requeridos:
Â· Conocimientos de ingenierÃa del software
Â· Conocimientos de metodologÃas y modelos de calidad para la industria del software 
Â· Conocimientos en arquitectura AWS
Â· Conocimientos en integraciÃ³n continua DevSecops.
Â· Conocimiento en herramientas: JENKINS, GIT, JIRA, CONFLUENCE, GRADLE/MAVEN, SELENIUM, APPIUM.
Â· Conocimiento en Infraestructura como CÃ³digo (Terraform/Terragrunt)
Â· Conocimiento y Uso de Contenedores (Docker)

 Conocimientos deseables

 
Â· Certification arquitecto AWS

 Los beneficios de la posiciÃ³n son:
Â· Prepaga Swissmedical (2 cÃ¡pitas).
Â· MÃ¡s dÃas por estudio.
Â· MÃ¡s horas de lactancia para las madres
Â· MÃ¡s dÃas de licencia para padres


Â¿Queres formar parte de este gran equipo y vivir la experiencia Tsoft?


EsEcribinos!







Ubicacíon: Tandil , Buenos Aires 
   


Empleo: Consultor DevOps - TANDIL 100% REMOTO! 
   


Disponibilidad: Full-Time 
   


Fecha Publicación: 21-05-2020
   

",PostedPublicado hace más de 30 días,Tiempo completo,,https://www.indeed.com/rc/clk?jk=23a3aac66d395d25&fccid=0eb62f82d8f9c00d&vjs=3
Gerente de Desarrollo (DevOps),Cantoli & Asoc.,"Santa Fe de la Vera Cruz, Santa Fe","
Para importante Cía. de Branding y Marketing Digital
Lugar de trabajo: CDMX (Santa Fe)
Disponibilidad: 
Orientamos la búsqueda a candidatos graduados en la Lic. en Sistemas o afines.
 La principal misión de la posición consistirá en llevar adelante los recursos que integran los proyectos de desarrollo de la empresa, tanto de los clientes como propios, agregando valor con una mirada innovadora y estratégica. Deberá planificar, dirigir y realizar el flow up de los proyectos, además de mantener el control sobre el ciclo de DevOps y buscar la mejora continua.
 Reportando a un Director General sus principales responsabilidades serán:

Planeación y seguimiento a la ejecución de múltiples proyectos.


Buscar el desarrollo profesional del equipo a su cargo.


Mantener el control sobre el ciclo de DevOps y buscar la mejora continua.


Asegurar la ejecución y calidad de los proyectos.


Evaluar tecnologías emergentes para la solución a problemas digitales.


Analizar y desarrollar soluciones a problemas planteados por los clientes.


Participar en la elaboración de estimaciones para generar propuestas de venta.


Presenciar juntas con los clientes para dar estatus de los proyectos.


Buscar la retroalimentación de los usuarios finales.


Administrar y generar documentación tanto técnica y administrativa por proyecto.


Brindar soporte a cliente.


Recibir las solicitudes e identificar el flujo de atención que requiere.


Administración y atención de los niveles de servicio de los proyectos.


Documentar las incidencias, estimar tiempo de resolución e informar.


Contabilizar el esfuerzo requerido para temas de soporte y calificar a QA.


Implementar sistemas de retroalimentación para medir satisfacción del cliente.

 Tendrá contacto tanto con Proveedores (para mantenerse actualizado) como con Clientes (para diseñar y ejecutar soluciones), además con áreas internas de Marketing, Comercial y de Recursos Humanos.
 Sera excluyente contar con conocimientos integrales en desarrollo Web, servidores y arquitectura en la nube, entre otros.


 Zona de Trabajo: CDMX (Santa Fe)


 Interesados enviar Cv sin omitir remuneración pretendida a asartor@cantoliconsultora.com.ar
",PostedPublicado hace más de 30 días,,,https://www.indeed.com/rc/clk?jk=a70a55ea9d2969ff&fccid=487f1e577887e1c7&vjs=3
DevOps Engineer - Unix,"JPMorgan Chase Bank, N.A.","Buenos Aires, Buenos Aires","
 As a Infrastructure Development professional, your mission is to help our team move toward creating next-level solutions that improve the way our business is run. Your hands-on knowledge in system design, application development, testing, and operational stability will help your team deliver high-quality products. You'll be instrumental in solving more difficult technical issues, developing integration elements, building data models, APIs, and open 3rd-party SDKs. You'll see your ideas come to life as part of a small, success-driven team. Your quest to embracing leading-edge technologies and methodologies inspires your team to follow suit. And best of all, you'll be able to harness massive amounts of brainpower through our global network of technologists from around the world to tackle big challenges. 
 
 This role requires a wide variety of strengths and capabilities, including: 
 

BS/BA degree or equivalent experience 
Provide technical expertise throughout the software lifecycle including design, implementation and delivery 
Understanding of cloud, virtualization, APIs, and modern software languages 
Software development experience in one or more general-purpose programming languages: Python, Java, C, C++, Go 
Experience with developing frameworks that help increase developer and release velocity, improving code health and technical standards 
Experience working with two or more from the following: web application development, database, unix/linux environments, distributed and parallel systems, information retrieval, networking, large-scale software development, security software development 
Understanding or have experience with Agile and Lean philosophies 
Strong critical-thinking and problem-solving skills with clear communication 
Ability to collaborate with different roles to achieve common goals 

El empleador sólo podrá solicitarle la información estrictamente necesaria para el desempeño en el trabajo que se ofrece. Ley Nº 6471 CABA   GTIARGALL
 J.P. Morgan is a global leader in financial services, providing strategic advice and products to the world's most prominent corporations, governments, wealthy individuals and institutional investors. Our first-class business in a first-class way approach to serving clients drives everything we do. We strive to build trusted, long-term partnerships to help our clients achieve their business objectives.
 We recognize that our people are our strength and the diverse talents they bring to our global workforce are directly linked to our success. We are an equal opportunity employer and place a high value on diversity and inclusion at our company. We do not discriminate on the basis of any protected attribute, including race, religion, color, national origin, gender, sexual orientation, gender identity, gender expression, age, marital or veteran status, pregnancy or disability, or any other basis protected under applicable law. In accordance with applicable law, we make reasonable accommodations for applicants' and employees' religious practices and beliefs, as well as any mental health or physical disability needs.
",PostedPublicado hace 18 días,Indefinido +1,,https://www.indeed.com/rc/clk?jk=b2acf9d892d99ea9&fccid=aaf3b433897ea465&vjs=3
DevOps Platform Engineer,Kin + Carta,"Buenos Aires, Buenos Aires+1 ubicación","




The opportunity


At Kin + Carta, we’ve got opportunities to offer you — for growth, for leadership, for big, world-changing impact and for, dare we say it, fun. We are a global workforce that is committed to building a world that works better for everyone. And that starts with our Kin. That’s why we’re proud of:

The life we create within our virtual walls, every day
Being B Corp certified
Our honor as a “Best Company to Work For” by Women's Choice Award










The role


Kin + Carta is looking for a DevOps Platform Engineer with a system engineering and development background to join our growing team in our Cloud Native Practice. This is a new position at Kin + Carta, and you’ll be helping to continue building out this client offering.










Role responsibilities



Take responsibility for technical design, deployment, monitoring and ongoing support and maintenance of a diverse set of cloud & containerization technilogies. The role is a technical, hands-on opportunity with a heavy focus on automation, resilient design and deployment of cloud-ready systems and services.
Collaborate with Product teams internal and external to EAIS to provide world class products and services in support of our application development community and our business as a whole. In this position, you’ll be responsible for the full-stack engineering and support of products that support our hybrid cloud and container platform capabilities.
Lead the design, build and maintenance of modern container platform for hybrid clouds that support Agile teams.
Partner with key stakeholders as a platform champion for cloud-native systems and coach on how to use platform capabilities effectively through appropriate venues.
Drive continuous improvement of cloud & container products and capabilities through internal user groups and external market research.
Collaborate/Communicate efforts and align development efforts with planned Roadmaps.
Provide system support as part of a support rotation with other team members.
Perform root cause analysis, alternate solution evaluation.









Minimum qualifications



Bachelor’s degree in information technology or related field
4+ years of experience in application or platform development, consulting or related field using OpenShift/Kubernetes, Docker/CRI-O, & Knative running on public cloud providers such as AWS.
In lieu of education, 6+ years of experience in application or platform development, consulting or related field.









Preferred qualifications



Ability to visualize and document architecture/design topology
Understanding of tools such as Github/Chef/Ansible/Terraform/Vault/Shell
Understanding of CI/CD, infrastructure engineering concepts
General understanding/expertise with Security
Past experience of Cassandra, Gemfire will be a plus
Knowledge of emerging trends, ability to recommend solutions and define future state of architecture
Experience developing CI/CD pipelines utilizing Jenkins/Harness
Experience with cloud providers like AWS preferred
Experience supporting or developing software leveraging OpenShift, Kubernetes, and Docker, Kubernetes Operators.
High proficiency in bash or python scripting
Experience and knowledge in Test Driven Development
Experience with programming languages like Go lang and consuming web services as RESTful APIs.
Experience working with one or more tools like Sysdig, Elastic Search, Filebeat, Kibana, Prometheus, Grafana, Splunk, AppDynamics is a plus.
Customer centric with a strong drive to make the developer experience as seamless and efficient as possible.









About Kin + Carta


Kin + Carta is a global digital transformation consultancy committed to working alongside our clients to build a world that works better #ForEveryone. Our 2,000 curious minds make creative connections between people, data and technology to create connected outcomes across the full lifecycle of the product and platform ecosystems.
 We’re makers, builders and creators by nature, and we come to work every day to build experiences for some of the world’s most influential companies. We help businesses accelerate their digital roadmap, rapidly innovate, modernize their systems, enable their teams and optimize for continued growth.
 We are a technology business with trust and human connection at its heart. As a Certified B Corp, our triple bottom line focus on people, the planet and profit is at the core of everything we do.
 We welcome our Kin to show up as their authentic selves every day. Because this is so important to us, Kin + Carta is proud to be an equal opportunity employer. To read further about our commitment to Inclusion, Diversity, Equity and Awareness, check out the IDEA page on our website.
 If you need accommodations at any point in the application or interview process, please let us know.








Your benefits 



Hard work deserves big rewards. Joining us means you’ll be able to enjoy a wide range of benefits aimed at mind, body, spirit and enhancing your career.






      Affinity groups & culture committees 
     



      Internal & external training opportunities 
     



      Bi-annual feedback cycles 
     



      Award-winning workplace culture 
     



      B Corp certified 
     



      Prepaid health coverage for family 
     



      Computer kit and home office equipment 
     



      Monthly Wi-Fi reimbursement 
     



      Coupon for online grocery shopping 
     



      English classes offered once per week 
     



      Additional week of vacation 
     



      Quarterly salary adjustment 
     





Apply for this role

Whoever you are, wherever you’re from and whoever you love, you’ll find an open door at Kin + Carta. It’s yours to walk through if you’re passionate about building a better world for everyone, and you’re keen to be part of a diverse and inclusive culture that plays to people’s strengths and thrives on togetherness.
",PostedPublicado hace más de 30 días,,,https://www.indeed.com/rc/clk?jk=57384f184b0af544&fccid=0c354a10048ca5f9&vjs=3
"Client Technology: Business Architecture & Analysis, Assuran...",EY,"Capital Federal, Buenos Aires","
CT Technology Business Analysis - Assistant Director TR
 Fueled by strategic investment in technology and innovation, Client Technology seeks to drive growth opportunities and solve complex business problems for our clients through building a robust platform for business and powerful product engine that are integral to innovation at scale. You will work with technologists and business specialists, blending EY’s deep industry knowledge and innovative ideas with our platforms, capabilities, and technical expertise. As a champion for change and growth, you will be at the forefront of integrating emerging technologies from AI to Data Analytics into every corner of what we do at EY. That means more growth for you, exciting learning opportunities, career choices, and the chance to make a real impact.
 The opportunity
 Business Analysts will apply analytical knowledge areas and in-depth analysis of the business to uncover its true problems, understand its objectives, define the relevant requirements, business rules and identify design elements to support the application functions. Business Analysts have strong problem-solving skills and interact regularly with various professionals to generate value for the business. Business Analysts have several key touch points through the product lifecycle and will ensure that the solution will enable the business to achieve its objectives.
 Your key responsibilities

 Lead the effort to plan, scope, gather, understand and analyze business requirements, and translates business requirements into functional and non-functional requirements
 Apply business analysis knowledge areas and creativity to drive requirements work effort ranging from planning, elaboration, analysis, validation to communication through the different stages of the requirements lifecycle
 Strong analytical capabilities to decompose sophisticated business models, specify critical functions and identify inter-dependencies for design considerations
 Lead the effort to engage with business and technology partners to clarify application functions, processes and data flow to align business and technology capabilities or constraints
 Integrate the solution into the business workstreams, which may include the provision of enablement materials and training agenda to facilitate adoption and integration of the product and processes into the business cycle
 Verify, through different testing practices (ex. UAT), that the solutions meet the functional specifications and resolve specified business problems
 Have awareness of technology components and their relevancy to the functional modules, especially their advantages in advancing business position and improving user journey
 Continuously advance the proficiency of business analysis and apply industry standard methodologies to promote forward thinking on the analysis of changing business models and knowledge sharing across other domains

 Skills and attributes for success

 Ability to plan, lead and direct tactical activities to scope work effort and eventually capture business requirements for analysis, and prioritize features to produce required business outcomes
 Knowledgeable and capable of conducting and handling requirements of varying complexity through its lifecycle and validating or presenting with business partners and technologists on the requirements
 Excellent communication skills and confident to identify, negotiate and mitigate difficult circumstances (ex. demanding stakeholders, changing requirements scope)
 Have engaged in business case development incorporating broader enterprise view of the business value proposition, encompassing functional analysis, workflow analysis, impact analysis (organization, cost) and risk analysis
 Have been involved in client training activities ranging from provisioning of quick reference or user guides, conducting functional walkthroughs, creating training nuggets and addressing FAQs to integrate solution functions into business tactical activities
 Ability to engage and collaborate in diverse settings of people, perspectives and experiences
 A sense of urgency, decisiveness, and ability to work well under pressure
 Ability to listen and to think independently, and be a curious and creative person

 To qualify for the role, you must have

 Bachelor's degree in Business Administration, Business Management, Computer Science, Engineering or related field preferred
 Minimum 8-10 years of experience with significant role interacting with business and technology leaders to define business operations, workflows and technology solutions
 Direct experience and accountability in the functional architecture of products, product portfolios or solution accelerator with at least $3m of investment, $1m if using leading cutting edge innovative technologies
 Have domain knowledge of one or more industries or sectors, with broad knowledge of current as well as emerging technologies
 Have experience in Agile framework participating directly in Agile practices and producing common artifacts
 Understand product development and delivery framework especially Agile framework, DevOps practices and micro services
 Significant relevant experience in either an internal or external business analysis role, or similar
 Significant technical knowledge and experience in delivering IT solutions, providing comprehensive technical advice and understanding user requirements
 Experience supplying to the formulation of business vision and strategy
 Strong partner management experience

 What we look for

 A self-starter, independent-thinker, curious and creative person with ambition and passion

 What we offer
 As part of this role, you'll work in a highly coordinated, globally complementary team with the opportunity and tools to grow, develop and drive your career forward. Here, you can combine global opportunity with flexible working. The EY benefits package goes above and beyond too, focusing on your physical, emotional, financial and social well-being. Your recruiter can talk about the benefits available in your country. Here’s a snapshot of what we offer:

 Continuous learning: Developing the attitude and skills to navigate whatever comes next.
 Success: We will provide the tools and flexibility, so you can make a significant impact, your way.
 Transformative leadership: We will give the insights, mentor and confidence to be the leader the world needs.
 Diverse and inclusive culture: Acceptance for who you are and empowered to use your voice to help others find theirs.

 We ensure that individuals with disabilities are provided reasonable accommodations to participate in the job application or interview process, to perform essential job functions and to receive other benefits and privileges of employment. Please contact us to request accommodations.
 EY is committed to being an inclusive employer, and we are happy to consider flexible working arrangements. We strive to achieve the right balance for our people, enabling us to deliver excellent client service whilst allowing to build your career without sacrificing your personal priorities. While our client-facing professionals can be required to travel regularly, and at times be based at client sites, our flexible working arrangements can help achieve a lifestyle balance.
 If you can confidently demonstrate that you meet the criteria above, please contact us as soon as possible.
 Build your legacy with us!
 Apply now!

",PostedPublicado hace más de 30 días,,,https://www.indeed.com/rc/clk?jk=266240cd8676da1a&fccid=1544766d4c2915b0&vjs=3
