job_title,company,location,job_summary,post_date,more_info,salary,job_url
Senior DevOps Engineer,Andela - Third Party Job Board Only Postings,"Buenos Aires, Buenos Aires","

About Andela
 Andela exists to connect brilliance and opportunity. Since 2014, we have been dedicated to breaking down global barriers and accelerating the future of work for both technologists and organizations around the world.
 For technologists, Andela offers competitive long term career opportunities with leading organizations, access to a global community of professionals, and education opportunities with leading technology providers.
 For companies, Andela provides access to a global network of fully integrated team members that unlock their business' innovation and growth potential.
 At Andela, we are deeply passionate about creating long-lasting and transformative growth opportunities for all and doing it in an E.P.I.C. [andela.com/careers] way.
 We are excited to continue building our remote first team with incredible people like you!

 About the role

We are looking for a Senior DevOps Engineer with solid expertise in Jenkins/Groovy and GCP to help with the orchestration of creating the pipelines and deploying the Container images in Google Cloud.

Responsibilities:

Understanding customer requirements and project KPIs
Planning the team structure, activities, and involvement in project management activities.
Setting up tools and required infrastructure.
Encouraging and building automated processes wherever possible
Selecting and deploying appropriate CI/CD tools

Requirements:

At least 5 years of professional experience working as a DevOps.
Experience administering continuous integration (CI/CD) systems such as Jenkins, Teamcity, Buildkite, or similar.
Experience in Containerization (Docker/Kubernetes) and infrastructure as code skills (Ansible, Terraform, or similar.)
Experience scaling, building, and deploying systems through cloud environments.
Advanced level of English (both written and oral).

#LI-FM

 Benefits

Fully Remote work culture - we hire globally and all of our roles are fully remote!
Bring your own device stipend - buy your own laptop with funds from Andela
Quarterly work from home stipends
Flexible working hours
Equity (as a part of compensation package)
Healthcare, 401k / pension (US only)
Andela Affinity Groups
Growth & development paths
Generous Paid Time Off, Parental Leave, Compassionate Leave
And more to come! We're on a journey to reimagine global benefits at Andela

At Andela, we outcompete through diversity. We know that our strengths lie in the multiplicity of talents, perspectives, backgrounds & orientations resident in our community and we take pride in that. Andela is committed to a work environment in which all individuals are treated with respect and dignity. Each individual has the right to work in a professional atmosphere that promotes equal employment opportunities and prohibits discriminatory practices. Andela provides equal employment opportunities and workplace to all employees and applicants without regard to factors including but not limited to race, color, religion, gender, sexual orientation, gender identity, national origin, age, disability, pregnancy (including breastfeeding), genetic information, HIV/AIDS or any other medical status, family or parental status, marital status, amnesty or status as a covered veteran in accordance with applicable federal, state and local laws. This commitment applies to all terms and conditions of employment, including but not limited to hiring, placement, promotion, termination, layoff, recall, transfer, leaves of absence, compensation and training. Our policies expressly prohibit any form of harassment and/or discrimination as stated above.
 Andela is home for all, come as you are.

",Postedhace 8 días,,,https://www.indeed.com/rc/clk?jk=b179af0d9d82aae2&fccid=f783f8fbbe72c927&vjs=3
SENIOR DEVOPS (WITH AWS),Svitla Systems,Desde casa,"







        Svitla Systems Inc. is looking for a Senior DevOps (with AWS) for a full-time position (40 hours per week) in Argentina. Our client is on-demand fuel management, tax automation, and compliance software provider. They deliver innovative, scalable cloud-based fuel logistics solutions that streamline fuel distribution. Fuel retailers, wholesalers, and haulers gain real-time visibility and paperless control of their fuel buying, dispatching, and reconciliation on desktop, laptop, tablet, or phone. The fuel management system integrates all major suppliers, distributors, terminals, and price feeds in one standard fuel supply chain by automating all aspects of the fuel management process from procurement, inventory management, demand forecasting, strategic sourcing, financial reconciliation, and margin analysis, and environmental compliance monitoring. The client provides industry-leading software and services to suppliers, distributors, convenience stores, carriers, and fleets that manage transportation fuels worldwide. It delivers operational and financial value for companies responsible for more than 30 billion gallons of gasoline and diesel annually. It is a technical position in a highly experienced technical team IoT environment with real production loads. Lots of opportunities to learn and innovate. You will have the chance to work with a wide range of AWS web services & third parties.
       




          Requirements:
        


 4+ years of experience with cloud-based (AWS cloud) IaaS management frameworks: configuration, operations, auto-scaling.
 2+ years of experience with MySQL and Oracle databases required.
 Working understanding of configuration management frameworks for automated deployment: Ansible, Terraform.
 Bachelor's degree in Computer Science or related field.
 Proficiency in Linux system administration, shell scripting, and troubleshooting.





          Responsibilities:
        


 Maximize maintainability and efficiency of all current systems/software via code and performance monitoring and optimization, reporting, and integration management.
 Debug application issues and provide quick workarounds to bring systems ops to be normal.
 Design, build, configure & manage Amazon AWS-based infrastructure and configuration.
 Develop scripts using configuration management frameworks: Terraform, Ansible, Docker, Chef.





          Will be a plus:
        


 Familiarity with SOA, Enterprise Architect, Jenkins, and Nagios.
 Knowledge of Python, PowerShell, Ruby, or Java languages.





          We Offer:
        


 US and EU projects based on advanced technologies.
 Competitive compensation based on skills and experience.
 Annual performance appraisals.
 Remote-friendly culture and no micromanagement.
 Bonuses for recommendations of new employees.
 Bonuses for article writing, public talks, other activities.
 15 vacation days, 10 national holidays, sick leaves.
 Udemy unlimited training account.
 Free webinars, meetups and conferences organized by Svitla.
 Fun corporate celebrations and activities.
 Awesome team, friendly and supportive community!





          About Svitla:
        

 Svitla Systems is a global trusted IT solutions company headquartered in California, with business and development offices throughout the US, Latin America, Europe, and Asia. Svitla is an outspoken advocate of workplace flexibility, best known for its well-established remote culture, individual approach to our teammate’s professional and personal growth, and family-like environment.
 Since 2003, Svitla has served a wide range of clients, from innovative start-ups in California to mega-large corporations such as Ingenico, Amplience, InvoiceASAP and Global Citizen. At Svitla, developers work with clients’ teams directly, building lasting and successful partnerships, as a result of seamless integration with on-site processes.

           Svitla Systems’ global mission is to build a business that contributes to the well-being of our partners, personnel and their families, improves our communities, and makes a lasting difference in the world. Join us!
         














        SHARE
      
















If you are interested in our vacancy, please send your CV. We will be happy to see you in our friendly team :)





",Postedhace 30+ días,,,https://www.indeed.com/rc/clk?jk=cf3171b1833b7894&fccid=2f27a82023b4a64f&vjs=3
Desarrollador DevOps,iStorming,"Ramos Mejía, Buenos Aires","

Fecha: 2022-05-03 10:02:28
Ref: 59493

En iStorming nos encontramos en la búsqueda de un Desarrollador DevOps Sr., para importante entidad bancaria   Tareas y Funciones:   - Responsable de analizar la madurez actual del banco en DevOps. Identificar los gaps y elaborar el roadmap de adopción de prácticas DevOps - Analizar los requerimientos de construcción y despliegue en el squad que trabaje. Diseñar el pipeline de DevOps en función a las herramientas y requerimientos establecidos - Definir las mejores prácticas DevOps para el proyecto y los squads en los que participe   Para este rol debes contar con los conocimientos y experiencia en: - Metodologías de trabajo e integraciones con DevOps. - Herramientas de CI/CD - Adopción de Prácticas DevOps   Familiarizado con: - Mejores Prácticas en Seguridad - Arquitectura en Cloud - AWS - Confluence, Jira o herramientas de colaboración similares - Agile, Scrum, Dev0ps, Test Driven Development, Business Driven Development - GitLab - Gradle Tools mandatorios: Rancher, Jenkins.   Horario de trabajo: Lunes a viernes de 9:00 a 18:00 hs Por favor, enviar CV (en formato .doc) a seleccionrrhh@istorming.com.ar indicando remuneración bruta pretendida y Ref 59493 - Desarrollador DevOps.- Muchas gracias
",Postedhace 30+ días,,,https://www.indeed.com/rc/clk?jk=d351d40a7b0cb81f&fccid=e5723587cfeb9b34&vjs=3
Senior Azure DevOps Engineer,Fusemachines,Desde casa,"
About Fusemachines:
 Fusemachines is a leading AI strategy, talent, and education services provider. Founded by Sameer Maskey Ph.D., Adjunct Associate Professor at Columbia University, Fusemachines has a core mission of democratizing AI. With a presence in 4 countries (Nepal, the United States, Canada, and the Dominican Republic and more than 250 full-time employees). Fusemachines seeks to bring its global expertise in AI to transform companies around the world.
 Job Type:
 This is a remote full-time consulting position.
 Role Scope:

 Designing and developing high-volume, low-latency applications for mission-critical systems and delivering high-availability and performance
 Contribute to all phases of the development lifecycle
 Write well designed, testable, efficient code
 Evaluate and propose improvements to the existing system
 Support continuous improvement by investigating alternatives and technologies and presenting these for architectural review
 Infrastructure Engineering
 Maintain and evolve application cloud infrastructure (Azure)
 Maintain and evolve Kubernetes clusters on bare metal and SAAS based
 Infrastructure hardening according to compliance and security requirements
 Maintenance and development of monitoring, logging, tracing, and alerting solutions
 Build CI/CD pipeline - Jenkins
 Implement a Disaster Recovery solution
 Build Multi-Region solution
 Advance monitoring solution with APM and cloud infra monitoring
 Upgrade third-party software with zero downtime

 Technologies required:

 Linux and Windows servers
 Bash and Python scripting
 Kubernetes, Terraform, Ansible, Azure (IAC)
 Jira, Jenkins, Jfrgo (Tools)
 Jira ticketing tool, MS team for better communications
 ELK and Nagios (Monitoring tool)s
 Github

 Requirements for the role:

 BS/MS degree in Computer Science, Engineering or a related subject
 10+ years of industry experience
 Experience in building distributed systems
 A hands-on approach to implementing solutions
 Good understanding of Linux networking and security
 Experience in working with public cloud infrastructure providers(AWS/Azure/Google Cloud)
 Understanding of Kubernetes concepts
 Experience with Terraform, Docker
 Experience with Bash and Python scripting and databases such as SQL
 Contributions to open-source projects are a plus
 Certification on Azure or any public cloud is a plus

 Equal Employment Opportunity
 We're proud to be an equal opportunity employer - and celebrate our employees' differences, including race, color, religion, sex, sexual orientation, gender identity, national origin, age, disability, and Veteran status. Differences make us better.
 
 
2iJAW0Hzxc
",Postedhace 30+ días,Tiempo completo,,https://www.indeed.com/rc/clk?jk=a4c21112c67338d4&fccid=b711a2a28448b767&vjs=3
Ingeniero DevOps,CIDER S.A.,"San Nicolas, Buenos Aires","


Argentina, CABA - San Nicolás 

Nos encontramos en búsqueda de un Ingeniero DevOps para importante empresa multinacional de de consultoría y servicios de tecnología de la información.

 Conocimientos Requeridos Azure Azure Devops IIS, Web .NET, NetCore Dockers, Kubernetes  Conocimientos Opcionales Databricks / Datafactory PowerBI, Analisys Services, Synapse

 Jornada laboral: Full Time








Información Adicional


Lugar: Argentina, CABA - San Nicolás
Horario: Full Time
Salario: A convenir
Idiomas: 
Tecnologías: Este anuncio no contiene tecnologías asociadas



",Postedhace 30+ días,Tiempo completo,,https://www.indeed.com/rc/clk?jk=3267b07e6a52b970&fccid=ca1184545e19f24b&vjs=3
DevOps Senior - (Python & Cloud) - Monitoring,"JPMorgan Chase Bank, N.A.","Buenos Aires, Buenos Aires","
 Site Reliability Engineering 
 
 We are looking for candidates who bring fresh ideas, demonstrate a unique and informed viewpoint, and enjoy collaborating with a cross-functional team to develop real-world solutions and positive user experiences at every interaction. 
 

Role 


Real time adoption, tracking and usage of Application Performance Monitoring (APM) 
Provide operational support for applications across CIB using APM tools, continuously analyze ways to improve efficiency, stability, and reliability 
Improve reliability, quality, and time-to-market of our suite of software solutions 
Measure and optimize system performance, with an eye toward pushing our capabilities forward, getting ahead of customer needs, and innovating to continually improve 
Understand manual process carried out and implement automations to eliminate the toil, this is also extended to reducing the volume of application alerts across the LOB 
Improve reliability of systems and time to market our clients requirement or issues 
Measurement of system performance and optimize application services 
Establish Center of Excellence with regularly contributing members and associated documentation 
Validate the existing recovery capabilities and implement solutions to reduce recovery time objective by automating manual tasks 
Implementation of SLO/SLI and effectively manage and review at regular intervals with an intention of overall customer satisfaction 
Knowledge of build/release systems and process 
Good to have experience with various managed and self-hosted CI/CD tooling (Jenkins) 
Proficient with SCM (source code management / versioning) tools like Git 
Good to have experience with containers (Docker, Kubernetes) 
Experience with evaluating and applying new technologies and applying the right tool for the right job 


Technical Skills 


Python, Java 
SQL server / Oracle 
Cloud - AWS and Kubernetes knowledge preferred 
Monitoring and Alerting Tools: Geneos, Dynatrace or experience of any other monitoring tool sets or log aggregators like Splunk/Kibana 
Ticketing System: ServiceNow knowledge preferred used for Change, Incident, problem or Service problems 


Core Skills 


Clear analytical thinking and excellent communication skills 
Self-starter, ability to work in a team or autonomously when required 
Ability and willingness to adapt to evolving and develop technical SME and business knowledge 
Commitment and ability to meet deadlines in a high pressure & constantly changing environment 
Logging, analyzing and managing queries, problems and incidents to resolution 
Helping to drive continuous improvement within the team as related to incident, problem and change management excellence 
Understanding the impact of change in a complex technical environment 

J.P. Morgan is a global leader in financial services, providing strategic advice and products to the world's most prominent corporations, governments, wealthy individuals and institutional investors. Our first-class business in a first-class way approach to serving clients drives everything we do. We strive to build trusted, long-term partnerships to help our clients achieve their business objectives.
 We recognize that our people are our strength and the diverse talents they bring to our global workforce are directly linked to our success. We are an equal opportunity employer and place a high value on diversity and inclusion at our company. We do not discriminate on the basis of any protected attribute, including race, religion, color, national origin, gender, sexual orientation, gender identity, gender expression, age, marital or veteran status, pregnancy or disability, or any other basis protected under applicable law. In accordance with applicable law, we make reasonable accommodations for applicants' and employees' religious practices and beliefs, as well as any mental health or physical disability needs.
",Postedhace 22 días,Tiempo completo +1,,https://www.indeed.com/rc/clk?jk=5a58876794a02804&fccid=aaf3b433897ea465&vjs=3
DevOps Engineer,Softvision,"Buenos Aires, Buenos Aires","
DESIGNING EXPERIENCES. ENGINEERING OUTCOMES
Cognizant Softvision is a leading product engineering company, creating impactful end-to-end digital products and solutions that connect brands with customers. Delivering sustainable innovation, agility and a connection that inspires engagement and business transformation, we’ve worked with some of the world’s largest leading brands. Cognizant Softvision has over 3,000 product, design and engineering professionals across a network of global studios in nine countries and five continents. Learn how Cognizant Softvision designs experiences and engineers outcomes that result in memorable interactions at www.cognizantsoftvision.com or follow us @WeAreSoftvision.
The ideal candidate has a passion for DevOps Automation as well as development and experience in a cross-functional team.
Skills

Azure Services (App Service Plan, Front door, Azure Storage, Application Gateway, API Management, AKS, Kudu, App Insights, Azure SQL, Azure Cosmos, etc.).
ARM templates / DSC
Hands on experience in building pipelines
Azure DevOps (pipelines, artifacts, environments, etc.)
Powershell
Git
Yaml

Experience

Strong understanding and hands-on experience architecting deployments of applications Azure Platform (PaaS, IaaS).
Strong understanding of Microservice based architecture, API contracts and Swagger.
Skilled with CI/CD using Azure DevOps
Experience integrating pipelines with code scanning tools or other security tools
Experience with System Administration and Security testing and hardening of cloud-based SaaS solutions
Experience with Docker containers, container orchestration and container platforms (AKS)
Strong written and verbal communication skills in English
Experience leading efforts focused on building a Multi-Tenant SaaS platform would be ideal.
1+ years of experience with DevOps infrastructure automation tools (ARM templates/Terraform)


We are a thriving Community of top technology talent that is globally connected. We design and engineer the products and solutions of many brands that you know and love. No matter where you are on your digital career roadmap, we can help you grow and have fun while doing it. Let’s take this journey together!




Benefits


 Great globally diverse culture
 Flexible work-life balance 
Ongoing career development
 Relocation opportunities
 Competitive Salary

",Postedhace 30+ días,,,https://www.indeed.com/rc/clk?jk=55826d1534ca3bda&fccid=bc6d68ab22143afb&vjs=3
DevOps Engineers,RH Master,"Córdoba, Córdoba","Seleccionamos para empresa del rubro tecnológico del mundo del software, “DevOps Engineers” 

 La Empresa es norteamericana, además se encuentra en varios países y abrió una sucursal en Córdoba Capital en zona céntrica/Barrio General Paz. 

 Son varios puestos, niveles semi seniors y seniors. Se van a proporcionar excelentes beneficios y muy buen sueldo y se va a atender a los clientes que poseen en EEUU. Puede ser trabajo trabajo remoto, on site o un mix, a convenir. 


REQUISITOS:
 2-5 years of relevant industry experience 

 Solid understanding of public cloud providers, AWS preferred 

 Experience with containerization and Kubernetes 

 Experience with monitoring, analysis, and alerting tools 

 Linux/UNIX admin experience 

 Good understanding of networking, routing, firewalls, vpn, SSL 

 Proficient in at least one scripting language, Python preferred 

 Familiarity with automation and configuration management tools 

 Experience with infrastructure as code tools, terraform preferred 

 Knowledge of Continuous Integration (CI), Continuous Delivery (CD) 

 Keen attention to detail and industry best practices pertaining privacy and security 


Inglés: Oral intermedio al menos. Buen manejo de inglés- Se va a capacitar en inglés- 


SE OFRECE:

– Muy buenos beneficios de primer nivel: relación de dependencia, almuerzo gratis, muy buena obra social, cochera gratis para quien vaya en auto, clases de inglés, capacitación constante, trabajar con las últimas tecnologías del mercado, transporte, y posibilidad de trabajo REMOTO o 90/10, por ejemplo 4 días remoto y 1 On Site, ó 3 días remoto y 2 On Site; o todo remoto ( a negociar de acuerdo a conveniencias ). 

 – Posibilidades de Viajes a EEUU. 

 – Excelente remuneración dependiendo nivel técnico. 

 – Proyectos muy atractivos y con tecnologías modernas de última generación. 


Enviar cv por mail a: sistemas@rhmaster.com.ar 
Comparte la información en tus Redes y/o Contactos",Postedhace 30+ días,,,https://www.indeed.com/rc/clk?jk=6e5203f91f98f2fe&fccid=ba1a816e070e8a74&vjs=3
DevOps / inglés avanzado,ADN Recursos Humanos,Desde casa,"















Ref. 
15910 
DevOps / inglés avanzado


Seniority: Sr, Semi Sr. 
             

Des
cripción: 
ADN
 - 
Recursos
 
Humanos
 estamos en la búsqueda de 
              DevOps / inglés avanzado para Importante Empresa de desarrollo de software, transformación digital y CRM. 
             

Detalle



Experiencia como AWS DevOps (3+ años)
Experiencia trabajando con Kubernetes (2+ años) RDS deployment and management experience
Experiencia con Linux (3+ años)
Conocimiento de trabajo con microservicios




Lugar de trabajo: Remoto. 
             

Lugar de residencia: Remoto. 
             

Horario: De lunes a Viernes de 9hs a 18hs. 
             

Edad: Indistinto. 
             

Sexo: Indistinto. 
             

Disponibilidad para viajar:


Idioma Inglés: Avanzado. 
             

Fecha de Inicio: Inmediato. 
             

Modalidad: Relación de Dependencia con Nuestro Cliente.
             

Duración: A largo plazo.
             

Posiciones a cubrir
:
 1.
             

              Para Importante Empresa
             

              La persona que asuma este puesto tendrá la posibilidad de desarrollarse dentro de un equipo de profesionales de alta calidad, con excelente ambiente laboral, remuneración acorde al desafío, más otros beneficios
             



Los Interesados por favor enviar CV a: 
cv@adnrh.com.ar
 - Asunto Ref. 15910


              Si usted desea tener conocimiento de todas las búsquedas laborales que realiza 
              ADN
 - 
Recursos Humanos vía correo electrónico, por favor suscríbase, enviando un mail a la casilla de correo 
              cv@adnrh.com.ar colocando en asunto
             














",Postedhace 9 días,,,https://www.indeed.com/rc/clk?jk=59b914d8711f133c&fccid=862ffa4c783502f9&vjs=3
