companyName,company_starRating,job_title,employee_residence,listing_jobDesc,salary,requested_url,company_location,company_size
PINCH B.V.,NA,Mobile App Developer,España,"At Pinch Apps Spain we are looking for Android, iOS and Flutter developers in our new office in MalagaAbout usWould you like to be part of a company that has more than 11 years of experience in mobile development but still retains the Start-up feel? Don't miss out, join our international team of professionals who share the same passion as you. At Pinch we pride ourselves on creating top quality apps, if you are a medior or senior Flutter/ Android/ iOS developer, come and join our growing Malaga team.Pinch is a well-known app development agency in Amsterdam, the Netherlands, where we work on leading apps every day. Due to the success, the company expands with a branch in Malaga Center. By the end of 2022, we want to work with 12 colleagues from Malaga in a healthy mix of seniors, mediors and juniors. You are one of them? We hope to open the branch in Spain in early 2022. Until then, you will work from home.About youYou are passionate about learning new skills and personal growth.You have been developing Flutter/ Android/ iOS applications for at least 3 years in a professional environment. In the case of Android you have developed with a Kotlin-mindset, while in iOS you develop in Swift.You are familiar with functional and reactive programming.You have knowledge of common design patterns in mobile development (MVC & MVVM), as well as basic knowledge of databases.You build effective user interfaces.You use Gitflow + Pull Requests, and have experience reviewing other developers' code.You have a curious heart, keeping up with the latest technologies.You take pride in the code you write and feel responsible for the work you deliver.You give your feedback to others and advise them when you think it is necessary, and you can receive it in the same way.You show a lot of enthusiasm, entrepreneurial spirit and creativity.You have a university degree or higher degree in studies related to information technology.You live in Spain, preferably MalagaYou have an advanced level of English & SpanishThe roleAs part of this job, you will work closely with our other engineers to improve and develop Flutter/ Android/ iOS based applications. We need someone who is able to develop applications that work with clean code, in addition to supporting the life cycle of each application. To ensure success, all code is reviewed by other developers, where we pay close attention to detail and that is why we are so successful with our clients.A successful Pinch candidate has work experience as a Flutter/ Android/ iOS developer, as well as a demonstrable portfolio with different projects. Furthermore, he has the ability to work in a fast-paced team environment and an innovative mindset are also crucial to fit right into the team.BenefitsCompetitive salary (same salary as in the Netherlands).Flexible working hours.Hybrid work model; As long as you come to the office once or twice a week, you can organise your weeks however you like.Fun events and other activities; because there is more to life than work. To stay up to date with the latest technologies, you can also join conferences, summits, or whatever, all over the world with other Pinch members.Exchanges with the Amsterdam office, where the Pinch Spain workers will go to Amsterdam for 1 week to work in a new environment and enjoy the Dutch capital, while the Dutch team will stay in Malaga for 1 week to work and enjoy the time offered by Spain.Exciting and diverse projects; a good challenge is always entertaining.Job Types: Full-time, PermanentSalary: 30,000.00€ - 60,000.00€ per yearAbility to commute/relocate:Málaga, Málaga provincia: Reliably commute or planning to relocate before starting work (Required)Application Question(s):Do you live in Malaga/ Andalucia?Experience:app development: 3 years (Preferred)Language:English (Required) At Pinch Apps Spain we are looking for Android, iOS and Flutter developers in our new office in MalagaAbout usWould you like to be part of a company that has more than 11 years of experience in mobile development but still retains the Start-up feel? Don't miss out, join our international team of professionals who share the same passion as you. At Pinch we pride ourselves on creating top quality apps, if you are a medior or senior Flutter/ Android/ iOS developer, come and join our growing Malaga team.Pinch is a well-known app development agency in Amsterdam, the Netherlands, where we work on leading apps every day. Due to the success, the company expands with a branch in Malaga Center. By the end of 2022, we want to work with 12 colleagues from Malaga in a healthy mix of seniors, mediors and juniors. You are one of them? We hope to open the branch in Spain in early 2022. Until then, you will work from home.About youYou are passionate about learning new skills and personal growth.You have been developing Flutter/ Android/ iOS applications for at least 3 years in a professional environment. In the case of Android you have developed with a Kotlin-mindset, while in iOS you develop in Swift.You are familiar with functional and reactive programming.You have knowledge of common design patterns in mobile development (MVC & MVVM), as well as basic knowledge of databases.You build effective user interfaces.You use Gitflow + Pull Requests, and have experience reviewing other developers' code.You have a curious heart, keeping up with the latest technologies.You take pride in the code you write and feel responsible for the work you deliver.You give your feedback to others and advise them when you think it is necessary, and you can receive it in the same way.You show a lot of enthusiasm, entrepreneurial spirit and creativity.You have a university degree or higher degree in studies related to information technology.You live in Spain, preferably MalagaYou have an advanced level of English & SpanishThe roleAs part of this job, you will work closely with our other engineers to improve and develop Flutter/ Android/ iOS based applications. We need someone who is able to develop applications that work with clean code, in addition to supporting the life cycle of each application. To ensure success, all code is reviewed by other developers, where we pay close attention to detail and that is why we are so successful with our clients.A successful Pinch candidate has work experience as a Flutter/ Android/ iOS developer, as well as a demonstrable portfolio with different projects. Furthermore, he has the ability to work in a fast-paced team environment and an innovative mindset are also crucial to fit right into the team.BenefitsCompetitive salary (same salary as in the Netherlands).Flexible working hours.Hybrid work model; As long as you come to the office once or twice a week, you can organise your weeks however you like.Fun events and other activities; because there is more to life than work. To stay up to date with the latest technologies, you can also join conferences, summits, or whatever, all over the world with other Pinch members.Exchanges with the Amsterdam office, where the Pinch Spain workers will go to Amsterdam for 1 week to work in a new environment and enjoy the Dutch capital, while the Dutch team will stay in Malaga for 1 week to work and enjoy the time offered by Spain.Exciting and diverse projects; a good challenge is always entertaining.Job Types: Full-time, PermanentSalary: 30,000.00€ - 60,000.00€ per yearAbility to commute/relocate:Málaga, Málaga provincia: Reliably commute or planning to relocate before starting work (Required)Application Question(s):Do you live in Malaga/ Andalucia?Experience:app development: 3 years (Preferred)Language:English (Required) Mostrar más ","Est. de la empresa:€30,000 - €60,000 ",https://www.glassdoor.es/partner/jobListing.htm?pos=124&ao=1136043&s=58&guid=00000182b0ad9d6ca5b26f68e5d0c2b9&src=GD_JOB_AD&t=SR&vt=w&ea=1&cs=1_44cceda8&cb=1660821544781&jobListingId=1007820742595&jrtk=3-0-1gaoar7i3i6it801-1gaoar7ingagk800-04dba51afbcff511-,NA,NA
XING - New Work,NA,(Senior) Node.js developer (Full-Remote Spain),Barcelona,"NEW WORK SE offers a wide range of brands, products and services for a better working life. One of our flagship products is XING e-recruiting, which offers tools and solutions that help companies find the right employees, as well as an extensive employer branding portfolio so customers can draw more attention to themselves as an employer.A challenging taskAs a member of our talented team, under Agile Development methodologies, your focus will be the development and maintenance of our web-based Recruiting products. We lead the German speaking market for social recruiting products.A convincing backgroundYou must be elegible to work in the European Union, the Company will not Sponsorship Visas or Work PermitsExperience in Node.js (Typescript) as Backend technology. Typescript experience is not required but it is a plus : )Testing (Unit Testing / End to end).DevOps mindset (you build it, you own it)Constantly evolving with the technology trends, and willing to embrace change.Team spirit and willingness to share knowledge with your colleagues.Fluent in English.Bonus pointsExperience in PHP and/or Ruby on Rails.Experience with frontend web technologies like React, Angular, Vue.Hands-on experience on Kubernetes as developer.Hands-on experience on AWS as developer.An inspiring environmentCheck our Twitter account! https://twitter.com/NewWork_esTraining, conferences and many opportunities to learn, experiment and grow.Innovation weeks (Hackweeks)Flexible working hours and remote flexibilityRestaurant tickets, coffee and snacks.Spanish / English/ German lessons.A mobile device of your choice (iPhone, iPad, Android…).A great, multicultural and diverse environment.A sunny office located in the centre of Barcelona, with a large terrace.Flexible Compensation Plan: Health insurance/ Transport/ Nursery TicketsExtended holidaysCompetitive salary and a Permanent contractBicycle park and package receptionRelocation pack if needed.We're looking forward to hearing from you!Tipo de puesto: Jornada completa, Contrato indefinidoSalario: 40.000,00€-65.000,00€ al añoBeneficios:Eventos de la empresaFlexibilidad horariaPrograma de formaciónTeléfono de empresaTeletrabajo opcionalTicket restauranteHorario:Turno de 8 horas NEW WORK SE offers a wide range of brands, products and services for a better working life. One of our flagship products is XING e-recruiting, which offers tools and solutions that help companies find the right employees, as well as an extensive employer branding portfolio so customers can draw more attention to themselves as an employer.A challenging taskAs a member of our talented team, under Agile Development methodologies, your focus will be the development and maintenance of our web-based Recruiting products. We lead the German speaking market for social recruiting products.A convincing backgroundYou must be elegible to work in the European Union, the Company will not Sponsorship Visas or Work PermitsExperience in Node.js (Typescript) as Backend technology. Typescript experience is not required but it is a plus : )Testing (Unit Testing / End to end).DevOps mindset (you build it, you own it)Constantly evolving with the technology trends, and willing to embrace change.Team spirit and willingness to share knowledge with your colleagues.Fluent in English.Bonus pointsExperience in PHP and/or Ruby on Rails.Experience with frontend web technologies like React, Angular, Vue.Hands-on experience on Kubernetes as developer.Hands-on experience on AWS as developer.An inspiring environmentCheck our Twitter account! https://twitter.com/NewWork_esTraining, conferences and many opportunities to learn, experiment and grow.Innovation weeks (Hackweeks)Flexible working hours and remote flexibilityRestaurant tickets, coffee and snacks.Spanish / English/ German lessons.A mobile device of your choice (iPhone, iPad, Android…).A great, multicultural and diverse environment.A sunny office located in the centre of Barcelona, with a large terrace.Flexible Compensation Plan: Health insurance/ Transport/ Nursery TicketsExtended holidaysCompetitive salary and a Permanent contractBicycle park and package receptionRelocation pack if needed.We're looking forward to hearing from you!Tipo de puesto: Jornada completa, Contrato indefinidoSalario: 40.000,00€-65.000,00€ al añoBeneficios:Eventos de la empresaFlexibilidad horariaPrograma de formaciónTeléfono de empresaTeletrabajo opcionalTicket restauranteHorario:Turno de 8 horas Mostrar más ","Est. de la empresa:€40,000 - €65,000 ",https://www.glassdoor.es/partner/jobListing.htm?pos=102&ao=1110586&s=58&guid=00000182b0ad9d6ca5b26f68e5d0c2b9&src=GD_JOB_AD&t=SR&vt=w&ea=1&cs=1_dcf05449&cb=1660821544779&jobListingId=1007748918030&cpc=678FF63AF7ACCB7E&jrtk=3-0-1gaoar7i3i6it801-1gaoar7ingagk800-82f7470581a23a07--6NYlbfkN0DSr4Wpy1KbGW0zC1DazaEuaagAS5TMgy6Wr7HxEcfbaINoZsO9AY_Xa91yu6rm_jHgCWUsZocf4nVcx5VpLcMwA_DSYkiV6VrlBsliSL4XVDbtGl6-SWo2fqSkSFhnKq02uhn4DmY1o8w3bbXdjtKSr1y5sTokjXsih5MYXfvqPaAMuTG1rmRx69ev_LfOcRgUiJvQSqkA84HihW2lPCsILaIB-JyiXNOP6Vo4NsMCOdcluhURgW_46sbtUPyChd-8X8S9quFi_55e-jPSllRS90sZvHrk-__U-GPqGeBljvn5sIAEX_q-664E0S2q59VHq6LpIAHAyws6HRsa3r8x7YjpgW2ByI_VOiw2hkSQRRstLM2HfRNrmCHqWcl9TNsrLhkgFl74Nief4TvuT2JuThO4UVP0kiHrpMJy4vXoHw5kN6yo5pr8lFMBrih-eDKr6PmGG5pGAewd7LQ3vr3K-DrDeyZYxlG6ZFcK5Y4xJBsINsZXqUNfPD1ZyVJbw2SfTgG3WOTY4b1VThMlRB-BDH6GT3KNr6c%3D,NA,NA
XING - New Work,NA,Frontend Developer React (Full-Remote Spain),Barcelona,"XING is one of the flagship products within New Work. XING is the social network for business professionals with millions of members all over the world. We lead the German speaking market for social recruiting products.Help us shape the future – for a better working life!A challenging taskYou’ll be creating and improving reusable components in our React based frontend stackYou will be responsible for structure, maintainability and quality of your applicationsYou have web performance in mind and drive this topic through tooling and consultancyYou work closely together with your team of fellow developers, product owners, designers and QA engineersYou collaborate with other teams in XING's frontend ecosystemYou have the great opportunity to work in an international, cross-functional environment (communicating in English, German is not required).A Convincing BackgroundStrong frontend skills (HTML, CSS, JavaScript)Knowledge or solid experience with the React libraryKnowledge in node.js, npm and the ecosystem around javascript dependency management are a bonusAn eye for proportion and usabilityExperience in unit testing frontend applicationsYou are a team player, used to work in agile environmentsYou know your qualities, share them with your team and are happy to further develop yourselfYou can comprehensively communicate on a technical level and speak english fluently in written and spoken languageAn inspiring environmentCheck our Twitter account! https://twitter.com/NewWork_esTraining, conferences and many opportunities to learn, experiment and grow.Innovation weeks (Hackweeks)Flexible working hours and remote flexibilityRestaurant tickets, coffee and snacks.Spanish / English/ German lessons.A mobile device of your choice (iPhone, iPad, Android…).A great, multicultural and diverse environment.A sunny office located in the centre of Barcelona, with a large terrace.Flexible Compensation Plan: Health insurance/ Transport/ Nursery TicketsExtended holidaysCompetitive salary and a Permanent contractBicycle park and package receptionRelocation pack if needed.We're looking forward to hearing from you!Job Types: Full-time, PermanentSalary: 30,000.00€ - 60,000.00€ per yearExperience:React: 1 year (Required)Language:English (Required) XING is one of the flagship products within New Work. XING is the social network for business professionals with millions of members all over the world. We lead the German speaking market for social recruiting products.Help us shape the future – for a better working life!A challenging taskYou’ll be creating and improving reusable components in our React based frontend stackYou will be responsible for structure, maintainability and quality of your applicationsYou have web performance in mind and drive this topic through tooling and consultancyYou work closely together with your team of fellow developers, product owners, designers and QA engineersYou collaborate with other teams in XING's frontend ecosystemYou have the great opportunity to work in an international, cross-functional environment (communicating in English, German is not required).A Convincing BackgroundStrong frontend skills (HTML, CSS, JavaScript)Knowledge or solid experience with the React libraryKnowledge in node.js, npm and the ecosystem around javascript dependency management are a bonusAn eye for proportion and usabilityExperience in unit testing frontend applicationsYou are a team player, used to work in agile environmentsYou know your qualities, share them with your team and are happy to further develop yourselfYou can comprehensively communicate on a technical level and speak english fluently in written and spoken languageAn inspiring environmentCheck our Twitter account! https://twitter.com/NewWork_esTraining, conferences and many opportunities to learn, experiment and grow.Innovation weeks (Hackweeks)Flexible working hours and remote flexibilityRestaurant tickets, coffee and snacks.Spanish / English/ German lessons.A mobile device of your choice (iPhone, iPad, Android…).A great, multicultural and diverse environment.A sunny office located in the centre of Barcelona, with a large terrace.Flexible Compensation Plan: Health insurance/ Transport/ Nursery TicketsExtended holidaysCompetitive salary and a Permanent contractBicycle park and package receptionRelocation pack if needed.We're looking forward to hearing from you!Job Types: Full-time, PermanentSalary: 30,000.00€ - 60,000.00€ per yearExperience:React: 1 year (Required)Language:English (Required) Mostrar más ","Est. de la empresa:€30,000 - €60,000 ",https://www.glassdoor.es/partner/jobListing.htm?pos=104&ao=1110586&s=58&guid=00000182b0ad9d6ca5b26f68e5d0c2b9&src=GD_JOB_AD&t=SR&vt=w&ea=1&cs=1_d3e9008f&cb=1660821544779&jobListingId=1007736323951&cpc=07D58528F3898F33&jrtk=3-0-1gaoar7i3i6it801-1gaoar7ingagk800-ff1a82b515c0c744--6NYlbfkN0DSr4Wpy1KbGW0zC1DazaEuaagAS5TMgy6Wr7HxEcfbaNVyKcTiUv1wiXHlhAmACPjlCcqXwHCJKag8e1Ilw2JXO608rzOYf2DCCdZlNwmXn-btXMBjsxpP675g_QhBpdpF3MNL0jNwmsebC6GmNoCzJOBNFcXkiSn-BsMoXLWYhkMgLBRMRlnWIHte8-D7RVXLvW7y5tVOKpr0F50PDaNwE0mGKkP1XJY96qBaxGKRFYVk0G_yWwKbSCBnaGI66df8y9EDiMlw_DanTNrLRzErQR3qMKwQjABcDAMzgeBR3c3RujwiNcewvJfECvLwbzyl9cBeBPRjXEJRtvnudwrxdtu7VYhDzOzbVhLnKz4PiORtBG-RKw7tdeHYzcDYVJYSeTotpPdxoKA1eRvB3rapsQDQ-sjLVjyvkb7PawvAuw2dg9mEBMsp-mrhBThzFOJ3ZWNJ9czPAuG3XOAOMvHBtTlRSVSUlnrkJDXNFV-4aZ6CtDzvUr84dXTCyCru4bPUB1aloBnhbsMvnXL2iCZ_,NA,NA
Grupo Sermicro,2.6,"Front End Developer - Angular, 100% En remoto",Trabajo en remoto,"Front End Developer - Angular en 100% En remoto.
¿Quieres ser parte del cambio?

Tenemos la misión de transformar el sector de la construcción aplicando tecnologías disruptivas a procesos de Innovación Investigación y Desarrollo.
Para ello contamos con 6 Hubs de Innovación ubicados en Darmstadt Essen Hong Kong Minneapolis Sydney y Madrid. La comunicación entre todos los centros es casi diaria por lo que nuestra lengua principal es el inglés.
Desde Madrid colaborarás con equipos multidisciplinares formados por unidades de negocio desarrolladores Front y Back End DevOps o QA lo que te permitirá tener una visión completa de los proyectos en los que trabajes.
Tendrás la oportunidad de formarte en nuevas tecnologías como IA IoT o Blockchain según tus inquietudes.

¿Cómo será tu día a día?

Te integrarás en un equipo que está dedicado a desarrollar una plataforma para dar servicio a los proyectos de construcción en áreas como procesamiento y clasificación de nubes de puntos reconocimiento por imagen visualización 2D y 3D gestión y seguimiento de las tareas del día a día control de costes seguimiento de equipos humanos...

Como Front End trabajarás dentro de un equipo Scrum multidisciplinar (Front Back y Mobile developers y QA). Con ellos asistirás a las diferentes ceremonias Scrum (en inglés) y participarás activamente en reuniones de estimación de tareas (poker estimating meeting).

Serás el encargado de desarrollar la interfaz de usuario de la aplicación con Angular 2+ Typescript y Javascript.

Para que tu día a día sea más fácil será necesario que cuentes con experiencia en frameworks de testing y que estés familiarizado con Docker Kubernetes y con los procesos/herramientas de CI/CD.

Qué podemos ofrecerte

Teletrabajo 100 desde cualquier localización en España. Si prefieres trabajar en la oficina también es opción estamos en la zona de Prosperidad (Madrid).
Acceso a plataformas de formación online gracias a ellas podrás reforzar todos tus conocimientos técnicos y aprender nuevos skills en función de tus intereses.
Clases de inglés online
Retribución flexible Tickets restaurant guardería transporte y seguro de salud.

Acerca del proceso de selección

Primera toma de contacto por teléfono con el equipo de Talent te facilitaremos toda la información de la posición y comentaremos juntos tus experiencias profesionales.
Entrevista con los compañeros de Management
Entrevista final con Product Owner
¿Suena bien?

¡Inscríbete y comentamos más detalles de la posición!

angular, javascript, typescript
053c135fc2b2b3d0dc47 Front End Developer - Angular en 100% En remoto.
¿Quieres ser parte del cambio?

Tenemos la misión de transformar el sector de la construcción aplicando tecnologías disruptivas a procesos de Innovación Investigación y Desarrollo.
Para ello contamos con 6 Hubs de Innovación ubicados en Darmstadt Essen Hong Kong Minneapolis Sydney y Madrid. La comunicación entre todos los centros es casi diaria por lo que nuestra lengua principal es el inglés.
Desde Madrid colaborarás con equipos multidisciplinares formados por unidades de negocio desarrolladores Front y Back End DevOps o QA lo que te permitirá tener una visión completa de los proyectos en los que trabajes.
Tendrás la oportunidad de formarte en nuevas tecnologías como IA IoT o Blockchain según tus inquietudes.

¿Cómo será tu día a día?

Te integrarás en un equipo que está dedicado a desarrollar una plataforma para dar servicio a los proyectos de construcción en áreas como procesamiento y clasificación de nubes de puntos reconocimiento por imagen visualización 2D y 3D gestión y seguimiento de las tareas del día a día control de costes seguimiento de equipos humanos...

Como Front End trabajarás dentro de un equipo Scrum multidisciplinar (Front Back y Mobile developers y QA). Con ellos asistirás a las diferentes ceremonias Scrum (en inglés) y participarás activamente en reuniones de estimación de tareas (poker estimating meeting).

Serás el encargado de desarrollar la interfaz de usuario de la aplicación con Angular 2+ Typescript y Javascript.

Para que tu día a día sea más fácil será necesario que cuentes con experiencia en frameworks de testing y que estés familiarizado con Docker Kubernetes y con los procesos/herramientas de CI/CD.

Qué podemos ofrecerte

Teletrabajo 100 desde cualquier localización en España. Si prefieres trabajar en la oficina también es opción estamos en la zona de Prosperidad (Madrid).
Acceso a plataformas de formación online gracias a ellas podrás reforzar todos tus conocimientos técnicos y aprender nuevos skills en función de tus intereses.
Clases de inglés online
Retribución flexible Tickets restaurant guardería transporte y seguro de salud.

Acerca del proceso de selección

Primera toma de contacto por teléfono con el equipo de Talent te facilitaremos toda la información de la posición y comentaremos juntos tus experiencias profesionales.
Entrevista con los compañeros de Management
Entrevista final con Product Owner
¿Suena bien?

¡Inscríbete y comentamos más detalles de la posición!

angular, javascript, typescript
053c135fc2b2b3d0dc47 Mostrar más ","Est. de la empresa:€45,000 - €54,000 ",https://www.glassdoor.es/partner/jobListing.htm?pos=125&ao=1136043&s=58&guid=00000182b0ad9d6ca5b26f68e5d0c2b9&src=GD_JOB_AD&t=SR&vt=w&cs=1_643bb238&cb=1660821544782&jobListingId=1007873466341&jrtk=3-0-1gaoar7i3i6it801-1gaoar7ingagk800-ec937271192f27af-,"Madrid, España",Desconocido
