companyName,company_starRating,job_title,employee_residence,listing_jobDesc,salary,requested_url,company_location,company_size
Hyvikk Solutions,NA,Front End Web Developer,Bhāvnagar,"The ideal candidate will be responsible for designing, developing, testing, and debugging responsive web and mobile applications for the company. Using JavaScript, HTML, and CSS, this candidate will be able to translate user and business needs into functional frontend design.** Responsibilities **Designing, developing, and testing UI for mobile and web applicationsBuild reusable code and libraries for future useAccurately translate user and business needs into functional frontend code** Qualifications **Bachelor's degree or equivalent in Computer ScienceGood Knowledge of JavaScript, HTML5, and CSS3++Minimum Experience : 1 Year++Job Types: Full-time, Regular / PermanentSalary: ₹100,000.00 - ₹400,000.00 per yearBenefits:Food allowanceLeave encashmentSchedule:Day shiftFixed shiftSupplemental Pay:Performance bonusYearly bonusCOVID-19 considerations:All Customers are required to wear a Mask. Hand Sanitization Facility is Available.Ability to commute/relocate:Atabhai Chowk, Bhavnagar - 364001, Gujarat: Reliably commute or planning to relocate before starting work (Preferred)Education:Bachelor's (Required)Experience:CSS: 1 year (Preferred)HTML: 1 year (Preferred)JavaScript: 1 year (Preferred)Total Work: 1 year (Preferred)Application Deadline: 31/07/2022 The ideal candidate will be responsible for designing, developing, testing, and debugging responsive web and mobile applications for the company. Using JavaScript, HTML, and CSS, this candidate will be able to translate user and business needs into functional frontend design.** Responsibilities **Designing, developing, and testing UI for mobile and web applicationsBuild reusable code and libraries for future useAccurately translate user and business needs into functional frontend code** Qualifications **Bachelor's degree or equivalent in Computer ScienceGood Knowledge of JavaScript, HTML5, and CSS3++Minimum Experience : 1 Year++Job Types: Full-time, Regular / PermanentSalary: ₹100,000.00 - ₹400,000.00 per yearBenefits:Food allowanceLeave encashmentSchedule:Day shiftFixed shiftSupplemental Pay:Performance bonusYearly bonusCOVID-19 considerations:All Customers are required to wear a Mask. Hand Sanitization Facility is Available.Ability to commute/relocate:Atabhai Chowk, Bhavnagar - 364001, Gujarat: Reliably commute or planning to relocate before starting work (Preferred)Education:Bachelor's (Required)Experience:CSS: 1 year (Preferred)HTML: 1 year (Preferred)JavaScript: 1 year (Preferred)Total Work: 1 year (Preferred)Application Deadline: 31/07/2022 Show more ","Employer Est.:₹100,000 - ₹400,000 ",https://www.glassdoor.co.in/partner/jobListing.htm?pos=409&ao=1136043&s=58&guid=00000182acec58ecaf323979c7ff222b&src=GD_JOB_AD&t=SR&vt=w&ea=1&cs=1_cb782d90&cb=1660758547342&jobListingId=1008009348030&jrtk=3-0-1gameomfk2gpq001-1gameomg9haqh800-622cf077fc831cdf-,NA,NA
Usha-System,NA,Angular/ Javascript/ - Web Developer - Immediate Hiring,Coimbatore,"RequirementsBachelor’s or Post graduate degree in computer science, computer engineering or similar.At least one year of work experience as an angular / Javascript developer.Proficiency in HTML, javascript, bootstrap and CSSDesign, build, and maintain efficient, reusable, and reliable codePerksHigh growth startup environmentCan Hands on experience on AWS Hosting and related componentsWork from Home OptionsJob Types: Full-time, Regular / PermanentSalary: ₹25,000.00 - ₹45,000.00 per monthBenefits:Flexible schedulePaid sick timeWork from homeSchedule:Morning shiftSupplemental Pay:Performance bonusQuarterly bonusYearly bonusExperience:Angular / Javascript Development: 1 year (Required) RequirementsBachelor’s or Post graduate degree in computer science, computer engineering or similar.At least one year of work experience as an angular / Javascript developer.Proficiency in HTML, javascript, bootstrap and CSSDesign, build, and maintain efficient, reusable, and reliable codePerksHigh growth startup environmentCan Hands on experience on AWS Hosting and related componentsWork from Home OptionsJob Types: Full-time, Regular / PermanentSalary: ₹25,000.00 - ₹45,000.00 per monthBenefits:Flexible schedulePaid sick timeWork from homeSchedule:Morning shiftSupplemental Pay:Performance bonusQuarterly bonusYearly bonusExperience:Angular / Javascript Development: 1 year (Required) Show more ","Employer Est.:₹300,000 - ₹540,000 ",https://www.glassdoor.co.in/partner/jobListing.htm?pos=405&ao=1136043&s=58&guid=00000182acec58ecaf323979c7ff222b&src=GD_JOB_AD&t=SR&vt=w&ea=1&cs=1_e6b3f3aa&cb=1660758547341&jobListingId=1008071367273&jrtk=3-0-1gameomfk2gpq001-1gameomg9haqh800-7d4919a2e3b27004-,"Vijayapuram, India",Unknown
PADAIE,NA,Web Developer,Gurgaon,"Good knowledge of wordpress and Seo.Work with graphics and other designers.Maintain and update websites.Stay up-to-date on technology.Identifying problems uncovered by customer feedback and testing, and correcting or referring problems to appropriate personnel for correction.Determining user needs by analyzing technical requirements.Job Types: Full-time, Regular / PermanentSalary: From ₹8,000.00 per monthSchedule:Day shiftMorning shiftAbility to commute/relocate:Sector 56, Gurgaon, Haryana: Reliably commute or planning to relocate before starting work (Required)Education:Bachelor's (Preferred)Experience:CSS: 1 year (Preferred)total work: 1 year (Preferred)HTML5: 1 year (Preferred)Speak with the employer+91 7042941369Application Deadline: 19/08/2022Expected Start Date: 18/08/2022 Good knowledge of wordpress and Seo.Work with graphics and other designers.Maintain and update websites.Stay up-to-date on technology.Identifying problems uncovered by customer feedback and testing, and correcting or referring problems to appropriate personnel for correction.Determining user needs by analyzing technical requirements.Job Types: Full-time, Regular / PermanentSalary: From ₹8,000.00 per monthSchedule:Day shiftMorning shiftAbility to commute/relocate:Sector 56, Gurgaon, Haryana: Reliably commute or planning to relocate before starting work (Required)Education:Bachelor's (Preferred)Experience:CSS: 1 year (Preferred)total work: 1 year (Preferred)HTML5: 1 year (Preferred)Speak with the employer+91 7042941369Application Deadline: 19/08/2022Expected Start Date: 18/08/2022 Show more ","Employer Est.:₹96,000 ",https://www.glassdoor.co.in/partner/jobListing.htm?pos=422&ao=1136043&s=58&guid=00000182acec58ecaf323979c7ff222b&src=GD_JOB_AD&t=SR&vt=w&ea=1&cs=1_9f01fb97&cb=1660758547345&jobListingId=1008073035490&jrtk=3-0-1gameomfk2gpq001-1gameomg9haqh800-8467bff16c59c9cd-,NA,NA
WEBJYOR INFOTECH Pvt Ltd,NA,Web Developer,Thiruvananthapuram,"We are looking for passionate Web Developers to develop websites for our domestic and international clients.Candidates should be familiar with all major aspects of WordPress development - both front-end and back-end development.Proven work experience in WordPress/WooCommerce website developmentKnowledge of front-end technologies including CSS3, JavaScript, HTML5, and jQuery.Knowledge of code versioning tools including Git, Mercurial, and SVN.Experience working with debugging tools such as Chrome Inspector and Firebug.2+ years experience preferredJob Types: Full-time, Regular / PermanentSalary: ₹10,000.00 - ₹30,000.00 per monthSchedule:Day shiftSupplemental Pay:Performance bonusEducation:Bachelor's (Preferred)Experience:total work: 2 years (Preferred)CSS/CSS3: 2 years (Preferred)HTML5: 2 years (Preferred)PHP: 2 years (Preferred)WordPress: 2 years (Preferred)Speak with the employer+91 9446136047 We are looking for passionate Web Developers to develop websites for our domestic and international clients.Candidates should be familiar with all major aspects of WordPress development - both front-end and back-end development.Proven work experience in WordPress/WooCommerce website developmentKnowledge of front-end technologies including CSS3, JavaScript, HTML5, and jQuery.Knowledge of code versioning tools including Git, Mercurial, and SVN.Experience working with debugging tools such as Chrome Inspector and Firebug.2+ years experience preferredJob Types: Full-time, Regular / PermanentSalary: ₹10,000.00 - ₹30,000.00 per monthSchedule:Day shiftSupplemental Pay:Performance bonusEducation:Bachelor's (Preferred)Experience:total work: 2 years (Preferred)CSS/CSS3: 2 years (Preferred)HTML5: 2 years (Preferred)PHP: 2 years (Preferred)WordPress: 2 years (Preferred)Speak with the employer+91 9446136047 Show more ","Employer Est.:₹120,000 - ₹360,000 ",https://www.glassdoor.co.in/partner/jobListing.htm?pos=411&ao=1136043&s=58&guid=00000182acec58ecaf323979c7ff222b&src=GD_JOB_AD&t=SR&vt=w&ea=1&cs=1_129967c6&cb=1660758547342&jobListingId=1008013773159&jrtk=3-0-1gameomfk2gpq001-1gameomg9haqh800-245c2601163c77df-,"Kollam, India",Unknown
IGLOBAL IMPACT ITES PVT LTD,NA,HTML Web Designers,Durgapur,"IGLOBAL IMPACT ITES PVT LTD (IGI) one of the leading IT & BPO company of Durgapur is hiring for HTML Web Designers.( Telephonic interview will be conducted for outstation candidates)Responsibilities and Duties: Can work on live projects of international clients.Can handle multiple projectsError-free coding.Requirements: Minimum 1 Year Experience in HTML Designing.Knowledge in HTML5Knowledge in CSS3Knowledge in BootstrapKnowledge in JavascriptKnowledge in JqueryKnowledge in Angular JSJob Type: Full-timeSalary: ₹10,000.00 - ₹30,000.00 per monthSchedule:Day shiftCOVID-19 considerations:MASKS, SANITIZATION, SOCIAL DISTANCINGAbility to commute/relocate:Durgapur, Durgapur - 713208, West Bengal: Reliably commute or planning to relocate before starting work (Required)Experience:HTML5: 1 year (Required)web design: 1 year (Required)Bootstrap: 1 year (Required)WordPress: 1 year (Preferred)Speak with the employer+91 9832504040 IGLOBAL IMPACT ITES PVT LTD (IGI) one of the leading IT & BPO company of Durgapur is hiring for HTML Web Designers.( Telephonic interview will be conducted for outstation candidates)Responsibilities and Duties: Can work on live projects of international clients.Can handle multiple projectsError-free coding.Requirements: Minimum 1 Year Experience in HTML Designing.Knowledge in HTML5Knowledge in CSS3Knowledge in BootstrapKnowledge in JavascriptKnowledge in JqueryKnowledge in Angular JSJob Type: Full-timeSalary: ₹10,000.00 - ₹30,000.00 per monthSchedule:Day shiftCOVID-19 considerations:MASKS, SANITIZATION, SOCIAL DISTANCINGAbility to commute/relocate:Durgapur, Durgapur - 713208, West Bengal: Reliably commute or planning to relocate before starting work (Required)Experience:HTML5: 1 year (Required)web design: 1 year (Required)Bootstrap: 1 year (Required)WordPress: 1 year (Preferred)Speak with the employer+91 9832504040 Show more ","Employer Est.:₹120,000 - ₹360,000 ",https://www.glassdoor.co.in/partner/jobListing.htm?pos=507&ao=1136043&s=58&guid=00000182acef91988348e7f086c91dfe&src=GD_JOB_AD&t=SR&vt=w&ea=1&cs=1_a96f417a&cb=1660758758264&jobListingId=1008055558861&jrtk=3-0-1gamev4fcihn3801-1gamev4fuihkj800-34195038f9a85995-,NA,NA
Noesis Publishing Services Private Limited,NA,Web Developer,Coimbatore,"Web developer,Should be proficient in Word press, Woocommerce, and associated plugins.They need to have a good sense of social media and driving traffic to a website.Job Type: Full-timeSalary: ₹15,000.00 - ₹33,599.75 per monthSchedule:Day shiftExperience:Web development: 2 years (Preferred)Expected Start Date: 13/08/2022 Web developer,Should be proficient in Word press, Woocommerce, and associated plugins.They need to have a good sense of social media and driving traffic to a website.Job Type: Full-timeSalary: ₹15,000.00 - ₹33,599.75 per monthSchedule:Day shiftExperience:Web development: 2 years (Preferred)Expected Start Date: 13/08/2022 Show more ","Employer Est.:₹180,000 - ₹403,197 ",https://www.glassdoor.co.in/partner/jobListing.htm?pos=530&ao=1136043&s=58&guid=00000182acef91988348e7f086c91dfe&src=GD_JOB_AD&t=SR&vt=w&ea=1&cs=1_1f63b80d&cb=1660758758267&jobListingId=1008066112685&jrtk=3-0-1gamev4fcihn3801-1gamev4fuihkj800-d21de2e0667d696b-,NA,NA
3AI,NA,Senior Web Developer,Remote,"Calling inquisitive and diligent candidates with 2-4 years of experience for Senior Web Application Developer role at 3AI – India’s largest platform for AI & Analytics leaders, professionals & aspirants. Responsibilities would be on the Web based platform & applications involving multiple functions including membership management, learning portal, digital library, events management, mentorship program and more.Job description: Web based platform/application development and enhancements as per requirementsCreate detailed specificationsDesign and develop clean and quality componentsPerform integrations with internal and external applicationsTest, troubleshoot and maintain the platform to ensure uninterrupted availabilityIdentify performance and optimization requirements and addressManage the hosting environmentPlatform/Application usage/performance analytics & reportingEnsure regular Backup & Restore managementPerform regular updates as required by marketing and core teamContribute in all phases of the development lifecycleFollow industry best practicesSkills required:Proven software development experience in PHPExperience in Wordpress, Joomla, Drupal etcDemonstrable knowledge of web technologies including HTML, CSS, Javascript, AJAX etcGood knowledge of databases, version control tools and of developing web servicesExperience in common third-party APIs (Google, Facebook, Linkedin etc)Passion for best coding practices and a desire to develop new bold ideasJob Type: Full-timeSalary: ₹1,000,000.00 - ₹1,300,000.00 per yearBenefits:Work from homeSchedule:Flexible shiftSupplemental Pay:Performance bonusExperience:Web development: 4 years (Required)Expected Start Date: 10/08/2022 Calling inquisitive and diligent candidates with 2-4 years of experience for Senior Web Application Developer role at 3AI – India’s largest platform for AI & Analytics leaders, professionals & aspirants. Responsibilities would be on the Web based platform & applications involving multiple functions including membership management, learning portal, digital library, events management, mentorship program and more.Job description: Web based platform/application development and enhancements as per requirementsCreate detailed specificationsDesign and develop clean and quality componentsPerform integrations with internal and external applicationsTest, troubleshoot and maintain the platform to ensure uninterrupted availabilityIdentify performance and optimization requirements and addressManage the hosting environmentPlatform/Application usage/performance analytics & reportingEnsure regular Backup & Restore managementPerform regular updates as required by marketing and core teamContribute in all phases of the development lifecycleFollow industry best practicesSkills required:Proven software development experience in PHPExperience in Wordpress, Joomla, Drupal etcDemonstrable knowledge of web technologies including HTML, CSS, Javascript, AJAX etcGood knowledge of databases, version control tools and of developing web servicesExperience in common third-party APIs (Google, Facebook, Linkedin etc)Passion for best coding practices and a desire to develop new bold ideasJob Type: Full-timeSalary: ₹1,000,000.00 - ₹1,300,000.00 per yearBenefits:Work from homeSchedule:Flexible shiftSupplemental Pay:Performance bonusExperience:Web development: 4 years (Required)Expected Start Date: 10/08/2022 Show more ","Employer Est.:₹1,000,000 - ₹1,300,000 ",https://www.glassdoor.co.in/partner/jobListing.htm?pos=518&ao=1136043&s=58&guid=00000182acef91988348e7f086c91dfe&src=GD_JOB_AD&t=SR&vt=w&ea=1&cs=1_df7dca6e&cb=1660758758266&jobListingId=1008056367600&jrtk=3-0-1gamev4fcihn3801-1gamev4fuihkj800-955ee40f3364031c-,NA,NA
Webtree Media Solutions WLL,4.2,Looking for a Word press Developer,Bangalore,"We are looking to hire a skilled WordPress developer to design and implement attractive and functional websites for our clients.You will be responsible for both back-end and front-end development including the implementation of WordPress themes and plugins as well as site integration and security updates.Duties & ResponsibilitiesDesign, implement and manage websites using WordPressCollaborate with members of a creative teamManage front-end and back-end website developmentCreate WordPress plug-ins and themesMaintain well-documented, reusable, and transferrable codeTroubleshoot and resolve website problems for clients and co-workersStay abreast of new developments in software, trends, and practicesRequirementsProficiency using WordPressExpertise in HTML5, CSS3, JavaScript, and jQueryExperience using debugging tools such as Firebug and Chrome InspectorStrong understanding of front-end and back-end website developmentExperience with responsive and adaptive designBachelor’s degree or equivalent work experience with a preference for a computer science related field2+ years’ experience with WordPress related technologies – mostly as part of a development teamKnowledge of and/or experience in Laravel will be an added advantage.Keen attention to detailJob Type: Full-timeSalary: Up to ₹80,000.00 per monthSchedule:Day shiftExperience:total work: 3 years (Preferred)Wordpress development: 2 years (Preferred)Application Deadline: 30/08/2022 We are looking to hire a skilled WordPress developer to design and implement attractive and functional websites for our clients.You will be responsible for both back-end and front-end development including the implementation of WordPress themes and plugins as well as site integration and security updates.Duties & ResponsibilitiesDesign, implement and manage websites using WordPressCollaborate with members of a creative teamManage front-end and back-end website developmentCreate WordPress plug-ins and themesMaintain well-documented, reusable, and transferrable codeTroubleshoot and resolve website problems for clients and co-workersStay abreast of new developments in software, trends, and practicesRequirementsProficiency using WordPressExpertise in HTML5, CSS3, JavaScript, and jQueryExperience using debugging tools such as Firebug and Chrome InspectorStrong understanding of front-end and back-end website developmentExperience with responsive and adaptive designBachelor’s degree or equivalent work experience with a preference for a computer science related field2+ years’ experience with WordPress related technologies – mostly as part of a development teamKnowledge of and/or experience in Laravel will be an added advantage.Keen attention to detailJob Type: Full-timeSalary: Up to ₹80,000.00 per monthSchedule:Day shiftExperience:total work: 3 years (Preferred)Wordpress development: 2 years (Preferred)Application Deadline: 30/08/2022 Show more ","Employer Est.:₹960,000 ",https://www.glassdoor.co.in/partner/jobListing.htm?pos=516&ao=1136043&s=58&guid=00000182acef91988348e7f086c91dfe&src=GD_JOB_AD&t=SR&vt=w&ea=1&cs=1_c28ec6f5&cb=1660758758266&jobListingId=1008064909799&jrtk=3-0-1gamev4fcihn3801-1gamev4fuihkj800-6b67c7fa937f06ca-,"Manama, Bahrain",1 to 50 Employees
Incipientinfo,4.1,JavaScript Developer,New Delhi,"Job descriptionDear Candidates,Greetings from Incipient Infotech…!!!!We are hiring for JavaScript Developer, Come and join us.(who wants to move to Vue.js technology, also this is a WFO job)Experience required: 0 to 1 yearsResponsibility: Design a framework for creating user apps that grow with the needs of the companyMonitor website performance, watch for traffic drops related to site usability problems and rectify the issuesReview app and feature coding and plan future website upgrades with the development teamAssist in the development of applications and features that will be put on the website and in internal functions as wellBenefits of joining us: Best in industry salary5 days workingFlexible timingPF BenefitLeave EncashmentMonthly EventsCompany Profile: Incipient Info is one of Australia’s fastest growing companies Focusing On web design sydney, web development, Digital Marketing, and Mobile applications. At Incipient Info we believe in bringing client projects to life through our Offshore IT services by integrating them with next-generation web technology, guaranteeing superior functional efficiency.Company website : https://incipientinfo.com/Thanks,Yamini HRAddress - 612,612-A Lilamani Corporate Heights, Opp., Ramapir BRTS Bus stop, Nr. Ozone Aangan, New Vadaj, Ahmedabad - 380013.Job Type: Full-timeBenefits:Flexible scheduleLeave encashmentProvident FundSchedule:Flexible shiftAbility to commute/relocate:Delhi, Delhi: Reliably commute or planning to relocate before starting work (Required)Experience:total work: 1 year (Preferred)Speak with the employer+91 8849109267 Job descriptionDear Candidates,Greetings from Incipient Infotech…!!!!We are hiring for JavaScript Developer, Come and join us.(who wants to move to Vue.js technology, also this is a WFO job)Experience required: 0 to 1 yearsResponsibility: Design a framework for creating user apps that grow with the needs of the companyMonitor website performance, watch for traffic drops related to site usability problems and rectify the issuesReview app and feature coding and plan future website upgrades with the development teamAssist in the development of applications and features that will be put on the website and in internal functions as wellBenefits of joining us: Best in industry salary5 days workingFlexible timingPF BenefitLeave EncashmentMonthly EventsCompany Profile: Incipient Info is one of Australia’s fastest growing companies Focusing On web design sydney, web development, Digital Marketing, and Mobile applications. At Incipient Info we believe in bringing client projects to life through our Offshore IT services by integrating them with next-generation web technology, guaranteeing superior functional efficiency.Company website : https://incipientinfo.com/Thanks,Yamini HRAddress - 612,612-A Lilamani Corporate Heights, Opp., Ramapir BRTS Bus stop, Nr. Ozone Aangan, New Vadaj, Ahmedabad - 380013.Job Type: Full-timeBenefits:Flexible scheduleLeave encashmentProvident FundSchedule:Flexible shiftAbility to commute/relocate:Delhi, Delhi: Reliably commute or planning to relocate before starting work (Required)Experience:total work: 1 year (Preferred)Speak with the employer+91 8849109267 Show more ","₹163,005 - ₹231,127 (Glassdoor Est.)",https://www.glassdoor.co.in/partner/jobListing.htm?pos=505&ao=1136043&s=58&guid=00000182acef91988348e7f086c91dfe&src=GD_JOB_AD&t=SR&vt=w&ea=1&cs=1_95c956ee&cb=1660758758264&jobListingId=1008075539822&jrtk=3-0-1gamev4fcihn3801-1gamev4fuihkj800-fd5f0a4799116a09-,"Ahmedabad, India",1 to 50 Employees
SMVV Edutech Adviosry Pvt Ltd,NA,Web developer,Panaji,"ResponsibilitiesKnow HTML, C++,JavaScript, PHP, Python and other relevant web design coding languagesCreate and test applications for websitesPresent design specsWork with graphics and other designersTroubleshoot website problemsMaintain and update websitesMonitor website trafficStay up-to-date on technologyJob Type: Full-timeSalary: ₹25,000.00 - ₹30,000.00 per monthSchedule:Day shiftAbility to commute/relocate:Panaji, North Goa - 403001, Goa: Reliably commute or planning to relocate before starting work (Required)Education:Bachelor's (Preferred)Experience:CSS: 1 year (Preferred)total work: 1 year (Preferred)HTML5: 1 year (Preferred)Speak with the employer+91 8799929521 ResponsibilitiesKnow HTML, C++,JavaScript, PHP, Python and other relevant web design coding languagesCreate and test applications for websitesPresent design specsWork with graphics and other designersTroubleshoot website problemsMaintain and update websitesMonitor website trafficStay up-to-date on technologyJob Type: Full-timeSalary: ₹25,000.00 - ₹30,000.00 per monthSchedule:Day shiftAbility to commute/relocate:Panaji, North Goa - 403001, Goa: Reliably commute or planning to relocate before starting work (Required)Education:Bachelor's (Preferred)Experience:CSS: 1 year (Preferred)total work: 1 year (Preferred)HTML5: 1 year (Preferred)Speak with the employer+91 8799929521 Show more ","Employer Est.:₹300,000 - ₹360,000 ",https://www.glassdoor.co.in/partner/jobListing.htm?pos=510&ao=1136043&s=58&guid=00000182acef91988348e7f086c91dfe&src=GD_JOB_AD&t=SR&vt=w&ea=1&cs=1_40bf5947&cb=1660758758265&jobListingId=1008034413505&jrtk=3-0-1gamev4fcihn3801-1gamev4fuihkj800-052ace2f33376874-,NA,NA
