companyName,company_starRating,job_title,employee_residence,listing_jobDesc,salary,requested_url,company_location,company_size
IBSS,NA,Internship Training Web Design,Chennai,"1. Writing efficient code2. Creating websites/a website using standard HTML/CSS practices3. Working closely with web designers and programmers to produce the website4. Constant communication with other colleagues in the business to develop and deploy their content - and ensuring there is a clear establishment of what can be created within what timeframe5. Researching different software programs, maintaining software documentation6. Implementing contingency plans in case the website goes down7. Maintaining and expanding/enhancing the website once built8. Managing a teamJob Types: Full-time, Internship, Part-timeContract length: 2 monthsSalary: From ₹10,000.00 per monthBenefits:Internet reimbursementSchedule:Day shiftFlexible shiftMorning shiftSupplemental Pay:Performance bonusAbility to commute/relocate:Chennai, Tamil Nadu: Reliably commute or planning to relocate before starting work (Required)Education:Bachelor's (Preferred) 1. Writing efficient code2. Creating websites/a website using standard HTML/CSS practices3. Working closely with web designers and programmers to produce the website4. Constant communication with other colleagues in the business to develop and deploy their content - and ensuring there is a clear establishment of what can be created within what timeframe5. Researching different software programs, maintaining software documentation6. Implementing contingency plans in case the website goes down7. Maintaining and expanding/enhancing the website once built8. Managing a teamJob Types: Full-time, Internship, Part-timeContract length: 2 monthsSalary: From ₹10,000.00 per monthBenefits:Internet reimbursementSchedule:Day shiftFlexible shiftMorning shiftSupplemental Pay:Performance bonusAbility to commute/relocate:Chennai, Tamil Nadu: Reliably commute or planning to relocate before starting work (Required)Education:Bachelor's (Preferred) Show more ","Employer Est.:₹120,000 ",https://www.glassdoor.co.in/partner/jobListing.htm?pos=110&ao=1136043&s=58&guid=00000182ace2e810bcfb8e04775a125a&src=GD_JOB_AD&t=SR&vt=w&ea=1&cs=1_019830ec&cb=1660757928507&jobListingId=1008075705494&jrtk=3-0-1game5q6sk6cm801-1game5q7ig2oh800-8183362bf142dc29-,NA,NA
Aalan Infotech,NA,Web Developer,Salem,"Write well designed, testable, efficient code by using best software development practicesCreate website layout/user interface by using standard HTML/CSS practicesIntegrate data from various back-end services and databasesGather and refine specifications and requirements based on technical needsCreate and maintain software documentationBe responsible for maintaining, expanding, and scaling our siteStay plugged into emerging technologies/industry trends and apply them into operations and activitiesCooperate with web designers to match visual design intentJob Types: Full-time, FresherSalary: ₹10,000.00 - ₹30,000.00 per monthSchedule:Day shiftSupplemental Pay:Performance bonusYearly bonusAbility to commute/relocate:Salem, Tamil Nadu: Reliably commute or planning to relocate before starting work (Required)Education:Bachelor's (Preferred)Application Deadline: 27/08/2022Expected Start Date: 17/08/2022 Write well designed, testable, efficient code by using best software development practicesCreate website layout/user interface by using standard HTML/CSS practicesIntegrate data from various back-end services and databasesGather and refine specifications and requirements based on technical needsCreate and maintain software documentationBe responsible for maintaining, expanding, and scaling our siteStay plugged into emerging technologies/industry trends and apply them into operations and activitiesCooperate with web designers to match visual design intentJob Types: Full-time, FresherSalary: ₹10,000.00 - ₹30,000.00 per monthSchedule:Day shiftSupplemental Pay:Performance bonusYearly bonusAbility to commute/relocate:Salem, Tamil Nadu: Reliably commute or planning to relocate before starting work (Required)Education:Bachelor's (Preferred)Application Deadline: 27/08/2022Expected Start Date: 17/08/2022 Show more ","Employer Est.:₹120,000 - ₹360,000 ",https://www.glassdoor.co.in/partner/jobListing.htm?pos=123&ao=1136043&s=58&guid=00000182ace2e810bcfb8e04775a125a&src=GD_JOB_AD&t=SR&vt=w&ea=1&cs=1_bbd31a3c&cb=1660757928512&jobListingId=1008071316901&jrtk=3-0-1game5q6sk6cm801-1game5q7ig2oh800-f0c2effcc4f4671e-,NA,NA
All Peoples Church and World outreach - Bangalore,NA,Web Developer,India,"WEB DEVELOPERBeing conversant with technologies associated with HTML5, CSS Frameworks, JS frameworks, Git etc., and be able to develop UI for modules / pages / blocks, based on this technology as required. Being able to carry out routine data updates and maintenance of related portals and operations and integrations as required.RESPONSIBILITIESDevelopment of responsive custom UI for applications / modules / pages based on various platforms.  * Upkeep of all websites and portals of APCWO, employing these technologies.  * Technical support to Staff / Users pertaining to these technologies.QUALIFICATIONS/EXPERIENCE REQUIREMENTSCompleted degree in any field of computer science or Certifications in JS / CSS / jQuery / Bootstrap etc.  * Experience with Git.  * Experience with Remote Computing (RDP/SSH/FTP) clients.REQUIRED SKILLSBe able to install Operating system, Set up Development Environment.  * Be able to adopt or upgrade to advanced technologies.  * Passion to learn and upgrade skills continually.  * Additional knowledge of other programming languages / scripting languages desirable.  * Work under pressure and meet deadlines.ADDITIONAL RESPONSIBILITIESAt APC we are continuously growing and expanding. Hence additional responsibilities will be added as we progress.  * Be prepared to work long hours if required.OPPORTUNITIESDepending on your skills, calling and interest, you will have the opportunity to:  * Travel and serve on APC Missions  * Volunteer at APCJob Types: Full-time, Regular / PermanentSalary: ₹40,000.00 - ₹45,000.00 per monthBenefits:Health insuranceProvident FundSchedule:Day shiftMonday to FridaySupplemental Pay:Performance bonusYearly bonusCOVID-19 considerations:As an organization, we are much concerned about our staff and we take all the necessary precautions and safety measures to keep our staff and workplace safe. Our office is disinfected promptly to ensure the place is safe to work in person.Education:Bachelor's (Required)Experience:JS / CSS / jQuery /Bootstrap/Git: 1 year (Preferred)total work: 4 years (Required)HTML5, CSS Frameworks, JS frameworks, Git: 1 year (Required) WEB DEVELOPERBeing conversant with technologies associated with HTML5, CSS Frameworks, JS frameworks, Git etc., and be able to develop UI for modules / pages / blocks, based on this technology as required. Being able to carry out routine data updates and maintenance of related portals and operations and integrations as required.RESPONSIBILITIESDevelopment of responsive custom UI for applications / modules / pages based on various platforms.  * Upkeep of all websites and portals of APCWO, employing these technologies.  * Technical support to Staff / Users pertaining to these technologies.QUALIFICATIONS/EXPERIENCE REQUIREMENTSCompleted degree in any field of computer science or Certifications in JS / CSS / jQuery / Bootstrap etc.  * Experience with Git.  * Experience with Remote Computing (RDP/SSH/FTP) clients.REQUIRED SKILLSBe able to install Operating system, Set up Development Environment.  * Be able to adopt or upgrade to advanced technologies.  * Passion to learn and upgrade skills continually.  * Additional knowledge of other programming languages / scripting languages desirable.  * Work under pressure and meet deadlines.ADDITIONAL RESPONSIBILITIESAt APC we are continuously growing and expanding. Hence additional responsibilities will be added as we progress.  * Be prepared to work long hours if required.OPPORTUNITIESDepending on your skills, calling and interest, you will have the opportunity to:  * Travel and serve on APC Missions  * Volunteer at APCJob Types: Full-time, Regular / PermanentSalary: ₹40,000.00 - ₹45,000.00 per monthBenefits:Health insuranceProvident FundSchedule:Day shiftMonday to FridaySupplemental Pay:Performance bonusYearly bonusCOVID-19 considerations:As an organization, we are much concerned about our staff and we take all the necessary precautions and safety measures to keep our staff and workplace safe. Our office is disinfected promptly to ensure the place is safe to work in person.Education:Bachelor's (Required)Experience:JS / CSS / jQuery /Bootstrap/Git: 1 year (Preferred)total work: 4 years (Required)HTML5, CSS Frameworks, JS frameworks, Git: 1 year (Required) Show more ","Employer Est.:₹480,000 - ₹540,000 ",https://www.glassdoor.co.in/partner/jobListing.htm?pos=104&ao=1136043&s=58&guid=00000182ace2e810bcfb8e04775a125a&src=GD_JOB_AD&t=SR&vt=w&ea=1&cs=1_1eb3f080&cb=1660757928506&jobListingId=1008076166621&jrtk=3-0-1game5q6sk6cm801-1game5q7ig2oh800-8291bd024a25f875-,NA,NA
Stemkit Education,NA,Front End Developer / Web Developer Bangalore Immediate Requirement,Bangalore,"Hiring experienced Front End Engineers and Web Developers on urgent basis.To apply please1. Send in your resume2. Your portfolio / github link3. List the technologies you have experience in.To apply, your resume should list the technologies you have proven expertise in along with the tenure of experience in each technology.Candidates are required to work from office. Candidates should not be in the employ of another company while working with us.Job Type: Full-timeSalary: ₹368,563.02 - ₹1,545,400.60 per yearSchedule:Day shiftAbility to commute/relocate:Bengaluru, Bengaluru Rural - 560087, Karnataka: Reliably commute or planning to relocate before starting work (Required)Education:Bachelor's (Preferred)Experience:total work: 1 year (Preferred) Hiring experienced Front End Engineers and Web Developers on urgent basis.To apply please1. Send in your resume2. Your portfolio / github link3. List the technologies you have experience in.To apply, your resume should list the technologies you have proven expertise in along with the tenure of experience in each technology.Candidates are required to work from office. Candidates should not be in the employ of another company while working with us.Job Type: Full-timeSalary: ₹368,563.02 - ₹1,545,400.60 per yearSchedule:Day shiftAbility to commute/relocate:Bengaluru, Bengaluru Rural - 560087, Karnataka: Reliably commute or planning to relocate before starting work (Required)Education:Bachelor's (Preferred)Experience:total work: 1 year (Preferred) Show more ","Employer Est.:₹368,563 - ₹1,545,401 ",https://www.glassdoor.co.in/partner/jobListing.htm?pos=101&ao=1136043&s=58&guid=00000182ace2e810bcfb8e04775a125a&src=GD_JOB_AD&t=SR&vt=w&ea=1&cs=1_7f7c9f6d&cb=1660757928506&jobListingId=1008019511944&jrtk=3-0-1game5q6sk6cm801-1game5q7ig2oh800-1113172e73132579-,NA,NA
PraxivLabs,NA,Web (frontend) Developer Opening,New Delhi,"Hi,Hope you are doing great!!We are looking for Web Developer with core php skills who's have experience on frontend, who is a tech geek and has hands on experience in building scalable, distributed and large web/mobile products. He/she must be an excellent problem solver with passion to self-learn and implement web technologies using Frontend & Backend. He/she would be responsible for the architecture design, code, build and deploy web/mobile applications.Web (Frontend) DeveloperRelevant Experience: 3-7YearsJob Location: New DelhiSkills Required- Web Applications development using MVC Framework, Wordpress and bootstrap is must.- Git hub expert- Deep Expertise and hands on experience with Web Applications and programming languages like Core PHP, HTML5, CSS3, JavaScript, JQuery, AJAX, etc.- Deep Expertise and hands on experience with Web Services and APIs – REST, SOAP, etc.- Hands on Experience in Payment Gateway Integration e.g. PayPal, Stripe, etc.- Hands on Experience and knowledge on MYSQL, SQL, PL/SQL, etc.If you feel interested please share your updated profile with below mentioned required details: 1.. Total years of experience(if applicable)2. Relevant experience(if applicable)3. How soon will you be able to join?4. What’s the reason for job change(if applicable)5. Current Salary(if applicable)6. Expected Salary(if applicable)7. Availability for Interview.8. Current LocationPlease acknowledge the mail and revert it back with your confirmation and your updated resume.Best RegardsHR TeamJob Types: Full-time, Regular / PermanentSalary: ₹30,000.00 - ₹60,000.00 per monthSchedule:Day shiftEducation:Bachelor's (Preferred)Experience:wordpress: 1 year (Preferred)total work: 1 year (Preferred)Bootstrap: 1 year (Preferred)License/Certification:frontend (Preferred) Hi,Hope you are doing great!!We are looking for Web Developer with core php skills who's have experience on frontend, who is a tech geek and has hands on experience in building scalable, distributed and large web/mobile products. He/she must be an excellent problem solver with passion to self-learn and implement web technologies using Frontend & Backend. He/she would be responsible for the architecture design, code, build and deploy web/mobile applications.Web (Frontend) DeveloperRelevant Experience: 3-7YearsJob Location: New DelhiSkills Required- Web Applications development using MVC Framework, Wordpress and bootstrap is must.- Git hub expert- Deep Expertise and hands on experience with Web Applications and programming languages like Core PHP, HTML5, CSS3, JavaScript, JQuery, AJAX, etc.- Deep Expertise and hands on experience with Web Services and APIs – REST, SOAP, etc.- Hands on Experience in Payment Gateway Integration e.g. PayPal, Stripe, etc.- Hands on Experience and knowledge on MYSQL, SQL, PL/SQL, etc.If you feel interested please share your updated profile with below mentioned required details: 1.. Total years of experience(if applicable)2. Relevant experience(if applicable)3. How soon will you be able to join?4. What’s the reason for job change(if applicable)5. Current Salary(if applicable)6. Expected Salary(if applicable)7. Availability for Interview.8. Current LocationPlease acknowledge the mail and revert it back with your confirmation and your updated resume.Best RegardsHR TeamJob Types: Full-time, Regular / PermanentSalary: ₹30,000.00 - ₹60,000.00 per monthSchedule:Day shiftEducation:Bachelor's (Preferred)Experience:wordpress: 1 year (Preferred)total work: 1 year (Preferred)Bootstrap: 1 year (Preferred)License/Certification:frontend (Preferred) Show more ","Employer Est.:₹360,000 - ₹720,000 ",https://www.glassdoor.co.in/partner/jobListing.htm?pos=116&ao=1136043&s=58&guid=00000182ace2e810bcfb8e04775a125a&src=GD_JOB_AD&t=SR&vt=w&ea=1&cs=1_bd5d2bf8&cb=1660757928508&jobListingId=1008034721098&jrtk=3-0-1game5q6sk6cm801-1game5q7ig2oh800-dcd173d449053faf-,NA,NA
DESIGNSHORE TECHNOLOGIES PVT LTD,NA,Web Developer,Bangalore,"We are looking for enthusiastic candidates with good command in English for outbound process(Australia and New Zealand )Establish, develop, and maintain positive business and customer relationshipsUpsell and Upgrade products/services based on customer requirementsExpedite the resolution of customer problems and complaints to maximize satisfactionDatabase Web DeveloperMinimum of 2 years of experience using Javascript to manage, retrieve, and save to a relational database that has more than 200 tables.Working experience with CRM, document management, Resource Management, and HRM.REQUIREMENTSPossess good communication skills, both oral and writtenHave a good attitude - should be committed to the work.Any graduates can apply or 10+2, 10+3.Should be able to commute on own (Work Timing 5:00 AM - 1:00 PM)Job Types: Full-time, Regular / PermanentSalary: ₹15,000.00 - ₹20,000.00 per monthSchedule:Morning shiftEducation:Bachelor's (Preferred)Experience:CSS: 1 year (Preferred)total work: 1 year (Preferred)HTML5: 1 year (Preferred)Speak with the employer+91 7899276203 We are looking for enthusiastic candidates with good command in English for outbound process(Australia and New Zealand )Establish, develop, and maintain positive business and customer relationshipsUpsell and Upgrade products/services based on customer requirementsExpedite the resolution of customer problems and complaints to maximize satisfactionDatabase Web DeveloperMinimum of 2 years of experience using Javascript to manage, retrieve, and save to a relational database that has more than 200 tables.Working experience with CRM, document management, Resource Management, and HRM.REQUIREMENTSPossess good communication skills, both oral and writtenHave a good attitude - should be committed to the work.Any graduates can apply or 10+2, 10+3.Should be able to commute on own (Work Timing 5:00 AM - 1:00 PM)Job Types: Full-time, Regular / PermanentSalary: ₹15,000.00 - ₹20,000.00 per monthSchedule:Morning shiftEducation:Bachelor's (Preferred)Experience:CSS: 1 year (Preferred)total work: 1 year (Preferred)HTML5: 1 year (Preferred)Speak with the employer+91 7899276203 Show more ","Employer Est.:₹180,000 - ₹240,000 ",https://www.glassdoor.co.in/partner/jobListing.htm?pos=120&ao=1136043&s=58&guid=00000182ace2e810bcfb8e04775a125a&src=GD_JOB_AD&t=SR&vt=w&ea=1&cs=1_038e0517&cb=1660757928510&jobListingId=1007971961392&jrtk=3-0-1game5q6sk6cm801-1game5q7ig2oh800-7509d7429fcfdb31-,NA,NA
Spider India,NA,HTML Developer,India,"Web Designer / HTML Developer experienced in building interfaces to rich web applications. We are looking for an individual skilled in highly dynamic web interface development (HTML5 , CSS3 / SCSS , Bootstrap , jQuery)Required Candidate profileMinimum 1-3 years of experience in HTML Developer roleKnowledge of HTML 4 & 5, JavaScript, CSS3 & HTML.Ability to write custom JS code and handle cross browser issues.Familiar with responsive designCreation of mobile web interfaces using HTML5 / CSS3Job Type: Full-timeSalary: ₹15,000.00 - ₹25,000.00 per monthSchedule:Day shiftEducation:Bachelor's (Preferred)Experience:CSS: 1 year (Preferred)total work: 1 year (Preferred)HTML5: 1 year (Preferred) Web Designer / HTML Developer experienced in building interfaces to rich web applications. We are looking for an individual skilled in highly dynamic web interface development (HTML5 , CSS3 / SCSS , Bootstrap , jQuery)Required Candidate profileMinimum 1-3 years of experience in HTML Developer roleKnowledge of HTML 4 & 5, JavaScript, CSS3 & HTML.Ability to write custom JS code and handle cross browser issues.Familiar with responsive designCreation of mobile web interfaces using HTML5 / CSS3Job Type: Full-timeSalary: ₹15,000.00 - ₹25,000.00 per monthSchedule:Day shiftEducation:Bachelor's (Preferred)Experience:CSS: 1 year (Preferred)total work: 1 year (Preferred)HTML5: 1 year (Preferred) Show more ","Employer Est.:₹180,000 - ₹300,000 ",https://www.glassdoor.co.in/partner/jobListing.htm?pos=112&ao=1136043&s=58&guid=00000182ace2e810bcfb8e04775a125a&src=GD_JOB_AD&t=SR&vt=w&ea=1&cs=1_c7c5aade&cb=1660757928508&jobListingId=1008052906445&jrtk=3-0-1game5q6sk6cm801-1game5q7ig2oh800-6403f7853684d7e7-,NA,NA
SIYANA,NA,Web Developer,Ahmedabad,"We are looking for young and enthusiastic web developers passed out after 2021 (B.E./B.Tech/MCA/Msc IT) for the position Software Developer.We are looking for experienced as well as freshers.Here we train you and shift you on live projects on Angular, Reactjs, Nodejs, Asp.Net MVC, Asp.net Core etc.Possess good analytical and communication skills.Should be a team player.Should have good knowledge in Coding basics & OOPS.Must know to perform CRUD in any language of his/her preferenceJob Type: Full-timeSalary: ₹20,000.00 - ₹60,000.00 per monthBenefits:Flexible scheduleInternet reimbursementSchedule:Day shiftMorning shiftSupplemental Pay:Overtime payAbility to commute/relocate:Ahmedabad, Gujarat: Reliably commute or planning to relocate before starting work (Required)Education:Bachelor's (Preferred)Experience:CSS: 1 year (Preferred)total work: 1 year (Preferred)HTML5: 1 year (Preferred) We are looking for young and enthusiastic web developers passed out after 2021 (B.E./B.Tech/MCA/Msc IT) for the position Software Developer.We are looking for experienced as well as freshers.Here we train you and shift you on live projects on Angular, Reactjs, Nodejs, Asp.Net MVC, Asp.net Core etc.Possess good analytical and communication skills.Should be a team player.Should have good knowledge in Coding basics & OOPS.Must know to perform CRUD in any language of his/her preferenceJob Type: Full-timeSalary: ₹20,000.00 - ₹60,000.00 per monthBenefits:Flexible scheduleInternet reimbursementSchedule:Day shiftMorning shiftSupplemental Pay:Overtime payAbility to commute/relocate:Ahmedabad, Gujarat: Reliably commute or planning to relocate before starting work (Required)Education:Bachelor's (Preferred)Experience:CSS: 1 year (Preferred)total work: 1 year (Preferred)HTML5: 1 year (Preferred) Show more ","Employer Est.:₹240,000 - ₹720,000 ",https://www.glassdoor.co.in/partner/jobListing.htm?pos=121&ao=1136043&s=58&guid=00000182ace2e810bcfb8e04775a125a&src=GD_JOB_AD&t=SR&vt=w&ea=1&cs=1_78c82e60&cb=1660757928511&jobListingId=1008075242452&jrtk=3-0-1game5q6sk6cm801-1game5q7ig2oh800-a1db18a885bec37f-,NA,NA
Skillslash,NA,Web Developer,Bangalore,"SkillslashResponsibilities and DutiesMust have knowledge about HTML, CSS, Jquery, JavaScript, Bootstrap, PHP.Integration of content into WordPress websites.Customization of word press sites using custom or pre-made themes.Collaborate with the web development team to fix website issuesCollaborate with other programmers to implement features.Continuously learn and improve skills.Create, edit and update documents, spreadsheets, and databases.Excellent written and verbal communication skills.Formatting reports and documentsImmediate Joining WFOJob Types: Full-time, Regular / PermanentSalary: ₹20,000.00 - ₹23,000.00 per monthBenefits:Health insuranceSchedule:Morning shiftAbility to commute/relocate:HSR Layout Sector 7, Bangalore, Karnataka: Reliably commute or planning to relocate before starting work (Required)Education:Bachelor's (Preferred)Experience:CSS: 1 year (Preferred)total work: 1 year (Preferred) SkillslashResponsibilities and DutiesMust have knowledge about HTML, CSS, Jquery, JavaScript, Bootstrap, PHP.Integration of content into WordPress websites.Customization of word press sites using custom or pre-made themes.Collaborate with the web development team to fix website issuesCollaborate with other programmers to implement features.Continuously learn and improve skills.Create, edit and update documents, spreadsheets, and databases.Excellent written and verbal communication skills.Formatting reports and documentsImmediate Joining WFOJob Types: Full-time, Regular / PermanentSalary: ₹20,000.00 - ₹23,000.00 per monthBenefits:Health insuranceSchedule:Morning shiftAbility to commute/relocate:HSR Layout Sector 7, Bangalore, Karnataka: Reliably commute or planning to relocate before starting work (Required)Education:Bachelor's (Preferred)Experience:CSS: 1 year (Preferred)total work: 1 year (Preferred) Show more ","Employer Est.:₹240,000 - ₹276,000 ",https://www.glassdoor.co.in/partner/jobListing.htm?pos=117&ao=1136043&s=58&guid=00000182ace2e810bcfb8e04775a125a&src=GD_JOB_AD&t=SR&vt=w&ea=1&cs=1_0d72b18c&cb=1660757928508&jobListingId=1008067911664&jrtk=3-0-1game5q6sk6cm801-1game5q7ig2oh800-53c4f7c601d42504-,NA,NA
Nucros Science & Taste,NA,Web Developer,New Delhi,"Work on website and add basic metatags and data.Job Types: Full-time, Part-timeSalary: ₹15,000.00 - ₹25,000.00 per monthSchedule:Flexible shiftMorning shiftAbility to commute/relocate:New Delhi, South - 110016, Delhi: Reliably commute or planning to relocate before starting work (Preferred)Education:Bachelor's (Preferred)Experience:CSS: 1 year (Preferred)total work: 1 year (Preferred)HTML5: 1 year (Preferred) Work on website and add basic metatags and data.Job Types: Full-time, Part-timeSalary: ₹15,000.00 - ₹25,000.00 per monthSchedule:Flexible shiftMorning shiftAbility to commute/relocate:New Delhi, South - 110016, Delhi: Reliably commute or planning to relocate before starting work (Preferred)Education:Bachelor's (Preferred)Experience:CSS: 1 year (Preferred)total work: 1 year (Preferred)HTML5: 1 year (Preferred) Show more ","Employer Est.:₹180,000 - ₹300,000 ",https://www.glassdoor.co.in/partner/jobListing.htm?pos=103&ao=1136043&s=58&guid=00000182ace2e810bcfb8e04775a125a&src=GD_JOB_AD&t=SR&vt=w&ea=1&cs=1_4f028a70&cb=1660757928506&jobListingId=1008073371001&jrtk=3-0-1game5q6sk6cm801-1game5q7ig2oh800-867021cd6766c8f0-,NA,NA
