companyName,company_starRating,job_title,employee_residence,listing_jobDesc,salary,requested_url,company_location,company_size
Phaico,NA,Web Developer,New Delhi,"1.Write, modify, and debug web applications using JavaScript, HTML5, and CSS3 & JQuery (must)2. Design, code, and manage automated test scripts, continuous builds, and deployment3. Develop new features, enhance existing features, and implement bug fixes in existing code4. Conceptualising creative ideas with clients5. Testing and improving the design of the website6. Establishing design guidelines, standards, and best practices7. Maintaining the appearance of websites by enforcing content standards8. Designing visual imagery for websites and ensuring that they are in line with branding for clients9. Working with different content management systems10. Incorporating functionalities and features into websites11. Designing sample pages including colors and fonts12. Preparing design plans and presenting the website structure13. Cooperating with web designers to match visual design intentSkill RequiredBootstrapCSSHTMLjQuerySpring MVCJob Types: Full-time, Regular / Permanent, FresherSalary: Up to ₹15,000.00 per monthBenefits:Flexible scheduleSchedule:Flexible shiftMorning shiftSupplemental Pay:Performance bonusYearly bonusAbility to commute/relocate:NCR, Delhi: Reliably commute or planning to relocate before starting work (Preferred)Experience:total work: 1 year (Preferred)Web development: 1 year (Preferred)Application Deadline: 20/08/2022 1.Write, modify, and debug web applications using JavaScript, HTML5, and CSS3 & JQuery (must)2. Design, code, and manage automated test scripts, continuous builds, and deployment3. Develop new features, enhance existing features, and implement bug fixes in existing code4. Conceptualising creative ideas with clients5. Testing and improving the design of the website6. Establishing design guidelines, standards, and best practices7. Maintaining the appearance of websites by enforcing content standards8. Designing visual imagery for websites and ensuring that they are in line with branding for clients9. Working with different content management systems10. Incorporating functionalities and features into websites11. Designing sample pages including colors and fonts12. Preparing design plans and presenting the website structure13. Cooperating with web designers to match visual design intentSkill RequiredBootstrapCSSHTMLjQuerySpring MVCJob Types: Full-time, Regular / Permanent, FresherSalary: Up to ₹15,000.00 per monthBenefits:Flexible scheduleSchedule:Flexible shiftMorning shiftSupplemental Pay:Performance bonusYearly bonusAbility to commute/relocate:NCR, Delhi: Reliably commute or planning to relocate before starting work (Preferred)Experience:total work: 1 year (Preferred)Web development: 1 year (Preferred)Application Deadline: 20/08/2022 Show more ","Employer Est.:₹180,000 ",https://www.glassdoor.co.in/partner/jobListing.htm?pos=228&ao=1136043&s=58&guid=00000182ace5fe3ab421c9fd174a6e92&src=GD_JOB_AD&t=SR&vt=w&ea=1&cs=1_b9520c26&cb=1660758130746&jobListingId=1008032658532&jrtk=3-0-1gamebvj0m6r9801-1gamebvjih7hj800-502e653790bebdce-,NA,NA
PUEBLO SHADES PVT. LTD,NA,frontend Html developer,Eranakulam,"frontend Html developerPUEBLO SHADES PVT. LTD.Experience : - 1-4years (minimum)Experience in frontend developer (html )Location : - ErnakulamLooking only from keralaSalary : - 20,000 -40,000Job Types: Full-time, Regular / PermanentSalary: ₹20,000.00 - ₹40,000.00 per monthSchedule:Day shiftMorning shiftSupplemental Pay:Yearly bonusExperience:HTML5: 1 year (Preferred)Speak with the employer+91 8078193699 frontend Html developerPUEBLO SHADES PVT. LTD.Experience : - 1-4years (minimum)Experience in frontend developer (html )Location : - ErnakulamLooking only from keralaSalary : - 20,000 -40,000Job Types: Full-time, Regular / PermanentSalary: ₹20,000.00 - ₹40,000.00 per monthSchedule:Day shiftMorning shiftSupplemental Pay:Yearly bonusExperience:HTML5: 1 year (Preferred)Speak with the employer+91 8078193699 Show more ","Employer Est.:₹240,000 - ₹480,000 ",https://www.glassdoor.co.in/partner/jobListing.htm?pos=221&ao=1136043&s=58&guid=00000182ace5fe3ab421c9fd174a6e92&src=GD_JOB_AD&t=SR&vt=w&ea=1&cs=1_e57d559a&cb=1660758130745&jobListingId=1008069344167&jrtk=3-0-1gamebvj0m6r9801-1gamebvjih7hj800-a8e3f8cf4498a60f-,NA,NA
Kevnit Digital Solutions Pvt Ltd,NA,Web Developer,Bangalore,"We are looking for a skilled web developer who will be responsible for developing and/or designing websites for our company. You will be working alongside a team of other developers in creating, maintaining, and updating our websites.In order for you to succeed in this role, you will need to be proficient in JavaScript, HTML, CSS, and have solid knowledge and experience in programming applications.Web Developer Responsibilities:Website and software application designing, building, or maintaining.Using scripting or authoring languages, management tools, content creation tools, applications, and digital media.Conferring with teams to resolve conflicts, prioritize needs, develop content criteria, or choose solutions.Directing or performing Website updates.Developing or validating test routines and schedules to ensure that test cases mimic external interfaces and address all browser and device types.Editing, writing, or designing Website content, and directing team members who produce content.Maintaining an understanding of the latest Web applications and programming practices through education, study, and participation in conferences, workshops, and groups.Back up files from Web sites to local directories for recovery.Identifying problems uncovered by customer feedback and testing, and correcting or referring problems to appropriate personnel for correction.Evaluating code to ensure it meets industry standards, is valid, is properly structured, and is compatible with browsers, devices, or operating systems.Determining user needs by analyzing technical requirements.Web Developer Requirements:Bachelor's degree in Web development or related field, or relevant experience.Solid knowledge and experience in programming applications.Proficient in JavaScript, HTML, CSS.Proficient in My SQL.Dedicated team player.Ability to thrive in a fast-paced environment.Solid ability in both written and verbal communication.Knowledge of programming language and technical terminology.Able to develop ideas and processes and clearly express them.High degree of independent judgment.Able to solve complex problems.Should know WordPressJob Types: Full-time, Regular / PermanentSalary: From ₹25,000.00 per monthBenefits:Health insuranceLife insuranceSchedule:Morning shiftSupplemental Pay:Performance bonusEducation:Bachelor's (Preferred)Speak with the employer+91 9606979380Expected Start Date: 01/07/2022 We are looking for a skilled web developer who will be responsible for developing and/or designing websites for our company. You will be working alongside a team of other developers in creating, maintaining, and updating our websites.In order for you to succeed in this role, you will need to be proficient in JavaScript, HTML, CSS, and have solid knowledge and experience in programming applications.Web Developer Responsibilities:Website and software application designing, building, or maintaining.Using scripting or authoring languages, management tools, content creation tools, applications, and digital media.Conferring with teams to resolve conflicts, prioritize needs, develop content criteria, or choose solutions.Directing or performing Website updates.Developing or validating test routines and schedules to ensure that test cases mimic external interfaces and address all browser and device types.Editing, writing, or designing Website content, and directing team members who produce content.Maintaining an understanding of the latest Web applications and programming practices through education, study, and participation in conferences, workshops, and groups.Back up files from Web sites to local directories for recovery.Identifying problems uncovered by customer feedback and testing, and correcting or referring problems to appropriate personnel for correction.Evaluating code to ensure it meets industry standards, is valid, is properly structured, and is compatible with browsers, devices, or operating systems.Determining user needs by analyzing technical requirements.Web Developer Requirements:Bachelor's degree in Web development or related field, or relevant experience.Solid knowledge and experience in programming applications.Proficient in JavaScript, HTML, CSS.Proficient in My SQL.Dedicated team player.Ability to thrive in a fast-paced environment.Solid ability in both written and verbal communication.Knowledge of programming language and technical terminology.Able to develop ideas and processes and clearly express them.High degree of independent judgment.Able to solve complex problems.Should know WordPressJob Types: Full-time, Regular / PermanentSalary: From ₹25,000.00 per monthBenefits:Health insuranceLife insuranceSchedule:Morning shiftSupplemental Pay:Performance bonusEducation:Bachelor's (Preferred)Speak with the employer+91 9606979380Expected Start Date: 01/07/2022 Show more ","Employer Est.:₹300,000 ",https://www.glassdoor.co.in/partner/jobListing.htm?pos=204&ao=1136043&s=58&guid=00000182ace5fe3ab421c9fd174a6e92&src=GD_JOB_AD&t=SR&vt=w&ea=1&cs=1_eeb3801b&cb=1660758130742&jobListingId=1007935029601&jrtk=3-0-1gamebvj0m6r9801-1gamebvjih7hj800-0fecd9817df1e6fe-,NA,NA
Tosh business solutions,NA,Front End Developer,Penamaluru,"tosh business solutions is an Reputed company which deals with software development, business development and marketing servicesJob Type: Full-timeSalary: From ₹300,000.00 per yearSchedule:Day shiftEvening shiftMorning shiftSupplemental Pay:Overtime payAbility to commute/relocate:Poranki, penamaluru , Penamaluru - 521137, Andhra Pradesh: Reliably commute or planning to relocate before starting work (Required)Education:Bachelor's (Preferred)Expected Start Date: 20/08/2022 tosh business solutions is an Reputed company which deals with software development, business development and marketing servicesJob Type: Full-timeSalary: From ₹300,000.00 per yearSchedule:Day shiftEvening shiftMorning shiftSupplemental Pay:Overtime payAbility to commute/relocate:Poranki, penamaluru , Penamaluru - 521137, Andhra Pradesh: Reliably commute or planning to relocate before starting work (Required)Education:Bachelor's (Preferred)Expected Start Date: 20/08/2022 Show more ","Employer Est.:₹300,000 ",https://www.glassdoor.co.in/partner/jobListing.htm?pos=202&ao=1136043&s=58&guid=00000182ace5fe3ab421c9fd174a6e92&src=GD_JOB_AD&t=SR&vt=w&ea=1&cs=1_c9dced57&cb=1660758130741&jobListingId=1008069728453&jrtk=3-0-1gamebvj0m6r9801-1gamebvjih7hj800-ea95984b21b4e127-,NA,NA
Helios Tech Labs,NA,Web Developer,Sahibzada Ajit Singh Nagar,"At Helios, we are looking for Web Developers who are dedicated to the craft, write code that they are proud of, and can hit the ground running.Highlights: 25% Hike on existing salary5 Day Work-weekLively Work EnvironmentMonthly Awards & RecognitionTeam Lunch & Dinner PartiesResponsibilities:Understand the scope of workYou will be working on exciting Web development, Mobile app development, Ecommerce development, and the latest trending technologies.Contribute to all phases of the product development life cycle.Write well-designed, testable, efficient code.Ensure designs are in compliance with specifications.Work closely with other developers, designers, and support representatives to manage and enhance the applications.Experience: Minimum 1 year of Web Development ExpSkills: Knowledge of any of the following languagesJavaScriptJavaHTMLCSSReactAngularObjective CScalaPythonC#C++PHPPerlJob Types: Full-time, Regular / PermanentSalary: ₹25,000.00 - ₹45,000.00 per monthBenefits:Health insurancePaid sick timeProvident FundSchedule:Day shiftApplication Question(s):Will you be able to reliably commute or relocate to Mohali (Phase 8 Industrial Area)Experience:Web development: 1 year (Preferred)Expected Start Date: 23/08/2022 At Helios, we are looking for Web Developers who are dedicated to the craft, write code that they are proud of, and can hit the ground running.Highlights: 25% Hike on existing salary5 Day Work-weekLively Work EnvironmentMonthly Awards & RecognitionTeam Lunch & Dinner PartiesResponsibilities:Understand the scope of workYou will be working on exciting Web development, Mobile app development, Ecommerce development, and the latest trending technologies.Contribute to all phases of the product development life cycle.Write well-designed, testable, efficient code.Ensure designs are in compliance with specifications.Work closely with other developers, designers, and support representatives to manage and enhance the applications.Experience: Minimum 1 year of Web Development ExpSkills: Knowledge of any of the following languagesJavaScriptJavaHTMLCSSReactAngularObjective CScalaPythonC#C++PHPPerlJob Types: Full-time, Regular / PermanentSalary: ₹25,000.00 - ₹45,000.00 per monthBenefits:Health insurancePaid sick timeProvident FundSchedule:Day shiftApplication Question(s):Will you be able to reliably commute or relocate to Mohali (Phase 8 Industrial Area)Experience:Web development: 1 year (Preferred)Expected Start Date: 23/08/2022 Show more ","Employer Est.:₹300,000 - ₹540,000 ",https://www.glassdoor.co.in/partner/jobListing.htm?pos=219&ao=1136043&s=58&guid=00000182ace5fe3ab421c9fd174a6e92&src=GD_JOB_AD&t=SR&vt=w&ea=1&cs=1_ca7f5be6&cb=1660758130745&jobListingId=1008075398601&jrtk=3-0-1gamebvj0m6r9801-1gamebvjih7hj800-2bfcc3411398bc1e-,NA,NA
ABS Technologies,NA,Web Developer,Guwahati,"PHP, JavaScript, C++ Knowledge RequiredJob Type: Full-timeSalary: ₹20,000.00 - ₹40,000.00 per monthSchedule:Morning shiftAbility to commute/relocate:Guwahati, Assam: Reliably commute or planning to relocate before starting work (Required)Education:Bachelor's (Preferred) PHP, JavaScript, C++ Knowledge RequiredJob Type: Full-timeSalary: ₹20,000.00 - ₹40,000.00 per monthSchedule:Morning shiftAbility to commute/relocate:Guwahati, Assam: Reliably commute or planning to relocate before starting work (Required)Education:Bachelor's (Preferred) Show more ","Employer Est.:₹240,000 - ₹480,000 ",https://www.glassdoor.co.in/partner/jobListing.htm?pos=212&ao=1136043&s=58&guid=00000182ace5fe3ab421c9fd174a6e92&src=GD_JOB_AD&t=SR&vt=w&ea=1&cs=1_b3ae9002&cb=1660758130742&jobListingId=1008056930446&jrtk=3-0-1gamebvj0m6r9801-1gamebvjih7hj800-ce27e6a98bb8f909-,"Paris, France",Unknown
Elementik Technologies Pvt Ltd,NA,Front End Developer,Pune,"We are looking for a qualified Front-end developer to join our IT team. You will be responsible for building the ‘client-side’ of our web applications. You should be able to translate our company and customer needs into functional and appealing interactive applications.If you’re interested in creating a user-friendly environment by writing code and moving forward in your career, then this job is for you. We expect you to be a tech-savvy professional, who is curious about new digital technologies and aspires to combine usability with visual design.Ultimately, you should be able to create a functional and attractive digital environment for our company, ensuring great user experience.ResponsibilitiesUse markup languages like HTML to create user-friendly web pagesMaintain and improve websiteOptimize applications for maximum speedDesign mobile-based featuresCollaborate with back-end developers and web designers to improve usabilityGet feedback from, and build solutions for, users and customersWrite functional requirement documents and guidesCreate quality mockups and prototypesHelp back-end developers with coding and troubleshootingEnsure high quality graphic standards and brand consistencyStay up-to-date on emerging technologiesSkills and requirementsProven work experience as a Front-end developerHands on experience with markup languagesExperience with JavaScript, CSS and jQueryFamiliarity with browser testing and debuggingIn-depth understanding of the entire web development process (design, development and deployment)Understanding of layout aestheticsKnowledge of SEO principlesFamiliarity with software like Adobe Suite, Photoshop and content management systemsAn ability to perform well in a fast-paced environmentExcellent analytical and multitasking skillsBSc degree in Computer Science or relevant fieldJob Type: Full-timeSalary: ₹25,000.00 - ₹35,000.00 per monthSchedule:Day shiftApplication Question(s):Have you gone through the JD?How many years of experience do you have as a frontend developer?How many years of experience in using skills like HTML, Javacript, Jquery, CSS?what is your current ctc?what is your expected ctc?What is your notice period?Do you have experience in react js? We are looking for a qualified Front-end developer to join our IT team. You will be responsible for building the ‘client-side’ of our web applications. You should be able to translate our company and customer needs into functional and appealing interactive applications.If you’re interested in creating a user-friendly environment by writing code and moving forward in your career, then this job is for you. We expect you to be a tech-savvy professional, who is curious about new digital technologies and aspires to combine usability with visual design.Ultimately, you should be able to create a functional and attractive digital environment for our company, ensuring great user experience.ResponsibilitiesUse markup languages like HTML to create user-friendly web pagesMaintain and improve websiteOptimize applications for maximum speedDesign mobile-based featuresCollaborate with back-end developers and web designers to improve usabilityGet feedback from, and build solutions for, users and customersWrite functional requirement documents and guidesCreate quality mockups and prototypesHelp back-end developers with coding and troubleshootingEnsure high quality graphic standards and brand consistencyStay up-to-date on emerging technologiesSkills and requirementsProven work experience as a Front-end developerHands on experience with markup languagesExperience with JavaScript, CSS and jQueryFamiliarity with browser testing and debuggingIn-depth understanding of the entire web development process (design, development and deployment)Understanding of layout aestheticsKnowledge of SEO principlesFamiliarity with software like Adobe Suite, Photoshop and content management systemsAn ability to perform well in a fast-paced environmentExcellent analytical and multitasking skillsBSc degree in Computer Science or relevant fieldJob Type: Full-timeSalary: ₹25,000.00 - ₹35,000.00 per monthSchedule:Day shiftApplication Question(s):Have you gone through the JD?How many years of experience do you have as a frontend developer?How many years of experience in using skills like HTML, Javacript, Jquery, CSS?what is your current ctc?what is your expected ctc?What is your notice period?Do you have experience in react js? Show more ","Employer Est.:₹300,000 - ₹420,000 ",https://www.glassdoor.co.in/partner/jobListing.htm?pos=220&ao=1136043&s=58&guid=00000182ace5fe3ab421c9fd174a6e92&src=GD_JOB_AD&t=SR&vt=w&ea=1&cs=1_3a80fb66&cb=1660758130745&jobListingId=1008065472849&jrtk=3-0-1gamebvj0m6r9801-1gamebvjih7hj800-322f1505c7b7be07-,NA,NA
Cherri Technologies,5.0,Web Developer,Puducherry,"Skills Required:-Experienced Candidates only (1 to 2 Years)-PHP, WordPress, Code-Igniter, Bootstrap, HTML, CSS, Javascript, jQuery, MySQL, AJAX.Job Type: Full-timeSalary: ₹30,000.00 - ₹50,000.00 per monthSchedule:Day shiftEducation:Bachelor's (Preferred)Experience:CSS: 1 year (Preferred)total work: 1 year (Preferred)HTML5: 1 year (Preferred)Speak with the employer+91 9600888106 Skills Required:-Experienced Candidates only (1 to 2 Years)-PHP, WordPress, Code-Igniter, Bootstrap, HTML, CSS, Javascript, jQuery, MySQL, AJAX.Job Type: Full-timeSalary: ₹30,000.00 - ₹50,000.00 per monthSchedule:Day shiftEducation:Bachelor's (Preferred)Experience:CSS: 1 year (Preferred)total work: 1 year (Preferred)HTML5: 1 year (Preferred)Speak with the employer+91 9600888106 Show more ","Employer Est.:₹360,000 - ₹600,000 ",https://www.glassdoor.co.in/partner/jobListing.htm?pos=208&ao=1136043&s=58&guid=00000182ace5fe3ab421c9fd174a6e92&src=GD_JOB_AD&t=SR&vt=w&ea=1&cs=1_6978d333&cb=1660758130742&jobListingId=1008073275113&jrtk=3-0-1gamebvj0m6r9801-1gamebvjih7hj800-6d3680fe3f3ccc50-,"Puducherry, India",1 to 50 Employees
Maco Infotech LTD,3.5,Web Developer,Patel Nagar,"Maintain working relationships with existing clients to ensure exceptional service and identification of potential new sales opportunitiesIdentify appropriate prospects, set appointments, make effective qualifying sales calls, and manage sales cycle to close new business in all service categories offeredPossess in-depth services knowledge and be able to conduct demos and relay objection handlingPrepare professional, complete, concise and accurate reports, proposals, booking packages, and other documentation as required for executive-level presentationsAchieve sales goals by assessing current client needs and following an defined selling process with potential buyers, often utilizing product demos and presentationsCoordinate with other sales reps to ensure company quotas and standards are being met, performing market research and regular competitor monitoringJob Type: Full-timeSalary: ₹15,000.00 - ₹40,000.00 per monthSchedule:Morning shiftSpeak with the employer+91 9667222334 Maintain working relationships with existing clients to ensure exceptional service and identification of potential new sales opportunitiesIdentify appropriate prospects, set appointments, make effective qualifying sales calls, and manage sales cycle to close new business in all service categories offeredPossess in-depth services knowledge and be able to conduct demos and relay objection handlingPrepare professional, complete, concise and accurate reports, proposals, booking packages, and other documentation as required for executive-level presentationsAchieve sales goals by assessing current client needs and following an defined selling process with potential buyers, often utilizing product demos and presentationsCoordinate with other sales reps to ensure company quotas and standards are being met, performing market research and regular competitor monitoringJob Type: Full-timeSalary: ₹15,000.00 - ₹40,000.00 per monthSchedule:Morning shiftSpeak with the employer+91 9667222334 Show more ","Employer Est.:₹180,000 - ₹480,000 ",https://www.glassdoor.co.in/partner/jobListing.htm?pos=210&ao=1136043&s=58&guid=00000182ace5fe3ab421c9fd174a6e92&src=GD_JOB_AD&t=SR&vt=w&ea=1&cs=1_d80feea2&cb=1660758130742&jobListingId=1008032825382&jrtk=3-0-1gamebvj0m6r9801-1gamebvjih7hj800-2eb447df27d76d58-,"Nagar, India",51 to 200 Employees
Travel Business Pvt. Ltd.,NA,PHP Web Developer,Bokāro,"- Design, estimate, and code new features. This is primarily a coding position.- Participate in software design discussions, sprint planning and other project management meetings- Excellent fundamental knowledge of PHP, MySQL, Bootstrap, HTML 5, JQuery- Good command over MySQL development with complex queries, DB schema design & Performance tuning- Wider experience on all phases of SDLC for system developments- Good analytical and troubleshooting skills to resolve Production issues- Good verbal written communication skillsLinux's environment skills a big plusExperience of working on enterprise systems would be a plusExperience of working on Payroll Finance domain would be a plusMust be a good team player as well as capable of working standalone with the least supervision as per situation demandsJob Types: Full-time, Regular / PermanentSalary: ₹10,000.00 - ₹25,000.00 per monthBenefits:Cell phone reimbursementHealth insuranceSchedule:Day shiftSupplemental Pay:Overtime payEducation:Diploma (Preferred)License/Certification:PHP (Preferred)Speak with the employer+91 7488130556 - Design, estimate, and code new features. This is primarily a coding position.- Participate in software design discussions, sprint planning and other project management meetings- Excellent fundamental knowledge of PHP, MySQL, Bootstrap, HTML 5, JQuery- Good command over MySQL development with complex queries, DB schema design & Performance tuning- Wider experience on all phases of SDLC for system developments- Good analytical and troubleshooting skills to resolve Production issues- Good verbal written communication skillsLinux's environment skills a big plusExperience of working on enterprise systems would be a plusExperience of working on Payroll Finance domain would be a plusMust be a good team player as well as capable of working standalone with the least supervision as per situation demandsJob Types: Full-time, Regular / PermanentSalary: ₹10,000.00 - ₹25,000.00 per monthBenefits:Cell phone reimbursementHealth insuranceSchedule:Day shiftSupplemental Pay:Overtime payEducation:Diploma (Preferred)License/Certification:PHP (Preferred)Speak with the employer+91 7488130556 Show more ","Employer Est.:₹120,000 - ₹300,000 ",https://www.glassdoor.co.in/partner/jobListing.htm?pos=213&ao=1136043&s=58&guid=00000182ace5fe3ab421c9fd174a6e92&src=GD_JOB_AD&t=SR&vt=w&ea=1&cs=1_8d373a45&cb=1660758130742&jobListingId=1008075081300&jrtk=3-0-1gamebvj0m6r9801-1gamebvjih7hj800-2b8fcbe8309798d3-,NA,NA
